id,title,selftext,score,num_comments,author,created_utc,url,gilded,subreddit
kgu4lq,How exactly Hadoop is used in real life?,"Hello, I read a lot of articles about how Hadoop is used by companies, [one link](https://medium.com/@suchitmajumdar/how-twitter-facebook-ny-times-use-hadoop-782b5d8940cf), but I wonder how it is used under the hood. I understand that Hadoop is something like storage for log analytics (?) etc, but how these logs are formatted (is it JSON, CSV, any binary files)? Are they split when they reach certain size?  How is it different from Elastic Search that also stores logs and enables free text search? Maybe Hadoop is used by other frameworks like Apache Hive?

&#x200B;

I am new to this topic and this is why I ask for clarification. Could you provide some example open-source project that uses Hadoop so that I can analyze its source code?

&#x200B;

Thank you :)",23,17,h3wro,2020-12-20 13:38:21,https://www.reddit.com/r/bigdata/comments/kgu4lq/how_exactly_hadoop_is_used_in_real_life/,0,bigdata
jzkec3,Kafka IDE is released as Open Beta today! 🎉,"[Kafka IDE](https://kafkaide.com/?utm_source=Reddit&utm_medium=social&utm_campaign=open-beta&utm_term=bigdata) is a desktop client similar to Tableau or Looker that queries Apache Kafka directly. It aims to be a better alternative to kafkacat, kafka manager or similar.

You can query particular time windows using offsets (you can use natural language to specify dates) as well as smart schema inference for those folks who deal with plain JSON messages.

It also let you peek into some Apache Kafka specific configurations for your cluster and topics.

Let us know if you find it useful or if you encounter any issue while trying it out! You can leave your comment here or send us an email at [team@kafkaide.com](mailto:team@kafkaide.com).",22,4,kafkaide-com,2020-11-23 16:07:22,https://www.reddit.com/r/bigdata/comments/jzkec3/kafka_ide_is_released_as_open_beta_today/,0,bigdata
irxuvs,"The versatility of ROW_NUMBER, one of SQL’s greatest function",,23,2,linkerzx,2020-09-13 13:01:30,https://medium.com/analytics-and-data/the-versatility-of-row-number-one-of-sqls-greatest-functions-53ec78e74096,0,bigdata
ed74xx,How to Use Airflow without Headaches,,21,1,None,2019-12-20 07:57:06,https://towardsdatascience.com/how-to-use-airflow-without-headaches-4e6e37e6c2bc,0,bigdata
cie0ry,Introducing Spark-Kafka integration for realtime Kafka SQL queries,,22,0,allwefantasy,2019-07-27 06:12:46,https://medium.com/@williamsmith_74955/introducing-spark-kafka-integration-for-realtime-kafka-sql-queries-a54e051a79cb,0,bigdata
ccvfu9,AI smokes 5 poker champs at a time in no-limit Hold’em with ‘ruthless consistency’,,22,0,craigbrownphd,2019-07-13 22:31:45,https://www.reddit.com/r/DataIntelligence/comments/cc4vf4/ai_smokes_5_poker_champs_at_a_time_in_nolimit/,0,bigdata
bvklv6,41 hours free course for big data hadoop with spark,"Direct [link here](https://www.udemy.com/big-data-harish/?couponCode=HARISH)

more big data free courses are collected [here](https://www.real.discount/search-page/?keyword=big+data)",22,0,saadmerie,2019-06-01 13:07:13,https://www.reddit.com/r/bigdata/comments/bvklv6/41_hours_free_course_for_big_data_hadoop_with/,0,bigdata
arjyvg,For all the SQL enthusiasts out there. SQL is a language which is becoming a pre-requisite for people who want a good career in data science. This tutorial contains all the topics to give you a brief about this language.,"https://www.youtube.com/playlist?list=PLVHgQku8Z936E51WaMbEHML6LutrGCSYr
",20,5,yashica_,2019-02-17 12:02:37,https://www.reddit.com/r/bigdata/comments/arjyvg/for_all_the_sql_enthusiasts_out_there_sql_is_a/,0,bigdata
a1jf1b,Useful resource bundle,I got [this](https://twitter.com/skjfhsjfldnlvcb/status/1067806126635331584) and realized others may want to get it too. I grabbed the 3rd tier but lower tiers are also valuable too in my opinion.,21,1,Oldmajenkins,2018-11-29 17:32:00,https://www.reddit.com/r/bigdata/comments/a1jf1b/useful_resource_bundle/,0,bigdata
9oxb7t,"Here are some awesome video's I found on YouTube related to Big Data and Hadoop, hope it helps anyone who is interested in learning it.",,22,5,sa-shahzan,2018-10-17 10:09:43,https://www.youtube.com/playlist?list=PLr0GuAb3MR-wEDZwetSvzvc-CKVSGruhq,0,bigdata
989mw7,Why Big Data is in Trouble: They Forgot About Applied Statistics,,24,1,IamArchit,2018-08-18 06:21:46,https://www.kdnuggets.com/2016/07/big-data-trouble-forgot-applied-statistics.html,0,bigdata
9401id,Things you should know when working as a Big Data Engineer,,21,1,Krever,2018-08-02 15:04:54,https://w.pitula.me/2018/data-engineer-must-know/,0,bigdata
86kn6g,Top 9 Data Science Use Cases in Banking,,22,0,viktoriia_shulga,2018-03-23 13:32:54,https://www.activewizards.com/blog/top-9-data-science-use-cases-in-banking/?utm_source=reddit&utm_medium=bigdata&utm_campaign=banking,0,bigdata
5vbc25,How I Cracked 11 Big Data Interviews. Hadoop & Spark Interview Experience & Questions,,20,2,anishp1313,2017-02-21 12:58:15,https://youtu.be/BuREt8e3_ok,0,bigdata
5rnmvc,The Data That Turned the World Upside Down,,23,2,BigLeafLittleRainbow,2017-02-02 16:11:38,https://motherboard.vice.com/en_us/article/how-our-likes-helped-trump-win,0,bigdata
5ra52h,Learn data science: 44 essential resources for developers,,22,0,piedpiperpivot,2017-01-31 18:53:18,https://techbeacon.com/learn-data-science-44-essential-resources-developers,0,bigdata
5jxucs,"More data will be created in 2017 than the previous 5,000 years of humanity",,22,4,AppDeveloperMagazine,2016-12-23 16:14:14,"https://appdevelopermagazine.com/4773/2016/12/23/More-data-will-be-created-in-2017-than-the-previous-5,000-years-of-humanity-/",0,bigdata
5h54ff,Data Engineering at Slack,,23,0,dianamp,2016-12-08 05:11:13,https://slack.engineering/data-wrangling-at-slack-f2e0ff633b69#.wbdaxmvg4,0,bigdata
4jyb6p,We are Giving Away Global Maritime Vessel Traffic Data For One Year,"Over the last two years, we have been designing, building, and testing a payload to be flown to the International Space Station. Our project is called GLobal AIS on Space Station (GLASS). Here are some details:

* The purpose of the GLASS project is to track maritime vessel traffic worldwide from the International Space Station.
* Most vessels over 300 gross tons must transmit an [Automatic Identification Signal \(AIS\)](https://en.wikipedia.org/wiki/Automatic_Identification_System), which is detectable from space.
* We are looking for evaluators to participate in a one-year applied research initiative. 
* We are specifically looking to work with businesses, government organizations, and academic researchers and institutions.
* The hardware is complete, and will launch on a SpaceX vehicle this summer.
* When the hardware is installed, checked out, and operational, we will begin offering the data to evaluators.
* After the one-year evaluation period is over, we intend to commercialize the platform.


Anyone interested in participating in the project should visit [our website](http://www.jamssamerica.com/glass-overview/) for details. Thanks!",21,8,houstonspace,2016-05-18 19:00:35,https://www.reddit.com/r/bigdata/comments/4jyb6p/we_are_giving_away_global_maritime_vessel_traffic/,0,bigdata
3zfnra,Announcing Spark 1.6,,21,0,AccidentalComplexity,2016-01-04 17:21:25,https://databricks.com/blog/2016/01/04/announcing-spark-1-6.html,0,bigdata
2o06ac,"Big data is all blue, shiny, and full of 0s and 1s. A tumblr collection.",,21,2,fhoffa,2014-12-02 02:22:37,http://bigdatapix.tumblr.com/,0,bigdata
2benif,Awesome Big Data: GitHub List,,23,1,ilikebigdata,2014-07-22 16:25:08,https://github.com/onurakpolat/awesome-bigdata,0,bigdata
wppu8n,"A Python Library to OCR, Archive, Index and Search any documents with ease","Hey there, 

We wanted to share a library that we've been working on for a while. It's called [`OcrPy`](https://github.com/maxent-ai/ocrpy) - a Python library for doing OCR++. 

At its core the library aims to unify a multitude of OCR systems (commercial & open-source) and provides a consistent and unified interface, along with a lot of additional functionalities that are usually really useful in practice - such as identifying the type of documents, the different types of layout's they come in, etc and in turn processing them in different approaches.

Once you parse these docs, it also lets you index and enables searching over these collections via semantic search. 

with that said, here are the links to the python library, documentation & tutorials.

1. Github: https://github.com/maxent-ai/ocrpy
2. Documentation: https://maxentlabs.com/ocrpy
3. Tutorial: https://maxentlabs.com/ocrpy/examples

Tl;dr of the library:

![](https://maxentlabs.com/ocrpy/_images/ocrpy-workflow.png)

- It supports various types of ocr cloud backends like AWS-textract, google-cloud-vision, azure-document-recognition, etc & open-source OCR backends like - tesseract. 
- It supports async processing of docs on various kinds of cloud storage like s3, GCS, azure storage, etc.
- Due to the abstraction of various types of these cloud/open-source OCR parser backends & storage backends - if required you can just switch from one ocr vendor to the other without any changes to the codebase or the output formats.
- You can also index and search over the parsed docs - currently we support indexing it to Elastisearch and OpenSearch backends. 
- In case you are interested in processing different types of docs with different types of parsers you can automatically identify the type of the doc and then use the appropriate parser (or write your own custom parser) - this is useful if you want to for instance use some deep learning model for handwritten docs or say table extraction etc.. vs using off-the-shelf OCR for regular docs. 
- Document type classification and layout parsing within the docs is built on top of Huggingface transformers - as such you can easily swap out and play with different types of models or add your own custom models into the pipeline as well.",21,1,xen-m-rph,2022-08-16 09:33:10,https://www.reddit.com/r/bigdata/comments/wppu8n/a_python_library_to_ocr_archive_index_and_search/,0,bigdata
v3l8a1,"What if AB testing is impossible to setup? I wrote a blog to measure impact using backdoor adjustment, a type of causal analysis","To ensure that every feature has a measurable impact on the broader platform my team will set up and run A/B testing on each new feature or product change, but what happens when a new feature needs to be released quickly and there is not enough time for a traditional testing approach? To make sure that these quick changes could still be measured I found a way to perform accurate pre-post analysis using a back-door adjustment of causal analysis. I wanted to share my findings with the community as it was able to help my team at DoorDash make quick bug fixes and still be able to measure the impact. Please check out the article to get the technical details and provide any feedback on my approach. [https://doordash.engineering/2022/06/02/using-back-door-adjustment-causal-analysis-to-measure-pre-post-effects/](https://doordash.engineering/2022/06/02/using-back-door-adjustment-causal-analysis-to-measure-pre-post-effects/)",21,0,tripleespresso7,2022-06-02 22:55:04,https://www.reddit.com/r/bigdata/comments/v3l8a1/what_if_ab_testing_is_impossible_to_setup_i_wrote/,0,bigdata
u4rygq,"LinkedIn Open-Sources ‘Feathr’, It’s Feature Store To Simplify Machine Learning (ML) Feature Management And Improve Developer Productivity","LinkedIn research team has recently open-sourced feature store, [Feathr](https://github.com/linkedin/feathr), created to simplify machine learning (ML) feature management and increase developer productivity. Feathr is used by dozens of LinkedIn applications to define features, compute them for training, deploy them in production, and share them across consumers. Compared to previous application-specific feature pipeline solutions, Feathr users reported significantly reduced time required to add new features to model training and improved runtime performance.

Hundreds of ML models run on LinkedIn in Search, Feed, and Ads applications. Thousands of features about entities in the Economic Graph, such as companies, job postings, and LinkedIn members, power the models. The most time-consuming aspects of handling the ML applications at scale have been preparing and managing features.

[Continue reading the summary](https://www.marktechpost.com/2022/04/15/linkedin-open-sources-feathr-its-feature-store-to-simplify-machine-learning-ml-feature-management-and-improve-developer-productivity/)

Github: https://github.com/linkedin/feathr

LinkedIn Blog: https://engineering.linkedin.com/blog/2022/open-sourcing-feathr—linkedin-s-feature-store-for-productive-m",21,0,No_Coffee_4638,2022-04-16 06:45:26,https://www.reddit.com/r/bigdata/comments/u4rygq/linkedin_opensources_feathr_its_feature_store_to/,0,bigdata
qn2oo2,"70 billion rows, which dbms to choose?","I need to train a model on tensorflow with 70 billion entries, and also I need to be capable of reading (no update necessary) those rows swiftly. Which dbms should I choose? I'm open to both SQL and NoSQL.",20,18,Ded-Smoke,2021-11-05 03:53:45,https://www.reddit.com/r/bigdata/comments/qn2oo2/70_billion_rows_which_dbms_to_choose/,0,bigdata
i5gld8,4 SQL Tips For Data Scientists And Data Analysts,,20,0,nonkeymn,2020-08-07 16:08:51,https://www.youtube.com/watch?v=kSt9NV-qZkc,0,bigdata
hf3map,Redash has been acquired by Databricks,,21,2,WesleyBatista,2020-06-24 16:02:09,https://databricks.com/blog/2020/06/24/welcoming-redash-to-databricks.html,0,bigdata
epmhdo,The Greatest Hedge Fund of All Time,"Renaissance Technologies is the Greatest Hedge Fund of All Time.

Founded by math genius Jim Simons, it's flagship fund Medallion has an average gross return of 66.1% since 1988.

With an average net return of 39.1% after fees.

The Medallion Fund is available only to current and past employees and their families, closing to outside investors in 1993.

Since, 1988, the Medallion Fund has racked up trading profits of more than $100 billion.

Now, I mentioned a net return of 39.1% after fees: well, the fees have been greater than the usual '2 and 20' structure (which means a 2% management fee and a 20% performance fee).

Medallion has had a 5% management fee, and from 1988 to 2001, a 20% performance fee and from 2002 until now, a 44% performance fee.

Notice in particular the return in 2007 and 2008, a time when many were completely REKT.

In 2008, a return (after these monstrous fees) of 82.4%

**To make us all feel terrible, if you had invested $1000 into Medallion in 1988 you would have today, after fees, around $23MM**.

That certainly beats inflation...

So, how did they do it and what can we take away from this story (aside from searing jealousy)?

&#x200B;

**PART 1: The Early Stages**

Early on, Simons had a goal of algorithmic investing.

Remember, this was the late 1980s before the phrase big data became a household name and most investment decisions were made over the phone based on gut with the likes of Jordan Belfort trying to scam you!

“I don’t want to have to worry about the market every minute. I want models that will make money while I sleep,” Simons said. “A pure system without humans interfering.”

Simons hired Sandor Straus to help him collect historic commodity information

Straus’ was essential to Renaissance Technologies early success in commodities trading.

He became somewhat of a data guru ensuring pricing was consistent and accurate, checking his numbers matched with yearbook data provided by commodity exchanges, Wall Street Journal, other newspapers and anything else he could get his hands on.

Over time, Straus and his colleagues discovered additional historical pricing data, helping the development of new predictive models.

In fact, some of the stock market data they'd later find went back as far as the 1800s!

At the time, the team couldn't do much with the data, BUT the ability to search modern history to see how markets reacted to unusual events would later help Simon's team build models to profit from market collapses and so called 'Black Swan events'.

The return in 2008 is a prime example of that.

Commodity markets were relatively simple and RenTec found success in deploying simple trading strategies.

The fund wasn't bothered as to why these trading patterns existed - the only thing that mattered is that they occurred in a predictable and actionable way.

&#x200B;

**PART 2: Intellectual Capital**

Now in order to build these quantitative models, RenTec is composed of mathematicians and physicists of the highest order and it has even been described as the ""best math department in the world"".

Therefore, their quantitative researchers are well aware of the problems with data mining, over-fitting and spurious signals.

We are taking A LOT of data: 9TB per day in fact.

RenTec originally focussed on trading commodities, currencies and futures.

The strategies were mainly trending (i.e. price will continue to move in same direction) and mean reversion (i.e. price will return to original value).

Simons was experimenting in the stock market (equities) since the late 1980s but the strategy that had worked well on futures was not working on equities.

In 1995, David Magerman, an early employee, spotted a line of simulation code used for the equity trading system showing the S&P 500 at an unusually low level.

This test code appeared to use a figure from back in 1991 that was roughly half the current number.

It had been written as a static figure, rather than as a variable that updated with each move in the market.

Magerman also spotted an algebraic error elsewhere in the code.

Finally, the simulator’s algorithms could finally recommend an ideal portfolio for the trading system to execute.

The resulting portfolio seemed to generate big profits, at least according to Magerman’s calculations.

Only then did Renaissance commit significant capital into the equity markets, and since then...well, pretty good....

&#x200B;

**PART 3: Infrastructure**

Now I mentioned before about the sheer amount of data RenTec is utilising.

Big data has obviously caught on, but many hedge funds continue to under-perform the market and even some hedge funds focussed on quant methods haven't fared too well.

The problem, and one of the reasons RenTec is so special, is the barrier to entry is so incredibly high:

Building a data pipeline and the infrastructure required to process that data is no trivial matter.

To then get profitable trading signals from that processed data is a mammoth task.

RenTec has been in the game for over 30 years, constantly refining their algorithms and improving the efficiency of their data processing pipeline.

They have completely automated the process of signal discovery:

They don't hire researchers to manually derive novel insights or trading models from data, and they don't really bother with exclusive sources of data. Instead, they hire researchers to improve methods for automatically processing vast amounts of arbitrary data and extracting profitable trading signals from it.

RenTec has automated the data processing and feature extraction pipeline end to end.

The data is a pure abstraction to them. They don't bother with forming hypotheses and trying to find data to test them, they allow their algorithms to actively discover new correlations from the ground up. So many quantitative funds advertise how much data they work with, and how they have all these exotic sources of data at their disposal - but the data does not matter. The models for the data do not matter.

The mathematics of *efficiently processing* that data are what matters.

&#x200B;

**CONCLUSION:**

**The takeaway from this is the following: do not day trade, you will get REKT.**

**You are competing with immense infrastructure and intellectual capital of the highest level.**

[https://www.youtube.com/watch?v=jcy8QaILDJI](https://www.youtube.com/watch?v=jcy8QaILDJI)

&#x200B;

BRAVE BROWSER: [https://brave.com/fin894](https://brave.com/fin894)",20,7,financeoptimum,2020-01-16 17:29:13,https://www.reddit.com/r/bigdata/comments/epmhdo/the_greatest_hedge_fund_of_all_time/,0,bigdata
923w2x,I still don't understand why Spark is so popular as a ETL solution. Could someone explain why Spark is so commonly chosen?,"I understand that Spark is good for streaming and ML. But with regards to *just* ETL tools/solutions, why should I choose Spark over a typical ETL solution or using a database to process the data? 

For maybe more context, let's say we're doing batch processing every day on no more than 10 GB of data. I've seen companies go for Spark in this scenario, which boggles my mind. What's likely the reasoning here? 

If the incoming data was much much larger at say 1 TB/day, would Spark be the preferred solution, generally speaking?

How much does the ability to use the streaming and ML packages play into decisions to use Spark? If a team wants to also do ML, I'm guessing having that ability on top of a data set is pretty convenient, so Spark is ideal? 

To be honest, as someone still learning its inner workings and coming from a traditional ETL developer background, I just don't understand the hype around Spark. ",20,15,iarcfsil,2018-07-26 16:43:17,https://www.reddit.com/r/bigdata/comments/923w2x/i_still_dont_understand_why_spark_is_so_popular/,0,bigdata
8r3f5f,Metacat: Making Big Data Discoverable and Meaningful at Netflix,,22,0,mfrw1,2018-06-14 16:53:08,https://medium.com/netflix-techblog/metacat-making-big-data-discoverable-and-meaningful-at-netflix-56fb36a53520,0,bigdata
83kyxs,Data Science vs. Data Analysis: What's the Difference?,,21,0,suthukrish,2018-03-11 05:50:00,https://dzone.com/articles/data-science-vs-data-analysis-whats-the-difference,0,bigdata
82xplv,"Could we talk about low effort posts, particularly links to articles?","I could be in the minority, in which case feel free to downvote this to oblivion. However, this sub is filled with low effort links to articles with no input by the poster, no discussion, and many are clearly bots.

I think this drives off potential subscribers that want to actually discuss big data technology, and not read ten articles on “the next big thing”.

What do you think? Do you enjoy the current state of the sub? What are other subs doing to prevent these low effort posts? I’d love to get some opinions.",22,11,brantaylor,2018-03-08 14:07:28,https://www.reddit.com/r/bigdata/comments/82xplv/could_we_talk_about_low_effort_posts_particularly/,0,bigdata
7sxqkb,"[video] Engineers from Reddit, Thumbtack, Tapjoy, Twitter and Google Cloud discuss big data engineering",,21,1,fhoffa,2018-01-25 17:34:43,https://www.youtube.com/watch?v=2AIO0szCfXg,1,bigdata
7cltq3,1.1 Billion Taxi Trips on BrytlytDB 2.0,,20,3,marklit,2017-11-13 08:34:43,http://tech.marksblogg.com/billion-nyc-taxi-rides-p2-16xlarge-brytlytdb-2.html,0,bigdata
759iac,"7 articles handpicked by data scientists: tutorials about RL, graph generation and sentiment analysis",,22,1,oliviercha,2017-10-09 14:45:25,https://blog.sicara.com/09-2017-best-ai-new-articles-this-month-df0f2088543d,0,bigdata
5rqh31,Google releases massive visual databases for machine learning,,20,1,psangrene,2017-02-02 23:53:45,http://www.datasciencecentral.com/profiles/blogs/google-releases-massive-visual-databases-for-machine-learning,0,bigdata
5maq4c,Why Dataproc — Google’s managed Hadoop and Spark offering — is a game changer,,22,25,fhoffa,2017-01-06 01:53:18,https://hackernoon.com/why-dataproc-googles-managed-hadoop-and-spark-offering-is-a-game-changer-9f0ed183fda3,0,bigdata
4cqk04,Caravel: Airbnb’s data exploration platform for Druid and SQL databases,,19,0,fjpower,2016-03-31 15:39:56,https://medium.com/airbnb-engineering/caravel-airbnb-s-data-exploration-platform-15a72aa610e5#.gr2tr1h3b,0,bigdata
3vg1xk,"Machine learning works spectacularly well, but mathematicians aren’t quite sure why.",,21,6,Megadragon9,2015-12-04 18:35:27,https://www.quantamagazine.org/20151203-big-datas-mathematical-mysteries/,0,bigdata
3pnls9,Elections Canada makes 42nd election vote data available in CSV for analysis,,20,4,atriou,2015-10-21 17:00:26,http://enr.elections.ca/National.aspx?lang=e,0,bigdata
3ob9hw,20 top free Data science and Big Data courses for newcomers,,21,0,hamzamu,2015-10-11 08:35:40,http://medevel.com/20-top-free-data-science-courses-for-newcomers.html?utm_campaign=shareaholic&utm_medium=reddit&utm_source=news,0,bigdata
27qr3d,Data Science Stack Exchange is now public,,20,0,dostre,2014-06-09 23:57:52,http://datascience.stackexchange.com/,0,bigdata
1t3yfa,"""You will never sell flour and eggs for as much as you can sell a cake,"" said a speaker at the Big Data conference. ""...If you package [the data] and sell some useful insight instead, then it has a higher value and a sustained market.""",,22,1,yourbasicgeek,2013-12-17 19:33:44,http://www.fiercebigdata.com/story/secrets-monetizing-data/2013-12-16,0,bigdata
1h1pie,I am trying to put together a list of subreddits that are related to big data.,,23,17,janhen10,2013-06-25 16:54:20,https://www.reddit.com/r/bigdata/comments/1h1pie/i_am_trying_to_put_together_a_list_of_subreddits/,0,bigdata
1c1jas,Key Big Data Terms You Should Know,,23,4,None,2013-04-10 04:14:05,http://hkotadia.com/archives/5427,0,bigdata
17kn5k9,I've built a tool so that non-tech people can explore data,,20,12,None,2023-10-31 15:05:41,https://v.redd.it/7g7ao76ozjxb1,0,bigdata
z70vlk,Stream Processing vs. Batch Processing: What to Know,[https://medium.com/p/eb8b0480ae6a](https://medium.com/p/eb8b0480ae6a),21,0,Glittering_Bug105,2022-11-28 16:26:50,https://www.reddit.com/r/bigdata/comments/z70vlk/stream_processing_vs_batch_processing_what_to_know/,0,bigdata
