id,title,selftext,score,num_comments,author,created_utc,url,gilded,subreddit
6jnll8,"This cancer data repository has 4.1 petabyte of data, will double that by end of the year.",,18,0,karis02,2017-06-26 20:06:09,http://chicagoinno.streetwise.co/2017/06/26/how-uchicagos-gdc-is-helping-cure-cancer-using-big-data/,0,bigdata
6aqwt0,More than 70% of employees have access to data they should not...,,17,2,carpb202,2017-05-12 12:11:44,https://hbr.org/2017/05/whats-your-data-strategy,0,bigdata
683pho,Spotify: Reliable export of Cloud Pub/Sub streams to Cloud Storage (for 100 billion events a day),,16,2,fhoffa,2017-04-28 16:28:18,https://labs.spotify.com/2017/04/26/reliable-export-of-cloud-pubsub-streams-to-cloud-storage/,0,bigdata
5sfrh5,"Announcing Apache Flink 1.2.0 with rescaling, mesos, security improvements, queryable state and much more",,15,0,rmetz,2017-02-06 18:02:32,http://flink.apache.org/news/2017/02/06/release-1.2.0.html,0,bigdata
5oxmzl,New York City public datasets now available on Google BigQuery,,16,2,jkestelyn,2017-01-19 16:47:01,https://cloud.google.com/blog/big-data/2017/01/new-york-city-public-datasets-now-available-on-google-bigquery,0,bigdata
5l07ov,Introducing Apache Spark 2.1,,14,0,based2,2016-12-30 00:02:52,https://databricks.com/blog/2016/12/29/introducing-apache-spark-2-1.html,0,bigdata
5drv2l,Apache Spark and Amazon S3 - Gotchas and best practices,,18,0,bistro17,2016-11-19 10:08:06,https://medium.com/@subhojit20_27731/apache-spark-and-amazon-s3-gotchas-and-best-practices-a767242f3d98#.c0hdqrd5q,0,bigdata
5bnv44,"In the past several years, Presidential elections have served as cutting-edge laboratories in social media, big data, and analytics—testbeds that end up getting used in the industry in later years.",,16,0,wheeler1432,2016-11-07 18:31:30,https://www.laserfiche.com/simplicity/2016-election-lessons/,0,bigdata
55e3rx,Apache Spark vs. Apache Drill – The Ramp,,15,2,pmz,2016-10-01 17:08:34,https://medium.com/the-ramp/apache-spark-vs-apache-drill-1bfd87f73d8d#.1vwba9qob,0,bigdata
5360ub,Airline Flight Data Analysis - Part 1 - Data Preparation,,16,2,diybigdata,2016-09-17 05:32:43,http://diybigdata.net/2016/08/airline-flight-data-analysis-data-preparation/?utm_source=reddit&utm_medium=social&utm_campaign=social-pug,0,bigdata
50u4ba,The time we scanned 1.09 Petabytes in 4 minutes in Google BigQuery - LIVE,,16,1,thetinot,2016-09-02 16:34:55,https://youtu.be/6Nv18xmJirs?t=35m40s,0,bigdata
4uj3hr,Apache Spark $100K enterprise data hackathon,"Devpost & IBM are hosting the Apache Spark Makers Build, a global online data competition to build Spark apps that help businesses & startups run more efficiently. There are over $100,000 in cash prizes, and submissions are open from now through August 23.

Participants will have access to enterprise data sets from Yelp, Amazon, Bitcoin, 4Quant, and others to build an analysis or app that tackles a business problem in marketing, customer care, operations, or risk management.

The grand prize is $50,000, and the top three winners each get a meeting with the judge or Spark community expert of their choice. Judges include data experts from Tesla, Netflix, IBM, and Silicon Valley Data Science.
 
Full details and registration are @ [apachespark.devpost.com](http://apachespark.devpost.com).",17,1,idesofjo,2016-07-25 15:16:13,https://www.reddit.com/r/bigdata/comments/4uj3hr/apache_spark_100k_enterprise_data_hackathon/,0,bigdata
46e8ux,"What it looks like to process 3.5 million books on Google Cloud (including 2TB SSD, 1 TB RAM, 160 cores, speeds from 750 MB/s to 45.5 GB/s)",,15,1,fhoffa,2016-02-18 10:59:09,http://googlecloudplatform.blogspot.com/2016/02/what-it-looks-like-to-process-3.5-million-books-in-Googles-cloud.html,0,bigdata
43pdvh,Is Hadoop MapReduce Dead?,"I work for an Oracle Platinum Partner. One of the most common questions our clients want answers to is, “What is the future of MapReduce as an execution engine for Hadoop?” 

Our practice director addressed this question in a well thought out explanation:  http://saturninfotech.com/blog/2016/01/28/is-mapreduce-dead/",15,6,Millenial369,2016-02-01 17:05:04,https://www.reddit.com/r/bigdata/comments/43pdvh/is_hadoop_mapreduce_dead/,0,bigdata
3sdago,The Data Science Industry: Who Does What (Infographic),,17,3,DataPoints,2015-11-11 04:22:45,http://blog.datacamp.com/data-science-industry-infographic/,0,bigdata
3o4yhn,"Building a Streaming Data Hub with Elasticsearch, Kafka and Cassandra",,14,0,aspleenic,2015-10-09 19:33:40,http://thenewstack.io/building-streaming-data-hub-elasticsearch-kafka-cassandra/,0,bigdata
3iueyn,"Doradus - a REST service that extends a Cassandra NoSQL database with a graph-based data model, advanced indexing and search features",,16,0,148-3tothe3tothe6,2015-08-29 13:46:54,https://github.com/dell-oss/Doradus,0,bigdata
38dxn3,9 Free Books for Learning Data Mining & Data Analysis,,16,0,skillcode,2015-06-03 16:13:52,http://codecondo.com/9-free-books-for-learning-data-mining-data-analysis/,0,bigdata
36x3po,Big Data Processing with Apache Spark – Part 1: Introduction,,16,0,carlosp81,2015-05-22 20:59:25,http://www.infoq.com/articles/apache-spark-introduction#.VV-X72bfbwg.reddit,0,bigdata
2zgyyf,4 Web Scraping Tools To Save You Time On Data Extraction,,16,2,vladdione,2015-03-18 14:42:24,http://tech.co/4-web-scraping-tools-save-time-data-extraction-2015-03,0,bigdata
2faesb,25 Classes to Get Started with Data Science & Big Data,,17,0,Allclasses,2014-09-02 19:59:16,http://blog.allclasses.com/25-classes-to-get-started-with-data-science-big-data/,0,bigdata
27bdz4,Census Data + Algorithm = No more gerrymandering,,17,1,JamesKotecki,2014-06-04 19:19:04,http://www.washingtonpost.com/blogs/wonkblog/wp/2014/06/03/this-computer-programmer-solved-gerrymandering-in-his-spare-time/?tid=sm_fb,0,bigdata
26uzrc,IBM Partners With 28 Universities to Help Train Tomorrow's Data Scientists,,15,1,dataconomy,2014-05-30 08:35:00,http://dataconomy.com/ibm-partners-with-28-universities-to-help-train-tomorrows-data-scientists/,0,bigdata
21qtvd,Big data: are we making a big mistake?,,18,6,skillcode,2014-03-30 13:35:41,http://www.ft.com/cms/s/2/21a6e7d8-b479-11e3-a09a-00144feabdc0.html,0,bigdata
1m3w3z,Our data-driven newborn,,16,2,thecodemonkey,2013-09-10 14:57:43,https://github.com/MiniCodeMonkey/Sophie-Tracker-3000,0,bigdata
11zh8pw,A Comprehensive Collection of Data Analysis Cheat Sheets For 2023,,15,0,Shradha_Singh,2023-03-23 11:18:07,https://medium.com/@reachtoanamikasingh19/a-comprehensive-collection-of-data-analysis-cheat-sheets-for-2023-3e1f66a9a900,0,bigdata
11oc025,Data Architecture Complexity,,15,0,bigdataengineer4life,2023-03-11 05:41:38,https://youtu.be/El96tIPpvSQ,0,bigdata
11newg0,Here’s a playlist of 7 hours of music with NO VOCALS I use to focus when I’m coding /learning . Post yours as well if you also have one!,[Spotify](https://open.spotify.com/playlist/6BoTD9WeyBN5rD5uyhbROO) | [Apple](https://music.apple.com/playlist/synthwave-focus-i/pl.u-b3b8Nm9C5MmMyM) | [Youtube](https://youtube.com/playlist?list=PLwO9YUACGAzS_XaTchS3qLgK5EGsb3qwa) | [Amazon](https://music.amazon.com/user-playlists/0375bdbe2f3d41f39523ddb35fc92ca0b1r),14,1,letsstartanew2,2023-03-10 04:40:57,https://www.reddit.com/r/bigdata/comments/11newg0/heres_a_playlist_of_7_hours_of_music_with_no/,0,bigdata
vfsuq1,What's new in Spark 3.3.0,,14,0,co0lster,2022-06-19 11:08:09,https://www.datapotion.io/blog/what-new-in-spark-3-3-0,0,bigdata
v4i6to,Apache Hive for Data Engineers (Hands On) with 2 Projects,,15,0,bigdataengineer4life,2022-06-04 05:38:19,https://youtu.be/m_WY1mGAxDE,0,bigdata
uy19gx,The Streets of Monaco,,14,0,marklit,2022-05-26 06:28:08,https://tech.marksblogg.com/streets-of-monaco-openstreetmap-postgis-qgis.html,0,bigdata
uf91tz,Microsoft AI Researchers Develop MoLeR: A Deep Learning-Based Generative Model That Enables Efficient Drug Design,"Healthcare systems constantly require new drugs to address unmet medical needs across diverse therapeutic areas. Pharmaceutical industries strive to deliver new drugs to the market through the complex activities of drug discovery and development. Target identification and validation, hit identification, lead creation and optimization, and finally, the identification of a candidate for further development are all part of the discovery process. Development, on the other hand, includes optimizing chemical synthesis and formulation, doing toxicity research in animals, conducting clinical trials, and finally obtaining regulatory approval. Both of these procedures take a long time and cost a lot of money.

Expert medicinal chemists are currently working to develop “hit” molecules, which are compounds that show some potential but also some unfavorable features during early screening. Chemists aim to alter the structure of hit compounds in subsequent tests to improve their biological efficacy and eliminate potential negative effects. To focus costly and time-consuming research on the most promising compounds, computational modeling approaches have been created to forecast how the molecules will fare in the lab. 

To overcome these issues, a new study by the Microsoft Generative Chemistry team in collaboration with Novartis has developed a model named MoLeR. Their paper, “LEARNING TO EXTEND MOLECULAR SCAFFOLDS WITH STRUCTURAL MOTIFS, ” demonstrates how generative models based on deep learning may aid in transforming the drug discovery process and uncovering new molecules more quickly.

[Continue Reading](https://openreview.net/pdf?id=ZTsoE8G3GG)

Paper: https://openreview.net/pdf?id=ZTsoE8G3GG

Github: [https://github.com/microsoft/molecule-generation](https://github.com/microsoft/molecule-generation)

&#x200B;

https://i.redd.it/nqoefts2hnw81.gif",14,1,No_Coffee_4638,2022-04-30 11:18:13,https://www.reddit.com/r/bigdata/comments/uf91tz/microsoft_ai_researchers_develop_moler_a_deep/,0,bigdata
uap958,The Data Warehouse Performance Wars,,15,0,humhiprib,2022-04-24 07:21:52,https://www.firebolt.io/blog/future-of-performance-is-not-about-performance,0,bigdata
ty6wmr,Looking for intersting end to end big data pipeline projects,"I am currently looking for project ideas with dataset source to implement. 

Preferably to implement end to end on GCP with deployment.

Any suggestions are welcome. Thanks in advance. :)",15,2,ViolinistSuper8880,2022-04-07 06:36:06,https://www.reddit.com/r/bigdata/comments/ty6wmr/looking_for_intersting_end_to_end_big_data/,0,bigdata
tpoyd6,LinkedIn Engineering Team Develops ‘Opal’ to Ingest Mutable Data and Build Mutable Dataset on Top of the Immutable File System,"Trusted data platforms and high-quality data pipelines are critical at LinkedIn for accurate business KPIs and sound decision-making. Today, online data repositories account for a significant portion of LinkedIn’s data. Internet datasets must be migrated to the data lake for further processing and business analytics, whether they are SQL or NoSQL systems.

However, because the data lake architecture is immutable, it cannot be easy to reflect online table updates, inserts, and deletes. *Opal* was introduced to balance data quality, latency, scan performance, and system scalability (computational resources and operational costs).

[Continue reading here](https://www.marktechpost.com/2022/03/27/linkedin-engineering-team-develops-opal-to-ingest-mutable-data-and-build-mutable-dataset-on-top-of-the-immutable-file-system/)",14,2,No_Coffee_4638,2022-03-27 17:41:21,https://www.reddit.com/r/bigdata/comments/tpoyd6/linkedin_engineering_team_develops_opal_to_ingest/,0,bigdata
s98lfb,"In 2021, people created 1.7 MB of data every second.",,16,8,bigdatatrunk,2022-01-21 11:21:55,https://i.redd.it/sc67sj2kz0d81.jpg,0,bigdata
p2w3fn,Enso 2.0 is out! A no-code interactive ETL and data analytics tool.,,15,3,sylwiabr,2021-08-12 09:04:41,https://v.redd.it/mkvpcxa17wg71,0,bigdata
of5dg7,Data Engineering Road Map - How To Learn Data Engineering Quickly,,16,0,nonkeymn,2021-07-06 22:12:13,https://www.youtube.com/watch?v=SpaFPPByOhM,0,bigdata
m6bu8w,Real alternatives do CDP/CDH/HDP? No open source alternative in the near future?,"Hi.

CDP is already in full speed pushing the cloud vendors. HDP with Ambari is basically dead and integrated inside the Cloudera group... 

So.. what is now the open source alternative? What can we install in our customers who don't want and can't spend thousands and thousands of dollars/euros on cloud infrastructure plus CDP licensing?

Any ideas? What is expected for small businesses who are running these days HDP for example?",15,22,JohnJohnPT,2021-03-16 15:38:12,https://www.reddit.com/r/bigdata/comments/m6bu8w/real_alternatives_do_cdpcdhhdp_no_open_source/,0,bigdata
m4gidc,Step by step guide to creating a data dictionary,"Simple data starts with good organization. A data dictionary is a list of key terms and metrics with definitions; a business glossary. Although this seems like a simple exercise, it’s very difficult to align business departments with the same definitions. A large ride-sharing company had difficulties related to data definitions. At this company, it was very difficult to get aligned on the same metrics for “number of rides per week”. Why?

* The data team defines the “number of rides per week” as the total number of rides that were **completed** between Jan. 1, 2020, 12:00 AM → Jan. 7, 2020, 11:59 PM.
* The marketing team defines the “number of rides per week” as the total number of rides that were **started** between Jan. 1, 2020, 12:00 AM → Jan. 7, 2020, 11:59 PM.
* The sales team defines “number of rides per week” as the total number of riders that **paid for a ride** Jan. 1, 2020, 7:00 AM → Jan. 8, 2020, 6:59 AM

All data-driven organizations experience this problem as they begin to grow their data and people. And although it sounds like a simple problem, which might require a meeting to solve, aligning the business and data to remove confusion can be an extremely profound problem. That's why a data dictionary can be one of the most valuable tools that a data team can create to deliver results. Below are the steps that teams need to take when creating their data dictionary

### 1. Gather terms from different departments

The first step data teams need to take is to collect the different terms that all departments are using to define key business definitions. Today, this collection could be done in a spreadsheet with a list of the business concepts. One approach teams take is to look at a sample of the most used reports and dashboards by teams to get an understanding of the main metrics used across departments. This can be done easily using Secoda, which automatically indexes the most used resources by an organization. Once teams have a good understanding of the commonly used tables and dashboards, listing out all the primary axis by charts can help to understand the term as well as the definitions.

* For example, a dashboard showing the rides completed by the state is composed of two primary terms: ""rides completed"" and ""state"". The teams should compile a list of these two terms.
* One way a tool like Secoda can help with this stage is to use the ""tag"" feature to categorize which reports involve the ""rides completed"" and ""state"" terms. Additionally, Secoda automatically documents the data type, and examples of the values, additional columns in the table, owners, and a link to the report.

Once you have your list of terms, you can begin grouping them by the functional unit. For example, the marketing metrics, product metrics, operations metrics. Another suggestion is to categorize the similar dimensions that are repeated throughout the tables (product\_id, country, year, etc.) This is helpful because some columns could have names that are difficult to understand. Making a list of these definitions can help data teams standardize some of these confusing terms. After you prepare this list, ask the teams to go over their section and add any terms that you might have missed. Once the terms have been collected, you should be ready to define the terms

### 2. Give the terms a definition

The data team should try to define the terms collected based on the information that they can collect on the terms. To do this, the data team should pull any existing definitions from outdated documentation. Most teams keep this documentation in google sheets or confluence, which can make finding the definitions a tricky part of the process. Another way to find the definitions is by looking through annual reports, or from actual code such as SQL queries or Excel. Names of terms should always be written out and unabbreviated to make sure that they are universally understandable. Even non-technical staff should understand the definitions of rows or columns, even if they refer to some other definitions in the database. After this initial draft is complete, schedule time to sit with the teams and ask them if there are inconsistencies, inaccuracies, or definitions that need to be refined. This part of the process can take time and can require multiple meetings to clear up. When our team started working on this step, we found that a lot of the meeting was spent explaining ""why"", as opposed to talking through solutions. One strategy that helped make these meetings more efficient was to create detailed documentation before the meeting. This way, all stakeholders came into the meeting prepared and informed about the discussion. One additional tip is to make sure the stakeholder understands that the goal of the meeting is to find out how the metrics **should** be defined, not how it was defined in the past. If the current definition is not perfect, this is a great chance to correct it and align teams on the same definition. Remember that overly complex metrics are rarely the right solution. One rule we like to follow internally is to always remember Goodhart's law. This law states that when a measure becomes a target, it ceases to be a good measure. We don't want to create measurements that are too complex and incentivize people inappropriately.

### 3. Find alignment

In this step, it's important to look for similarities or dependencies in definitions across teams and resolve conflicts. Multiple teams may have similar definitions. For those teams and terms, bring them into the same meeting to align the teams towards one definition. When you're setting up the meeting, clarify the outcome of the meeting to get one standard definition that works for both teams.

* This might require one team to concede to another teams definition
* This might require both teams to agree to a new name for the definition.
* This might require both teams to rework their existing definition to find a completely new definition.

One suggestion is to make sure that names and definitions avoid and ambiguity. Use longer, more descriptive terms when they add more clarity. Your goal should be to eliminate any confusion about the definitions.

### 4. Get support and sign off

Once these meetings conclude and teams are on the same page, have the team leads sign off on the new definition. The team leads should be in alignment with the definitions and feel like the data team worked collaboratively with them to come to this definition. One effective strategy is to involve the leadership team in the exercise early to make sure that their team leads are signing off on the definitions. If the team leads see the value of having alignment, this can move at a much faster pace.

### 5. Centralize the document 

After you receive sign-off from team leads, publish the data dictionary as a document that can be accessed by all employees. The definitions should be understood by anyone in the company, not just the data team. Additionally, the definitions should be adopted by all teams and by leadership. Because of this, getting people to start using the right definitions is a tricky part of the process. The individual definitions should be baked into the reports and visualizations whenever possible. One of the tougher tasks is to manage the data dictionary after it's been published. One solution to this is to try to autogenerate the data dictionary definitions from a single source, such as a code repository. We believe that a tool that integrates into the database or code is a great way to manage the data dictionary.

### 6. Upkeep the data dictionary

Although the key metrics should be stable, they may need to change over time. One instance that might require key metrics to change is when a new revenue stream is introduced or when the pricing of an existing revenue line changes. These changes traditionally come from the business team and might require the data team to implement the changes into the data dictionary. When there are big changes in the business, treat the changes to the data dictionary as a key part of the product release. Communicate the changes in the dictionary definition to the rest of the teams and make sure all team leads are informed about the new changes. One strategy that we used was creating a slack channel dedicated to updates to the data dictionary. This way, all business stakeholders can stay informed on the important key business definitions. Creating a data dictionary is not a small undertaking, it requires patience and alignment with leadership. This process will likely take a few months, even with the proper tooling. That being said, having the proper tools in place to record the dictionary can make maintaining and accessing the dictionary a much easier process. We suggest tackling the process head-on and early on. Many companies wait a long time before defining their data dictionary, which can make the process much more difficult in the future. Teams that invest the time to get alignment on their data can see major benefits in the long term as they make faster decisions as a team. Our team is working towards a tool that helps teams align on key business metrics and access their data from a single dashboard. If you're interested in trying out the tool, you can sign up to try the tool for free at [Secoda.co](http://secoda.co/).",14,0,secodaHQ,2021-03-13 21:58:41,https://www.reddit.com/r/bigdata/comments/m4gidc/step_by_step_guide_to_creating_a_data_dictionary/,0,bigdata
lacsnv,"Robinhood, UiPath, Databricks Raise Mammoth Rounds",,14,0,The-Techie,2021-02-01 20:12:20,https://www.thetechee.com/2021/02/robinhood-uipath-databricks-raise.html,0,bigdata
l1znv8,Modern Big Data Architectures - Lambda,,15,1,luminoumen,2021-01-21 14:39:29,https://luminousmen.com/post/modern-big-data-architectures-lambda-kappa,0,bigdata
hjb5pu,"Python library for advanced Google News data mining: get news data by topics, geolocation, full-text search. Plus, clusters of similar topics",,15,0,kotartemiy,2020-07-01 14:23:55,https://github.com/kotartemiy/pygooglenews,0,bigdata
havuab,Zoe: a new CLI tool for Apache Kafka,"Hi!

Within Adevinta, we are heavy users of Apache Kafka. We built our own tooling around it. Recently, we open sourced one of these tools called Zoe. It's a high level command line tool to easily interact with Kafka. We use it heavily here and it significantly optimized our workflow.

* Checkout [the repository here](https://github.com/adevinta/zoe) where you will find a screen cast that demo the tool.
* And [the documentation](https://adevinta.github.io/zoe/)

We will soon write an article about it.

Any feedback is welcome : )",13,1,wlezzar,2020-06-17 17:28:56,https://www.reddit.com/r/bigdata/comments/havuab/zoe_a_new_cli_tool_for_apache_kafka/,0,bigdata
f9pb3u,Building a Serverless data processing platform at Nielsen,"Check out our blog post, describing how we built a data processing platform that handles 250 billion events per day, using Serverless architecture.

It discusses why we decided not to use Apache Spark for this specific use case, and what benefits we got from using AWS Lambda.

Read more about our Serverless real use-case here:  
[https://medium.com/nmc-techblog/going-serverless-a-real-use-case-1e40e80a2a9c](https://medium.com/nmc-techblog/going-serverless-a-real-use-case-1e40e80a2a9c)",15,4,ItaiYaffe,2020-02-26 06:54:05,https://www.reddit.com/r/bigdata/comments/f9pb3u/building_a_serverless_data_processing_platform_at/,0,bigdata
