id,title,selftext,score,num_comments,author,created_utc,url,gilded,subreddit
mkfsfi,"Big Data Pipeline on AWS, Microsoft Azure, and Google Cloud",,262,21,satishcgupta,2021-04-05 08:23:32,https://i.redd.it/82cgd6zaebr61.png,0,bigdata
z0qt73,"Big Data Pipelines on AWS, Azure, and Google Cloud (v2022)",,154,12,satishcgupta,2022-11-21 05:42:24,https://i.redd.it/hd7n9igsr81a1.png,0,bigdata
qq35ab,k-Means clustering: Visually explained,,128,11,Va_Linor,2021-11-09 12:59:42,https://v.redd.it/urt5l3sgiky71,0,bigdata
c5189o,Big Data,,109,6,FunkyDoktor,2019-06-25 02:53:24,https://i.redd.it/i945mic43f631.jpg,0,bigdata
icyh6p,I've compiled a list of the best books on data science (see comments for the list),,95,5,vhpoet,2020-08-19 22:56:23,https://i.redd.it/u1lb24jdh1i51.png,0,bigdata
v69kmi,Saw that today and it made me laugh 😀,,91,8,ioah86,2022-06-06 18:02:31,https://i.redd.it/4iz4ge92j1491.jpg,0,bigdata
q18zde,Do you agree?,,89,16,D3Vtech,2021-10-04 16:29:32,https://i.redd.it/egxczjvwmgr71.png,0,bigdata
ns4lfg,The age-old spinach data problem,,91,1,lblip123,2021-06-04 13:01:48,https://i.redd.it/rg3r6xmuy8371.png,0,bigdata
ca521f,Matt Tuck Big data Landscape,,84,12,inboundmage,2019-07-07 09:30:04,http://mattturck.com/wp-content/uploads/2019/07/2019_Matt_Turck_Big_Data_Landscape_2019v2_Fullsize.png,0,bigdata
mkbfhw,Realities Of Being A Data Engineer,"As the demand continues to grow for data engineers I wanted to cover a few expectations I had going into being a data engineer.

Just in case some people on this thread are thinking about becoming data engineers themselves. Also, it would be great to discuss other challenges you might be facing becoming a data engineer. Also, I added a timestamp to when I reference this in a recent video I put up. But the points are the exact same in the video. So feel free to just discuss here as well!

1. I assumed most companies had already switched over to tools like Hadoop, Bigquery, Spark, etc. You read enough articles and it seems like you will need to be familiar with all of these technologies. However, I have found plenty of companies still store their data in Oracle, SQL Server, and Postgres...and...it works. There is no need for them to switch. In fact when I interviewed at  a large tech company and I told them I wanted to learn more about distributed systems and streaming. They asked me about the downsides of the tech. [0:48](https://www.youtube.com/watch?v=6RiA_Qur2yo&t=48s)​ Hadoop And Spark?
2. Data engineering salary - I assumed I would make 100k after a few years. However, I quickly was able to make a lot more than that by getting hired in big tech. In fact you could make 2x that at the right company. Now SWEs always make more. But 200k is a decent amount even in the bay. [6:15](https://www.youtube.com/watch?v=6RiA_Qur2yo&t=375s)​ What to expect for a data engineering salary?
3. I assumed most of my work would be creating data pipelines. But I have done at least 3 migrations in the last 3-4 years. So you will spend a lot of time just replicating functionality in a different system or design process. [3:04](https://www.youtube.com/watch?v=6RiA_Qur2yo&t=184s)​ Isn't it All About Data Pipelines
4. Data engineers get no fanfare. As much as most of the work the analyst and data data scientist do rely on data engineers. We are always in the background. We don't get to present our findings or talk about our impact that much. Personally I kind of like being behind the scenes [5:02](https://www.youtube.com/watch?v=6RiA_Qur2yo&t=302s)​ All The Focus Is Not On Data Engineers

What were your expectations vs reality for being a data engineer or working with big data.

&#x200B;

Edit: I don't think I have ever gotten a reward before...THANK YOU.

&#x200B;

Edit 2: Thank you for the silver on the BI subreddit!",80,15,nonkeymn,2021-04-05 03:14:22,https://www.reddit.com/r/bigdata/comments/mkbfhw/realities_of_being_a_data_engineer/,0,bigdata
14s0wq1,Data Truth!,,71,3,Sailja_Jain,2023-07-06 06:58:16,https://i.redd.it/2av5hc84maab1.jpg,0,bigdata
gezig6,Big Data Engineers Path,,70,10,TheInsaneApp,2020-05-07 04:05:37,https://i.redd.it/zua58yhyo9x41.png,0,bigdata
8ud9f5,Big Data Landscape 2018,,69,9,rsinghanalytics,2018-06-27 20:53:03,http://mattturck.com/wp-content/uploads/2018/06/Matt-Turck-FirstMark-Big-Data-Landscape-2018.png,0,bigdata
2vl13s,Google BigQuery is ridiculously fast. Just queries 3TB in 7 seconds in plain SQL.,,65,11,tinoter,2015-02-11 22:05:20,http://i.imgur.com/9Q6uZ9D.png,0,bigdata
124rf3g,Big news! LambdaConf returns Sept 16-19th and is better than ever! 🔥,"Join us in the Rockies for an unforgettable conference featuring thought-provoking talks, workshops, craft beer tasting, hiking, and immersive experiences that will change the way you think about software development. Grab your Early Bird Ticket: [https://www.eventbrite.com/e/lambda-conf-colorado-usa-in-person-only-tickets-540887036687](https://www.eventbrite.com/e/lambda-conf-colorado-usa-in-person-only-tickets-540887036687)",59,1,Agataziverge,2023-03-28 14:59:34,https://www.reddit.com/r/bigdata/comments/124rf3g/big_news_lambdaconf_returns_sept_1619th_and_is/,0,bigdata
116ax6a,What People Are Missing About Microsoft’s $10B Investment In OpenAI,"&#x200B;

[Sam Altman Might Have Just Pulled Off The Coup Of The Decade](https://preview.redd.it/daoewwski5ja1.png?width=720&format=png&auto=webp&s=2eec23c4cadb1697314f0225fd4485ddacabc601)

Microsoft is investing $10B into OpenAI!

There is lots of frustration in the community about OpenAI not being all that open anymore. They appear to abandon their ethos of developing AI for everyone, [free](https://openai.com/blog/introducing-openai/) of economic pressures.

The fear is that OpenAI’s models are going to become fancy MS Office plugins. Gone would be the days of open research and innovation.

However, the specifics of the deal tell a different story.

To understand what is going on, we need to peek behind the curtain of the tough business of machine learning. We will find that Sam Altman might have just orchestrated the coup of the decade!

To appreciate better why there is some three-dimensional chess going on, let’s first look at Sam Altman’s backstory.

*Let’s go!*

A Stellar Rise

Back in 2005, Sam Altman founded [Loopt](https://en.wikipedia.org/wiki/Loopt) and was part of the first-ever YC batch. He raised a total of $30M in funding, but the company failed to gain traction. Seven years into the business Loopt was basically dead in the water and had to be shut down.

Instead of caving, he managed to sell his startup for $[43M](https://golden.com/wiki/Sam_Altman-J5GKK5) to the finTech company [Green Dot](https://www.greendot.com/). Investors got their money back and he personally made $5M from the sale.

By YC standards, this was a pretty unimpressive outcome.

However, people took note that the fire between his ears was burning hotter than that of most people. So hot in fact that Paul Graham included him in his 2009 [essay](http://www.paulgraham.com/5founders.html?viewfullsite=1) about the five founders who influenced him the most.

He listed young Sam Altman next to Steve Jobs, Larry & Sergey from Google, and Paul Buchheit (creator of GMail and AdSense). He went on to describe him as a strategic mastermind whose sheer force of will was going to get him whatever he wanted.

And Sam Altman played his hand well!

He parleyed his new connections into raising $21M from Peter Thiel and others to start investing. Within four years he 10x-ed the money \[2\]. In addition, Paul Graham made him his successor as president of YC in 2014.

Within one decade of selling his first startup for $5M, he grew his net worth to a mind-bending $250M and rose to the circle of the most influential people in Silicon Valley.

Today, he is the CEO of OpenAI — one of the most exciting and impactful organizations in all of tech.

However, OpenAI — the rocket ship of AI innovation — is in dire straights.

OpenAI is Bleeding Cash

Back in 2015, OpenAI was kickstarted with $1B in donations from famous donors such as Elon Musk.

That money is long gone.

In 2022 OpenAI is projecting a revenue of $36M. At the same time, they spent roughly $544M. Hence the company has lost >$500M over the last year alone.

This is probably not an outlier year. OpenAI is headquartered in San Francisco and has a stable of 375 employees of mostly machine learning rockstars. Hence, salaries alone probably come out to be roughly $200M p.a.

In addition to high salaries their compute costs are stupendous. Considering it cost them $4.6M to train GPT3 once, it is likely that their cloud bill is in a very healthy nine-figure range as well \[4\].

So, where does this leave them today?

Before the Microsoft investment of $10B, OpenAI had received a total of $4B over its lifetime. With $4B in funding, a burn rate of $0.5B, and eight years of company history it doesn’t take a genius to figure out that they are running low on cash.

It would be reasonable to think: OpenAI is sitting on ChatGPT and other great models. Can’t they just lease them and make a killing?

Yes and no. OpenAI is projecting a revenue of $1B for 2024. However, it is unlikely that they could pull this off without significantly increasing their costs as well.

*Here are some reasons why!*

The Tough Business Of Machine Learning

Machine learning companies are distinct from regular software companies. On the outside they look and feel similar: people are creating products using code, but on the inside things can be very different.

To start off, machine learning companies are usually way less profitable. Their gross margins land in the 50%-60% range, much lower than those of SaaS businesses, which can be as high as 80% \[7\].

On the one hand, the massive compute requirements and thorny data management problems drive up costs.

On the other hand, the work itself can sometimes resemble consulting more than it resembles software engineering. Everyone who has worked in the field knows that training models require deep domain knowledge and loads of manual work on data.

To illustrate the latter point, imagine the unspeakable complexity of performing content moderation on ChatGPT’s outputs. If OpenAI scales the usage of GPT in production, they will need large teams of moderators to filter and label hate speech, slurs, and tutorials on killing people, you name it.

*Alright, alright, alright! Machine learning is hard.*

*OpenAI already has ChatGPT working. That’s gotta be worth something?*

Foundation Models Might Become Commodities:

In order to monetize GPT or any of their other models, OpenAI can go two different routes.

First, they could pick one or more verticals and sell directly to consumers. They could for example become the ultimate copywriting tool and blow [Jasper](https://app.convertkit.com/campaigns/10748016/jasper.ai) or [copy.ai](https://app.convertkit.com/campaigns/10748016/copy.ai) out of the water.

This is not going to happen. Reasons for it include:

1. To support their mission of building competitive foundational AI tools, and their huge(!) burn rate, they would need to capture one or more very large verticals.
2. They fundamentally need to re-brand themselves and diverge from their original mission. This would likely scare most of the talent away.
3. They would need to build out sales and marketing teams. Such a step would fundamentally change their culture and would inevitably dilute their focus on research.

The second option OpenAI has is to keep doing what they are doing and monetize access to their models via API. Introducing a [pro version](https://www.searchenginejournal.com/openai-chatgpt-professional/476244/) of ChatGPT is a step in this direction.

This approach has its own challenges. Models like GPT do have a defensible moat. They are just large transformer models trained on very large open-source datasets.

As an example, last week Andrej Karpathy released a [video](https://www.youtube.com/watch?v=kCc8FmEb1nY) of him coding up a version of GPT in an afternoon. Nothing could stop e.g. Google, StabilityAI, or HuggingFace from open-sourcing their own GPT.

As a result GPT inference would become a common good. This would melt OpenAI’s profits down to a tiny bit of nothing.

In this scenario, they would also have a very hard time leveraging their branding to generate returns. Since companies that integrate with OpenAI’s API control the interface to the customer, they would likely end up capturing all of the value.

An argument can be made that this is a general problem of foundation models. Their high fixed costs and lack of differentiation could end up making them akin to the [steel industry](https://www.thediff.co/archive/is-the-business-of-ai-more-like-steel-or-vba/).

To sum it up:

* They don’t have a way to sustainably monetize their models.
* They do not want and probably should not build up internal sales and marketing teams to capture verticals
* They need a lot of money to keep funding their research without getting bogged down by details of specific product development

*So, what should they do?*

The Microsoft Deal

OpenAI and Microsoft [announced](https://blogs.microsoft.com/blog/2023/01/23/microsoftandopenaiextendpartnership/) the extension of their partnership with a $10B investment, on Monday.

At this point, Microsoft will have invested a total of $13B in OpenAI. Moreover, new VCs are in on the deal by buying up shares of employees that want to take some chips off the table.

However, the astounding size is not the only extraordinary thing about this deal.

First off, the ownership will be split across three groups. Microsoft will hold 49%, VCs another 49%, and the OpenAI foundation will control the remaining 2% of shares.

If OpenAI starts making money, the profits are distributed differently across four stages:

1. First, early investors (probably Khosla Ventures and Reid Hoffman’s foundation) get their money back with interest.
2. After that Microsoft is entitled to 75% of profits until the $13B of funding is repaid
3. When the initial funding is repaid, Microsoft and the remaining VCs each get 49% of profits. This continues until another $92B and $150B are paid out to Microsoft and the VCs, respectively.
4. Once the aforementioned money is paid to investors, 100% of shares return to the foundation, which regains total control over the company. \[3\]

What This Means

This is absolutely crazy!

OpenAI managed to solve all of its problems at once. They raised a boatload of money and have access to all the compute they need.

On top of that, they solved their distribution problem. They now have access to Microsoft’s sales teams and their models will be integrated into MS Office products.

Microsoft also benefits heavily. They can play at the forefront AI, brush up their tools, and have OpenAI as an exclusive partner to further compete in a [bitter cloud war](https://www.projectpro.io/article/aws-vs-azure-who-is-the-big-winner-in-the-cloud-war/401) against AWS.

The synergies do not stop there.

OpenAI as well as GitHub (subsidiary of Microsoft) e. g. will likely benefit heavily from the partnership as they continue to develop[ GitHub Copilot](https://github.com/features/copilot).

The deal creates a beautiful win-win situation, but that is not even the best part.

Sam Altman and his team at OpenAI essentially managed to place a giant hedge. If OpenAI does not manage to create anything meaningful or we enter a new AI winter, Microsoft will have paid for the party.

However, if OpenAI creates something in the direction of AGI — whatever that looks like — the value of it will likely be huge.

In that case, OpenAI will quickly repay the dept to Microsoft and the foundation will control 100% of whatever was created.

*Wow!*

Whether you agree with the path OpenAI has chosen or would have preferred them to stay donation-based, you have to give it to them.

*This deal is an absolute power move!*

I look forward to the future. Such exciting times to be alive!

As always, I really enjoyed making this for you and I sincerely hope you found it useful!

*Thank you for reading!*

Would you like to receive an article such as this one straight to your inbox every Thursday? Consider signing up for **The Decoding** ⭕.

I send out a thoughtful newsletter about ML research and the data economy once a week. No Spam. No Nonsense. [Click here to sign up!](https://thedecoding.net/)

**References:**

\[1\] [https://golden.com/wiki/Sam\_Altman-J5GKK5](https://golden.com/wiki/Sam_Altman-J5GKK5)​

\[2\] [https://www.newyorker.com/magazine/2016/10/10/sam-altmans-manifest-destiny](https://www.newyorker.com/magazine/2016/10/10/sam-altmans-manifest-destiny)​

\[3\] [Article in Fortune magazine ](https://fortune.com/2023/01/11/structure-openai-investment-microsoft/?verification_code=DOVCVS8LIFQZOB&_ptid=%7Bkpdx%7DAAAA13NXUgHygQoKY2ZRajJmTTN6ahIQbGQ2NWZsMnMyd3loeGtvehoMRVhGQlkxN1QzMFZDIiUxODA3cnJvMGMwLTAwMDAzMWVsMzhrZzIxc2M4YjB0bmZ0Zmc0KhhzaG93T2ZmZXJXRDFSRzY0WjdXRTkxMDkwAToMT1RVVzUzRkE5UlA2Qg1PVFZLVlpGUkVaTVlNUhJ2LYIA8DIzZW55eGJhajZsWiYyYTAxOmMyMzo2NDE4OjkxMDA6NjBiYjo1NWYyOmUyMTU6NjMyZmIDZG1jaOPAtZ4GcBl4DA)​

\[4\] [https://arxiv.org/abs/2104.04473](https://arxiv.org/abs/2104.04473) Megatron NLG

\[5\] [https://www.crunchbase.com/organization/openai/company\_financials](https://www.crunchbase.com/organization/openai/company_financials)​

\[6\] Elon Musk donation [https://www.inverse.com/article/52701-openai-documents-elon-musk-donation-a-i-research](https://www.inverse.com/article/52701-openai-documents-elon-musk-donation-a-i-research)​

\[7\] [https://a16z.com/2020/02/16/the-new-business-of-ai-and-how-its-different-from-traditional-software-2/](https://a16z.com/2020/02/16/the-new-business-of-ai-and-how-its-different-from-traditional-software-2/)",57,4,LesleyFair,2023-02-19 13:59:31,https://www.reddit.com/r/bigdata/comments/116ax6a/what_people_are_missing_about_microsofts_10b/,0,bigdata
xludlh,What's bad data?,,60,1,Ok-Put-4951,2022-09-23 11:00:25,https://i.redd.it/iyznfwasalp91.png,0,bigdata
eu73vm,Google just published 25 million free datasets,,59,5,superconductiveKyle,2020-01-26 14:09:19,https://link.medium.com/tKSfTtk5y3,0,bigdata
n5ire6,"Researchers found that accelerometer data from smartphones can reveal people's location, passwords, body features, age, gender, level of intoxication, driving style, and be used to reconstruct words spoken next to the device.",,57,1,bayashad,2021-05-05 15:35:38,https://i.redd.it/b8bpryt35bx61.png,0,bigdata
mttt65,Online Courses And Youtube Channels I Used To Become A Data Engineer,"Oddly enough I wrote an article over a year ago about some great data engineering courses and channels that you can use to become a data engineer(Or at least the courses I used). 

The odd part being that when I started a youtube channel, I got asked for similar content. So I put together a video (Without affiliate links ;) ) to cover the youtube channels and courses I used. 

Here were some of my favorites. I didn't include the Google Data Engineer course because I will likely put together a separate video for that. 

Also, feel free to let me know what courses you took or would recommend! 

[0:46](https://www.youtube.com/watch?v=lVj0RlSxTXk&t=46s)​ - Youtube: WiseOwl - When I first started working in data, I worked at a company that was focused on the Microsoft stack. In particular, the older, SSIS, SSRS and standard SQL Server. So WiseOwl provided a lot of learning in terms of specific tooling. I will add that they don't really teach anything in terms of good practices. These videos are generally just specific how-tos for basic concepts like transformations and SQL.

[4:06](https://www.youtube.com/watch?v=lVj0RlSxTXk&t=246s)​ -  Udemy: Data Warehouse Fundamentals for Beginners - As mentioned in the previous section above, WiseOwl only really focuses on how-tos for specific issues. Really, its great for those problems you google. Like ""How do I use pivot on SQL Server"". Something very specific.

When it comes to really going beyond and thinking from a higher level. You will need to learn about data warehousing and ETL design(Even if these are changing in terms of best practices). Understanding what ETLS and data warehouses are can drastically help you understand the big picture. Like, why are companies look to ELTs vs ETLs or Data Lakehouses vs Data Lakes. Understanding these changes requires you know where data engineering started from. 

 [3:16](https://www.youtube.com/watch?v=lVj0RlSxTXk&t=196s)​ - Youtube: Airflow Apache w/Tuan Vu  - I skipped over this channel to discuss the high level data warehousing course. But, if you're looking for another free option. Tuan Vu's apache airflow playlist is great if you're trying to get up to speed on airflow fast. It's a great way to practice setting up airflow on a cloud VM. 

[6:40](https://www.youtube.com/watch?v=lVj0RlSxTXk&t=400s)​ - Udemy: Big Data on Amazon web services (AWS) - Once you have the basics down. You probably want to start  to learn about the big data tools you can use and where they are useful. This is where this course comes in handy. The Udemy Big Data AWS course is very helpful in letting you see what tools you can use and what they do. Also, you can assume that if it exists on AWS there is a similar tool on Azure or GCP. 

[8:43](https://www.youtube.com/watch?v=lVj0RlSxTXk&t=523s)​ - Udemy: Taming Big Data with Apache Spark and Python - Hands On!  - Now if you want more specific big data courses I think any course by Frank Kane is great. For example, I am still working through this course and its been a good mix of hands on and high level work.",59,11,nonkeymn,2021-04-19 05:23:11,https://www.reddit.com/r/bigdata/comments/mttt65/online_courses_and_youtube_channels_i_used_to/,0,bigdata
xw7st9,Apache Iceberg Reduced Our Amazon S3 Cost by 90%,,58,6,dnzprmksz,2022-10-05 11:15:18,https://medium.com/insiderengineering/apache-iceberg-reduced-our-amazon-s3-cost-by-90-997cde5ce931,0,bigdata
dveafo,10 billion/2.1 TB YouTube comments,"I crawled YouTube comments for my friends that are into big data. Well, I got an unexpectedly large dataset together.Because of the enormous size, I haven't had time to analyze video and author coverage yet, unfortunately.

Hope you enjoy. Seeders as always appreciated.

More Info: [https://files.mine.terorie.dev/yt/](https://files.mine.terorie.dev/yt/)

`magnet:?xt=urn:btih:18bc22ee0017fb056794f3d7821a942b5c08cc91&dn=YT%5FCOMMENTS%5FTERORIE%5F2019%5F10.ndjson.zst`

*Update:* Added list of the 576,551,936 unique author IDs who posted all those comments.  
*Update #2*: Direct download link is available!",50,15,terorie,2019-11-12 18:45:29,https://www.reddit.com/r/bigdata/comments/dveafo/10_billion21_tb_youtube_comments/,0,bigdata
11xisa7,"This subreddit is littered with low effort blogs and self promotion, to the point of uselessness. There’s essentially no discussion or learning to be had.",,54,12,theArtOfProgramming,2023-03-21 14:38:56,https://www.reddit.com/r/bigdata/comments/11xisa7/this_subreddit_is_littered_with_low_effort_blogs/,0,bigdata
vsirkq,"Iceberg + Spark + Trino + Dagster: modern, open-source data stack installation","I created a docker-compose based installation of a data stack with Iceberg, Spark, Trino, Dagster, and more. I've already delivered two data projects with it and I love it!  Feel free to use it too. Read this [short description](https://zsvoboda.medium.com/modern-data-stack-demo-5d75dcdfba50) for more details and installation steps. Enjoy!",54,13,zdsvoboda,2022-07-06 05:52:49,https://www.reddit.com/r/bigdata/comments/vsirkq/iceberg_spark_trino_dagster_modern_opensource/,0,bigdata
bbiy00,Top 12 Interesting Career in Big Data Field,,52,10,raj11113,2019-04-10 06:54:55,https://i.redd.it/s0htlvquwdr21.jpg,0,bigdata
6y66vi,"Harvard student noted that search requests on ""iphone slow"" spike when new model announced, not so for other makers.",,50,13,weev1,2017-09-05 06:23:34,https://www.nytimes.com/2014/07/27/upshot/hold-the-phone-a-big-data-conundrum.html,0,bigdata
jucwjc,relatable,,52,1,allende1973,2020-11-15 00:50:59,https://v.redd.it/13z0vvhb38z51,0,bigdata
g130k1,The Different Types of Data Analytics,,52,2,TonTona,2020-04-14 10:20:13,https://sonasoft.com/different-types-of-data-analytics/,0,bigdata
mmtkus,Big Data infrastructure alternatives on cloud,,50,10,satishcgupta,2021-04-08 14:55:57,https://i.redd.it/ksyevsr5ryr61.png,0,bigdata
ecq2mx,Finland is making its online AI crash course free to the world,,51,1,Curio_ser,2019-12-19 07:43:46,https://www.theverge.com/2019/12/18/21027840/online-course-basics-of-ai-finland-free-elements,0,bigdata
k9ve9v,Made these for our BI director. You feel me?,,50,4,PracticallyUncommon,2020-12-09 16:49:20,https://i.redd.it/ukzzqc14y6461.jpg,0,bigdata
