id,title,selftext,score,num_comments,author,created_utc,url,gilded,subreddit
j6rkgb,Explore over 74M companies from the whole Europe and beyond,,12,0,coinval_co,2020-10-07 14:13:04,https://www.hithorizons.com,0,bigdata
iorwzm,An interview with Martin Traverso about how the Presto distributed SQL engine reduces complexity and increases flexibility for analytical workloads across heterogeneous data sources at scale.,,11,0,blarghmatey,2020-09-08 11:32:37,https://www.dataengineeringpodcast.com/presto-distributed-sql-episode-149/,0,bigdata
ighgp4,An interview about how LinkedIn designed their metadata management platform and how it is being used to power data discovery and integration.,,13,0,blarghmatey,2020-08-25 18:03:12,https://www.dataengineeringpodcast.com/datahub-metadata-management-episode-147/,0,bigdata
i3kcld,Data Isn’t Safe With American Companies Either,,12,0,Antwanian,2020-08-04 14:31:56,https://medium.com/@austimullins/data-isnt-safe-with-american-companies-either-a08a84180352,0,bigdata
hvdq22,How Very Real Bots Spread Very Fake Science News,,13,12,scottsteinberg,2020-07-21 19:13:46,https://youtu.be/L5gyarpvaYw,0,bigdata
gyh8mc,"DataOps: What, Why and How?",,12,2,analyticsinsight,2020-06-07 18:11:07,https://www.analyticsinsight.net/dataops-what-why-and-how/,0,bigdata
glhbet,Spark Partitions,,12,1,luminoumen,2020-05-17 15:31:02,https://luminousmen.com/post/spark-partitions,0,bigdata
gj1am1,Principles of lazy data documentation — and how to get your team onboard,"Great blog on how to make data documentations less painful. Curious as to how others have gained buy in from their team for data documentation testing?

https://blog.quiltdata.com/principles-of-lazy-data-documentation-and-how-to-get-your-team-onboard-bb674b78ea73",11,1,superconductiveKyle,2020-05-13 15:35:10,https://www.reddit.com/r/bigdata/comments/gj1am1/principles_of_lazy_data_documentation_and_how_to/,0,bigdata
fopxg1,"Data Teams Going ""Remote"" - Challenges, Learnings & Observations","Folks, how are you and your data teams impacted in the current situation? Has the ""remote"" transition been easy? While my team is working hard with IT/admin to resolve their access issues + tool/tech setup, I was wondering if you had any useful tips, challenges you faced or learnings you'd like to share? Especially the impact on intangibles like collaboration, productivity/agility, comms...",13,15,2121varuag,2020-03-25 13:05:01,https://www.reddit.com/r/bigdata/comments/fopxg1/data_teams_going_remote_challenges_learnings/,0,bigdata
fcrge1,What are the options for a free hadoop stack in 2020 (and years to come),"Hi everyone, I'm a newly-transformed data engineer and searching for hadoop installation recently.

I've heard that you can just install CDH or HDP and call it a day. But after digging around I've noticed the following facts (please correct me if wrong):

- Cloudera Express was the only free edition of CDH, and now [Cloudera has discontinued it for CDH 6.3.3 and above][cdh]. That means CDH as a binary distributable is not accessible for free anymore (except for trial use of course).
- As Hortonworks merged with Cloudera, HDP 3.1.5 and above is not freely accessible anymore. [The documentation basically says][hdp] that you have to be a Cloudera customer to access the binaries.

At this point, I'm a little bit reluctant to install CDH or HDP as knowing that I'm not going to getting any upgrades (except by paying).

So what are other options to install hadoop?

Surely I can install upstream components individually by hand. But that's really painful and not good for management in general.

[cdh]: https://docs.cloudera.com/documentation/enterprise/6/6.3/topics/install_software_cm_wizard.html#id_abd_dtm_25
[hdp]: https://docs.cloudera.com/HDPDocuments/Ambari-2.7.5.0/bk_ambari-installation/content/access_ambari_paywall.html",14,20,naitree,2020-03-03 08:05:00,https://www.reddit.com/r/bigdata/comments/fcrge1/what_are_the_options_for_a_free_hadoop_stack_in/,0,bigdata
elaonj,A gentle Introduction to Big Data. Hope it helps the community !!,,13,1,ashishmg,2020-01-07 12:04:10,https://www.datacloudschool.com/2020/01/introduction-big-data-analytics.html,0,bigdata
eh3i00,8 Top Big Data Analytics Trends That Will Dominate 2020,,11,0,Big_Data_Path,2019-12-29 08:07:30,https://bigdatapath.wordpress.com/2019/12/29/8-top-big-data-analytics-trends-that-will-dominate-2020/,0,bigdata
efbr3d,Artificial intelligence vs Machine Learning vs Deep Learning,,12,7,Big_Data_Path,2019-12-25 04:07:18,https://bigdatapath.wordpress.com/2019/12/25/artificial-intelligence-vs-machine-learning-vs-deep-learning/,0,bigdata
e8n1qq,Spark SQL Date and Time Functions,,13,0,Sparkbyexamples,2019-12-10 06:38:11,https://sparkbyexamples.com/spark/spark-sql-date-and-time-functions/,0,bigdata
e1alps,Artificial Intelligence vs. Machine Learning vs. Data Mining 101 – What’s the Big Difference?,,13,0,Big_Data_Path,2019-11-25 04:15:36,https://bigdatapath.wordpress.com/2019/11/25/artificial-intelligence-vs-machine-learning-vs-data-mining-101-whats-the-big-difference/,0,bigdata
dffa16,"You are not Google, LinkedIn or Amazon",,12,5,TheTesseractAcademy,2019-10-09 10:47:09,https://thedatascientist.com/you-are-not-google-linkedin-or-amazon/,0,bigdata
c6cv78,Using AWK and R to parse 25tb,,14,1,CrankyBear,2019-06-27 23:46:53,https://livefreeordichotomize.com/2019/06/04/using_awk_and_r_to_parse_25tb/,0,bigdata
c5fyel,7 Fastest-Growing Job Roles In Data Science & How To Work Towards Them,,13,0,TheTesseractAcademy,2019-06-25 21:45:45,https://www.analyticsindiamag.com/7-fastest-growing-job-roles-in-data-science-how-to-work-towards-them/,0,bigdata
bov8b3,"Apache Flink: Flux capacitor, huh? Temporal Tables and Joins in Streaming SQL",,14,0,Marksfik,2019-05-15 08:19:14,https://flink.apache.org/2019/05/14/temporal-tables.html,0,bigdata
bokiiu,Optimisation vs Prediction (part 2): Optimisation examples,,13,0,TheTesseractAcademy,2019-05-14 15:39:28,https://www.youtube.com/watch?v=fvECPP_koqE&t=1s,0,bigdata
bjski7,IBM Data Science Professional Certificate on Coursera,"&#x200B;

https://reddit.com/link/bjski7/video/kepucrro1rv21/player

Data Science has been ranked as one of the hottest professions and the demand for data practitioners is booming. This [Professional Certificate from IBM](https://www.coursera.org/specializations/ibm-data-science-professional-certificate) is intended for anyone interested in developing skills and experience to pursue a career in Data Science or Machine Learning.  

This program consists of 9 courses providing you with latest job-ready skills and techniques covering a wide array of data science topics including: open source tools and libraries, methodologies, Python, databases, SQL, data visualization, data analysis, and machine learning. You will practice hands-on in the IBM Cloud using real data science tools and real-world data sets.  It is a myth that to become a data scientist you need a Ph.D. 

This Professional Certificate is suitable for anyone who has some computer skills and a passion for self-learning. No prior computer science or programming knowledge is necessary. We start small, re-enforce applied learning, and build up to more complex topics.  Upon successfully completing these courses you will have done several hands-on assignments and built a portfolio of data science projects to provide you with the confidence to plunge into an exciting profession in Data Science. In addition to earning a Professional Certificate from Coursera, you will also receive a digital Badge from IBM recognizing your proficiency in Data Science. 

[**IBM Data Science Professional Certificate on Coursera - Enroll Now & Get Ready for The Future**](https://www.coursera.org/specializations/ibm-data-science-professional-certificate)",11,5,skilluponline,2019-05-02 08:37:15,https://www.reddit.com/r/bigdata/comments/bjski7/ibm_data_science_professional_certificate_on/,0,bigdata
bekyfa,People Trust AI to be Better Leaders than Politicians - Toks Tech,,13,4,cryptokunbo,2019-04-18 12:29:12,https://www.toks.tech/people-trust-ai-to-be-better-leaders-than-politicians/,0,bigdata
b1lo79,Looking for Big data online class," 

Being an IT engineer, I am exploring the Big Data specialization and wishing to earn a certificate in that field to help me get a new job later.

I've been looking around and found these two specializations:

* [Data Science Specialization](https://www.coursera.org/specializations/jhu-data-science) from **John Hopkins University**
* [Big Data Specialization](https://www.coursera.org/specializations/big-data) from **UC San Diego**

I was hoping someone with experience in the field to advise on which to pick as it will be a big investment in time (months) and effort.

Any other suggestion out of the list is welcome.

Thank you!",12,9,dEnissay,2019-03-15 23:20:24,https://www.reddit.com/r/bigdata/comments/b1lo79/looking_for_big_data_online_class/,0,bigdata
aphn2w,Free Webinar On Data Engineering And ETL Development With Python And SQL,,12,1,nonkeymn,2019-02-11 16:00:23,https://medium.com/swlh/free-webinar-on-etl-development-with-python-and-sql-e974f388051c,0,bigdata
aldthz,"Hive complex type processing via HQL macros (No lateral view, no java)","I wrote some hive udfs you can use with a macro to process complex types without lateral view or custom udfs.

I wrote about them here:
https://tech.trivago.com/2019/01/30/a-new-functional-approach-to-complex-types-in-apache-hive/

they are open sourced aswell. https://github.com/trivago/hive-lambda-sting

Let me know what you think. 

Thanks to trivago for offering me the time to do this",12,0,None,2019-01-30 15:34:47,https://www.reddit.com/r/bigdata/comments/aldthz/hive_complex_type_processing_via_hql_macros_no/,0,bigdata
aihul4,An Interview With The Founding Members Of The LEGO Big Data Team,,12,1,blarghmatey,2019-01-22 01:59:17,https://www.dataengineeringpodcast.com/lego-enterprise-big-data-episode-66/,0,bigdata
agmxf8,The Three Components of a Big Data Data Pipeline,,12,0,eljefe6a,2019-01-16 16:38:12,http://www.jesse-anderson.com/2019/01/the-three-components-of-a-big-data-data-pipeline/,0,bigdata
agh2pc,Data is the most valuable asset ever created.,"Data is the fuel for the 4th Revolution. I seem to find myself explaining this constantly, so I put together a brief explanation of this, just in case anyone also finds themselves constantly in the same position :) Feedback is welcome!

https://www.youtube.com/watch?v=JaIpEg7VfgQ",12,1,DemocratizedWisdom,2019-01-16 03:39:42,https://www.reddit.com/r/bigdata/comments/agh2pc/data_is_the_most_valuable_asset_ever_created/,0,bigdata
abr777,1.1 Billion Taxi Rides: Spark 2.4.0 versus Presto 0.214,,14,7,marklit,2019-01-02 07:34:39,https://tech.marksblogg.com/billion-nyc-taxi-rides-spark-2-4-versus-presto-214.html,0,bigdata
a598li,Codecademy Vs DataCamp Vs Dataquest: Which one is better for taking it upon for pursuing data analytics? Price or otherwise?,,11,1,vigbig,2018-12-11 18:05:00,https://www.reddit.com/r/bigdata/comments/a598li/codecademy_vs_datacamp_vs_dataquest_which_one_is/,0,bigdata
a2n1xo,"What is Data Analytics? Definition, Types, Software, and Use Cases",,13,1,lady_monsoon,2018-12-03 09:15:50,https://theappsolutions.com/blog/development/what-is-big-data-analytics/,1,bigdata
9v2ern,The top 10 data and analytics conferences to attend in 2019,,12,1,CrankyBear,2018-11-07 19:19:40,https://www.hpe.com/us/en/insights/articles/the-top-data-and-analytics-conferences-to-attend-in-2019-1811.html,0,bigdata
9tla1f,Avro or Parquet???,,11,11,stackchief,2018-11-02 15:49:35,https://www.stackchief.com/blog/Hadoop%20Data%20Formats%3A%20Avro%20or%20Parquet%3F,0,bigdata
9sd68d,How Netflix Is Using Jupyter Notebooks In Production (Interview),,12,0,blarghmatey,2018-10-29 13:40:26,https://www.dataengineeringpodcast.com/using-notebooks-as-the-unifying-layer-for-data-roles-at-netflix-with-matthew-seal-episode-54/,0,bigdata
9rswkq,Is Hadoop Officially Dead?,,12,19,None,2018-10-27 08:59:41,https://www.datanami.com/2018/10/18/is-hadoop-officially-dead/,0,bigdata
9rdp35,What are good Interview prep materials/questions and Sample Projects for Senior Big Data Engineer/ Architect level positions?,"What are good Interview prep materials/questions and Sample Projects for Senior Big Data Engineer/ Architect level positions.

I want to brush up on architecture of below Big data technologies and also solution and application architectures using below popular projects/technologies of the big data ecosystem,

like Spark, Spark Streaming, Storm, Hive, Pig, Tez, Hadoop, MapReduce, Kafka, Flume, YARN, MongoDB, Cassandra?

Could someone point me to such resources?",11,1,astrostar3,2018-10-25 19:56:25,https://www.reddit.com/r/bigdata/comments/9rdp35/what_are_good_interview_prep_materialsquestions/,0,bigdata
9hmiad,"Hey Quadrant Fans, checkout this tweet, from Quadrant Protocol's team. 👉 Our CEO Mike Davie met Nam Nguyen, Chief Strategy Officer of Vietnam Blockchain Capital to discuss how to plug Quadrant into the Vietnam scene! Read more here!",,11,1,Cy4cent,2018-09-21 05:28:44,https://twitter.com/exploreQuadrant/status/1042930157500227585?s=20,0,bigdata
9h5qon,Banyan Network: The 3 Laws of Data Value (3 min),,11,0,mauvaison,2018-09-19 14:43:04,https://medium.com/@garymensah/banyan-network-the-3-laws-of-data-value-d9f143f326dc,0,bigdata
941wb6,Data Scientist Interviews Demystified,,11,0,DanClark-KDnuggets,2018-08-02 18:32:42,https://www.kdnuggets.com/2018/08/data-scientist-interviews-demystified.html,0,bigdata
92bmfj,Kafka on Kubernetes with Local Persistent Volumes,,14,1,matyix_,2018-07-27 11:15:09,https://banzaicloud.com/blog/kafka-on-kubernetes/,0,bigdata
8otxoz,New site that ranks the most popular data science tools,,12,6,justinontheshore,2018-06-05 19:52:14,https://datas.ci/ence,0,bigdata
8m1vzk,Use AWS Glue to run ETL jobs against non-native JDBC data sources | Amazon Web Services,,14,0,TomorrowsMom,2018-05-25 13:49:33,https://aws.amazon.com/blogs/big-data/use-aws-glue-to-run-etl-jobs-against-non-native-jdbc-data-sources/,0,bigdata
8f1f2d,Hadoop 3: Comparison with Hadoop 2 and Spark,,13,0,viktoriia_shulga,2018-04-26 09:46:40,https://www.activewizards.com/blog/hadoop-3-comparison-with-hadoop-2-and-spark/?utm_source=reddit&utm_medium=bigdata&utm_campaign=hadoop,0,bigdata
80mprc,Apache Nifi vs Gobblin vs Others?,"Hi All,

I am assessing a big-data project, we would need to pull lots of big data sets from various internet sources (ftp, api, etc), do light transformations and light data quality / sanity checking (eg: row and columnar inspections), and push it downstream. Immediate focus is batchy, but anticipate supporting streaming down the line. Ease of support at scale is a focus..

We are looking at Apache Nifi and Gobblin, which seem to overlap in intention. What sort of use cases fit which platform best? How would they compare for the use case above? What other pieces should I be looking at?

Thanks!",12,4,mdw__,2018-02-27 14:13:47,https://www.reddit.com/r/bigdata/comments/80mprc/apache_nifi_vs_gobblin_vs_others/,0,bigdata
80m0zk,A Comparison of Deep Learning Frameworks,,12,0,y-emre,2018-02-27 12:23:15,https://www.exastax.com/deep-learning/a-comparison-of-deep-learning-frameworks/,0,bigdata
7u1kc7,"Bokeh vs Dash, which is the alternative for Shiny in Python?",,12,1,fl4v1,2018-01-30 15:00:36,https://medium.com/p/bokeh-vs-dash-which-is-the-best-dashboard-framework-for-python-c5b576375f7f,0,bigdata
7mm2r3,How I became a Data Engineer from Backend Engineering,,13,0,None,2017-12-28 11:26:04,https://medium.com/@ssola/becoming-a-data-engineer-5e0f14048d42,0,bigdata
7jqxhz,"In China, a Three-Digit Score Could Dictate Your Place in Society",,14,2,pmillerbd,2017-12-14 11:08:35,https://www.wired.com/story/age-of-social-credit/,0,bigdata
7i5soe,Why you shouldn’t use pie charts - Tips for better data visualization,,11,1,berkes,2017-12-07 11:26:49,https://blog.funnel.io/why-we-dont-use-pie-charts-and-some-tips-on-better-data-visualizations,0,bigdata
7cfeqw,Deconstructing Data Science,"Hey everyone! 👋

Yesterday I launched the second post of a new Data Science blog, where I’m open-sourcing every resource I find and insight I come across in pursuit of becoming a world-class (top 5%) Data Scientist in < 6 months.

The purpose of this post is to empower others to start accelerating their own learning by:

1) deconstructing the complex craft of Data Science into it’s simple micro-skills

2) identifying the 20% of skills that contribute to 80% of outcomes

I'm writing this with learners like you and I in mind, so if you're also interested in accelerating your learning, check it out & feel free to share around:

https://ajgoldstein.com/2017/11/12/deconstructing-data-science/",11,1,ajva1996,2017-11-12 13:35:10,https://www.reddit.com/r/bigdata/comments/7cfeqw/deconstructing_data_science/,0,bigdata
7a42ba,Career progression within big data,"Hey everyone, wanted to ask you all on this sub about your experience with data and how your career has progressed or even where you've seen colleagues progress.

I'm a data engineer myself at a consulting company, so I've been exposed to tons of different areas/technologies but don't have a lot of deep experience with them. Example- I don't know the Hadoop stack very well or even Spark, and I know a lot of groups are slowly migrating away from Hadoop. My background is in ETL development, and as of late some broad work in AWS.

I always see job postings asking for experience with data science - machine learning, modeling, etc. How much knowledge in that domain do you guys have? Would a cursory understanding of data science would pretty beneficial for data engineers like myself down the road? 

 I ask because I haven't seen many data engineers progress into management, and I'm trying to see what the possibilities are down the road.",12,3,iarcfsil,2017-11-01 14:53:53,https://www.reddit.com/r/bigdata/comments/7a42ba/career_progression_within_big_data/,0,bigdata
7a0yko,Best-Ever Algorithm Found for Huge Streams of Data,,12,2,based2,2017-11-01 02:56:26,https://www.quantamagazine.org/best-ever-algorithm-found-for-huge-streams-of-data-20171024/,0,bigdata
78iz3w,New sub for sharing open source databases: OSDB • r/osdb,,12,0,toadlyBroodle,2017-10-24 21:26:40,https://www.reddit.com/r/osdb/,0,bigdata
76vp4m,Getting confused between all of the pipeline/etl tools,"So the picture is getting quite blurry between all of the pipeline/etl tools available. 

Specifically:

 * Apache NiFi
 * Apache StreamSets
 * Luigi 
 * Airflow 
 * Falcon
 * Oozie
 * A Microsoft solution?

I've got several projects that I could see a use for a pipeline/flow tool where ETLing is the point of the entire project. So what are the strengths and weaknesses of each? Where should I be using one or the other? Where does one shine where the other would be difficult to manage or be overkill for the project? Which would be the most light-weight of the tools? 

I have several projects but have two stick out in my mind. They are completely unrelated to each other at all. They do NOT overlap at all.

1) The project is a simple ETL for XML data. In simple terms, 20 or so machines write out XML log data to their local drive that is shared on the network. A python application connects to each machine's share, copies the data to the local system for archival purposes of the raw data. The same application reads the XML data from the files, extracts all of the relevant content from the XML files and stores it into a Microsoft SQL Server database. Currently the application gets run every 20 minutes through a Huey cronjob task in Python to look for new data on the share. This is a Windows-only application/ecysystem so using something in the MS world isn't out of the question either (hence why I included it).

2) The second project is more ""pipeline"". We have about 2 million files that will need to run through a process of a) Original Format --> b)Converted to an industry standard format --> c) data massaged to fit our need --> d)Data converted --> e) intermediate results are written out to disk --> f)data use to train deep learning model to train model. 

For inference of a file, steps a), b), c), d), e), f) would be performed. Step f) would be replaced with the inference of the model and then f) would pass results down to g) (another application). This is initially going to be done on Linux that they want to end up (potentially) on Windows with so that could be a consideration.

So for these what would you end up choosing? 
",12,21,kur1j,2017-10-17 02:47:29,https://www.reddit.com/r/bigdata/comments/76vp4m/getting_confused_between_all_of_the_pipelineetl/,0,bigdata
72ozlt,Strava's data lake for all of our activity data streams,,12,0,micahville,2017-09-27 01:18:56,https://medium.com/strava-engineering/from-data-streams-to-a-data-lake-b6ca17c00a23,0,bigdata
71iutn,"Can someone help me understand this sentence: ""You don’t use Hadoop for anything where you need low-latency results.""","I'm reading this book ""Big Data Principales and best practices of scalable realtime data systems"" and there's this paragraph: 

> Hadoop, for example, can parallelize large-scale batch computations on very large
amounts of data, but the computations have high latency. You don’t use Hadoop for
anything where you need low-latency results.

What do they mean exactly in the last sentence please give examples.",14,13,nomadProgrammer,2017-09-21 12:43:26,https://www.reddit.com/r/bigdata/comments/71iutn/can_someone_help_me_understand_this_sentence_you/,0,bigdata
6xhetv,Taming Big Data with Apache Spark and Python,,12,0,dnonsense,2017-09-01 20:56:41,https://medium.com/@mrtech/taming-big-data-with-apache-spark-and-python-hands-on-142923510309,0,bigdata
6sncs8,Generalists Dominate Data Science,,13,0,rjurney,2017-08-09 18:13:21,https://blog.datasyndrome.com/generalists-dominate-data-science-f01882f25347,0,bigdata
6qncnm,1.1B Taxi Rides Benchmark On The GPU- And PostgreSQL-Powered BrytlytDB,,12,0,marklit,2017-07-31 09:35:22,http://tech.marksblogg.com/billion-nyc-taxi-rides-aws-ec2-p2-16xlarge-brytlytdb.html,0,bigdata
6n7qmn,The top Big Data skills to master in 2017. Why and How? Get Answered,,13,3,shauryasinha,2017-07-14 08:20:55,http://www.springpeople.com/blog/top-big-data-skills-that-are-high-in-demand/,0,bigdata
6j7791,Visualization and large-scale processing of historical weather radar (NEXRAD Level II) data (4 days of processing in less than an hour with Dataflow),,12,0,fhoffa,2017-06-24 08:55:04,https://cloud.google.com/blog/big-data/2017/06/visualization-and-large-scale-processing-of-historical-weather-radar-nexrad-level-ii-data,0,bigdata
6ha5jj,Top 7 Big Data Use Cases in Insurance Industry,,13,0,yagmurnur,2017-06-14 20:19:08,https://www.exastax.com/big-data/top-7-big-data-use-cases-in-insurance-industry/,0,bigdata
6axlkk,Apache NiFi MiNiFi C++ 0.2.0 release,,11,0,based2,2017-05-13 12:34:30,http://mail-archives.apache.org/mod_mbox/www-announce/201705.mbox/%3C4C394A2C-C116-411C-83DD-5F2C44077D79%40apache.org%3E,0,bigdata
6ag267,"After Lambda: Exactly-once processing in Google Cloud Dataflow, Part 1",,12,0,fhoffa,2017-05-10 22:17:55,https://cloud.google.com/blog/big-data/2017/05/after-lambda-exactly-once-processing-in-google-cloud-dataflow-part-1,0,bigdata
68zptv,"Looking to start out with data analytics? then this podcast may help - An chat with Microsoft's Amy Nicholson talking about how analytics is helping us all to make more complex decisions and to augment our day to day jobs, not replace them.",,11,0,techstringy,2017-05-03 11:22:01,https://techstringy.wordpress.com/2017/05/02/telling-data-stories-amy-nicholson-ep-25/,0,bigdata
68udtf,Caching out of Hadoop: How New York Times Embraces New Technology - The New Stack,,12,0,thetinot,2017-05-02 17:01:49,https://thenewstack.io/caching-hadoop-new-york-times-embraces-new-technology,0,bigdata
64xojd,Is there such a thing as unstructured data?,"Was having a debate with a few mates, the topic of unstructured and semi-structured came up.  We were debating whether any data is truly unstructured. 

Our thinking concluded, if the data exists, it must have some basic structure, even if it is at a meta level. 

Twitter data for example, typically regarded as unstructured, but data are organized into tweets, tweets have a user attached, they may or may not have hashtags, may or may not be a DM, they have a time and date stamp, etc. So there is some primitive structure.  Depending on the language of the data, there may be sentence structure, punctuation, etc.   It convinced me to stop using the term ""Unstructured Data"" until I can prove any exists.",11,7,NotSure2505,2017-04-12 11:57:41,https://www.reddit.com/r/bigdata/comments/64xojd/is_there_such_a_thing_as_unstructured_data/,0,bigdata
608b01,A Simple Blood Test for Autism? Study’s Use Of ‘Big Data’ Validates Early Intervention,,13,0,None,2017-03-19 03:54:26,https://www.studyfinds.org/autism-blood-test-diagnosis-study/,0,bigdata
5y9u48,How much data is being created during a second on the internet,,12,1,bigdatahero,2017-03-08 19:00:12,https://i.redd.it/ss9ftzoie8ky.png,0,bigdata
5wump5,"Data Science, Big Data, AI Events and Conferences 2017",,12,4,BigCloudTeam,2017-03-01 09:35:47,http://www.bigcloud.io/data-science-dates-2/,0,bigdata
5skesy,Any good blogs that is updated regularly on bigdata trends and developments?,,12,5,Raul2351987,2017-02-07 09:14:23,https://www.reddit.com/r/bigdata/comments/5skesy/any_good_blogs_that_is_updated_regularly_on/,0,bigdata
5o9bmj,Apache Beam established as a new top-level project,,10,18,based2,2017-01-16 06:34:50,https://beam.apache.org/blog/2017/01/10/beam-graduates.html,0,bigdata
