id,title,selftext,score,num_comments,author,created_utc,url,gilded,subreddit
mpmk0h,Geographic map of the United States,,17,1,spaceborat,2021-04-12 20:26:09,https://i.redd.it/try0zw1gxss61.jpg,0,dataviz
13l00vc,What type of graph is this?,I was thinking a tree diagram but open to your thoughts on this. Not my imageor graph obviously. .,14,2,Daily101Cyber,2023-05-18 14:01:22,https://i.redd.it/c6mdouby0n0b1.png,0,dataviz
ja8p8u,"Number of Covid cases per states over time, pretty enlightening (and red...) ! Source in the comments",,15,3,TheoMerca,2020-10-13 07:27:11,https://v.redd.it/x1brmz5sdts51,0,dataviz
9rjre4,The small multiples bar chart house,,14,0,gionni78,2018-10-26 11:05:51,https://i.redd.it/1xaf3r6diiu11.jpg,0,dataviz
71j2v6,Data Viz Project - the most comprehensive archive of data visualizations.,,9,4,ferdiocom,2017-09-21 13:22:56,http://datavizproject.com,0,dataviz
6z5mk5,How to Generate FiveThirtyEight Graphs in Python,,12,0,dataphysicist,2017-09-10 01:37:23,https://www.dataquest.io/blog/making-538-plots/,0,dataviz
o1b40t,I’ve got over ten years of active reddit data on my account. What can I do with it?,"I’m hoping that there’s some easy way to import the data into something that can create interesting visuals or identify trends on how my preferences changed over time. 

I was thinking about maybe writing a book about my last ten years and since my reddit account is 10 years old it’s an interesting potential source of personal insight.",9,1,tokin4torts,2021-06-16 18:01:21,https://www.reddit.com/r/dataviz/comments/o1b40t/ive_got_over_ten_years_of_active_reddit_data_on/,0,dataviz
ha76rr,What do you calm this kind of chart?,,9,8,joenewlin,2020-06-16 16:22:34,https://i.redd.it/h91pt6swsa551.jpg,0,dataviz
k6z7gj,Does anyone recognize what software created this?,,8,4,lifeasart,2020-12-05 02:25:48,https://i.redd.it/bm0ctkz64a361.png,0,dataviz
hrvnay,Eating McDonalds at the same rate minimum wage pays for it,,8,0,dontnormally,2020-07-15 20:41:10,https://www.youtube.com/watch?v=WAfSiXiOXmE&feature=emb_title,0,dataviz
bdvvdq,"dataviz.tools: A curated guide to the best tools, resources and technologies for data visualization",,7,0,prdmagnet,2019-04-16 16:20:36,https://dataviz.tools/,0,dataviz
179e6ba,Spotify - Analysis of Audio Features,,7,1,ShockSir,2023-10-16 19:19:45,https://i.redd.it/wxq15b7c7mub1.png,0,dataviz
nufitx,"What do you think of a no-code tool that can help you to interact with databases (like MongoDB, PostgreSQL) and APIs?","Trying to explore data from databases isn’t the most fun thing to do for a non-technical person. Is it?

That’s why we are building a tool to interact with databases and APIs. So anybody can explore data at a much faster speed than before. You don’t have to write a single line of code and any non-technical user can use it

Currently, we are testing with DynamoDB, PostgreSQL and SQL.

Is there anything that we should keep in mind while building it?

We are looking for some feedback.

If anyone would like early access please comment below and I’ll send you a link.

Does anyone see this being helpful? Would love to hear your feedback!

Thanks in advance!

:)

[ Dolo - The fastest way to get insights with internal data.](https://preview.redd.it/zsco314g5v371.png?width=1920&format=png&auto=webp&s=82513a06ed679833c06d516822d7469767e96e02)",7,1,imrityunjoybora,2021-06-07 15:37:57,https://www.reddit.com/r/dataviz/comments/nufitx/what_do_you_think_of_a_nocode_tool_that_can_help/,0,dataviz
lx2e41,Interactive data exploration and data science for everyone,,7,0,_paige_joseph,2021-03-03 19:36:55,http://omnisci.link/o71c60,0,dataviz
ip2bos,The Storygram,,8,5,FranzFlueckiger,2020-09-08 21:12:42,https://v.redd.it/axecl692czl51,0,dataviz
hr6ehr,black women in data viz?,"i'm trying to find a data-viz portfolio, specifically one for a black female designer. i've found one black woman who's a designer but has worked in house for a long time and doesn't have a portfolio, as far as i can tell (i have asked and haven't heard back). who are some black american women in the data-visualization design field? or infographic design? help?",8,6,wordgirrl,2020-07-14 17:59:24,https://www.reddit.com/r/dataviz/comments/hr6ehr/black_women_in_data_viz/,0,dataviz
bhlgj5,5 Papers about high-dimensional data visualization,,7,1,f1789,2019-04-26 11:56:49,http://www.thinkingondata.com/5-papers-about-high-dimensional-data-visualization/,0,dataviz
bf2gcz,Why EU Regions are Redrawing Their Borders,,7,0,alexd_ricci,2019-04-19 18:21:55,https://pudding.cool/2019/04/eu-regions/,0,dataviz
5zjepy,"It’s beautiful, but is it actionable? Learn how data, design, and psychology create an impact",,6,3,lolnette,2017-03-15 13:43:16,http://maass.us/KlVJ309MRzF,0,dataviz
vijqec,Working on tools to markup charts with Chart.js,,6,1,aviddabbler,2022-06-23 00:23:46,https://v.redd.it/qta07ljhl9791,0,dataviz
ul16pp,"Started implementing Bret Victors ideas from ""Drawing Dynamic Visulizations""","Hi,

in 2013 Bret Victor gave a talk called ""Drawing Dynamic Visualizations"", where he demonstrates a software, that allows the user to create data driven graphics by primarily using tools and functions known from drawing software. To my knowledge he never published the software. So some months ago I started implementing my own version of his ideas as a web application.

At [https://dapentry.com](https://dapentry.com) you can find a first, early version of my progress so far. You can

* Draw basic shapes: Rectangles, circles, Lines, Polygons
* Use basic transformations: Move, rotate, scale
* Change some style: Fill color, stroke color, stroke width
* Use simple text objects
* Loop things
* Create data fields for: Single values, value lists and tables
* Use data fields in the drawing to make shapes and transformations dependend on data
* Export the drawing as SVG
* Export the drawing as a JS-library to use on your own website.
* You can create an account and store your designs in a global library (this functionality is very basic)
* You can use drawings from the library in your own drawing (cannot be exported to JS right now)

Maybe some of you want to check it out. I'd appreciate it. There's definetely bugs and it can sometimes be finicky to use.

At [https://cheat.dapentry.com](https://cheat.dapentry.com) is a cheat sheet. Documentation is in the works.

There's also stuff missing I'd like to add like

* Support the instancing of drawings in JS-export
* Conditional drawing: Bret didn't use it in his presentation but discusses it in the talk notes on his website
* Make colors data dependent
* Drawing arcs
* Bezier curves
* Snapping to intersections
* ...

Bret Victors talk: [https://vimeo.com/66085662](https://vimeo.com/66085662)

His talk notes: [http://worrydream.com/#!/DrawingDynamicVisualizationsTalkAddendum](http://worrydream.com/#!/DrawingDynamicVisualizationsTalkAddendum)",5,2,drawable,2022-05-08 13:00:02,https://www.reddit.com/r/dataviz/comments/ul16pp/started_implementing_bret_victors_ideas_from/,0,dataviz
uhn785,"Free and open source data visualization software LabPlot publishes version 2.9. It comes with color maps and conditional formatting, box plots, support for MATLAB, SAS, Stata and SPSS formats, improved performance, and more.",,5,0,Bro666,2022-05-03 18:59:23,https://labplot.kde.org/2022/05/03/labplot-2-9-released/,0,dataviz
oatzkc,"Divinecomedy.digital: a new groundbreaking project that applies data visualization to digital humanities. The first multimedia application that uses data visualization to collect, catalogue and make works of art interact with the Divine Comedy.",,6,0,The_Visual_Boy,2021-06-30 09:52:38,https://divinecomedy.digital/#/,0,dataviz
o7q2li,"Open-source list of data visualization tools (charts, data grids, maps, etc.) for software engineers",,5,0,igorlukanin,2021-06-25 15:33:50,https://awesome.cube.dev,0,dataviz
mrmamu,12 Color Palettes for Telling Better Stories with Your Data,,7,1,_paige_joseph,2021-04-15 19:36:36,http://omnisci.link/t99hjj,0,dataviz
m6eqvo,Time-Series Forecasting with Facebook Prophet and OmniSci,,7,0,_paige_joseph,2021-03-16 17:43:03,http://omnisci.link/tcgia0,0,dataviz
m0ly74,4 Simple Ways to Map Vehicle Location Data with OmniSci Free,,7,0,_paige_joseph,2021-03-08 18:12:33,http://omnisci.link/wbpd2o,0,dataviz
jx9c7k,I hadn't yet seen an interactive chart that captures the full connections between COVID and US politics... so I wrote my own,,6,1,PixelWrangler,2020-11-19 19:24:51,https://robjagnow.com/politics_of_covid/,0,dataviz
iwz1gm,D3.js Basics - Selections and Selecting Elements,,6,0,DataCrayon,2020-09-21 12:01:40,https://datacrayon.com/posts/visualisation/visualisation-with-d3/selections-and-selecting-elements/,0,dataviz
g160hu,Video visualizes deaths caused by each of the worst pandemics in history (including long-term/multi-decade events like HIV/AIDS). Puts into perspective how insane some of these events really are and why being safe now to stop spread is so important.,,7,0,CircleBat,2020-04-14 13:59:25,https://www.youtube.com/watch?v=v743pmwuPIY,0,dataviz
f2nvo1,Hot and Crazy MATRIX / Cute and Money MATRIX,,6,0,HeWhoCreeps,2020-02-12 07:59:16,https://www.youtube.com/watch?v=R_USJCTIgs4&feature=emb_logo,0,dataviz
b9psbu,5 Rules for Clarity in Data Visualization,,6,0,estatarde,2019-04-05 11:04:16,https://www.monterail.com/blog/rules-rules-of-data-visualization?utm_medium=social&utm_source=reddit&utm_campaign=dataviz,0,dataviz
a98hu2,The Top 5 Free Alternatives to Tableau,,8,1,walkiriatellez,2018-12-24 20:33:47,http://dotcomwriters.com/2018/12/24/the-top-5-free-alternatives-to-tableau/,0,dataviz
717vx2,The toolkit for the modern data ninja,,6,0,benrudolph,2017-09-20 01:51:13,https://medium.com/@_benrudolph/a-data-ninjas-toolkit-abfe11d38fe8,0,dataviz
6hklb4,Just updated: dataviz.tools - 417 highly-curated open-source/freemium data visualization tools,,5,1,carlvlewis,2017-06-16 05:27:54,http://dataviz.tools,0,dataviz
64no05,Visualizing the global Tor network traffic,,6,0,ulasb,2017-04-11 00:54:13,"https://torflow.uncharted.software/#?ML=-42.0556640625,40.01078714046552,4",0,dataviz
5nuq8k,Top 50 ggplot2 Visualizations - The Master List (With Full R Code),,6,1,selva86,2017-01-14 01:26:01,http://r-statistics.co/Top50-Ggplot2-Visualizations-MasterList-R-Code.html,0,dataviz
qgu2s9,The free and open source LabPlot application now lets you easily plot data on multi-axes graphs,,5,0,Bro666,2021-10-27 11:01:15,https://labplot.kde.org/2021/10/27/multi-axes-made-easy/,0,dataviz
q1f59i,"See the effects of climate change on a massive spatiotemporal scale by ingesting, analyzing and visualizing a dataset of over 100 years of temperature and precipitation records.",,5,0,paige_joseph,2021-10-04 21:02:52,https://www.omnisci.com/blog/100-years-100-million-records,0,dataviz
ou0oq9,Is it the right choice?,"Hello team, please I have a question : I am a marketing master degree student, and when I check the job requirements of data analytics field, I found that most companies require an engineering degree, do you think that I made a bad choice? Willing to see your answers. Thank you so much",5,2,Shot-Zookeepergame24,2021-07-29 16:20:07,https://www.reddit.com/r/dataviz/comments/ou0oq9/is_it_the_right_choice/,0,dataviz
itxesx,D3.js Basics - Creating Shape Elements,,5,0,DataCrayon,2020-09-16 15:11:52,https://datacrayon.com/posts/visualisation/visualisation-with-d3/creating-shape-elements/,0,dataviz
ic5lt5,An infographic video that shows how political parties fared in the Indian general elections over the years,,6,0,pheonix_bird,2020-08-18 17:35:36,https://www.youtube.com/watch?v=NfNdF9-YSMw,0,dataviz
gpb651,How to build these visualizations? D3.JS?,,6,1,gavintrololol,2020-05-23 19:40:07,https://meetglimpse.com/?r=3ezdab8qeq,0,dataviz
gleugd,"This program reads the longitude, latitude, temperatures and dates from two different CSV files (dataset) that are provided from the weather stations around the world and visualizes the locations and temperatures into an interactive map for 365 days.",,6,1,code7lab7,2020-05-17 12:47:56,https://v.redd.it/cefy33f5nbz41,0,dataviz
gccxju,"For some odd reason, the bot cross-posted this link into ""Best Data Visualizations of 2016"" which was totally not the right place for it, but was under DataViz, so I'll cross post it here. COVID-19 Is No Worse Than the Flu — And Other Dangerous Myths Busted by Data",,4,0,Paige_Roberts,2020-05-02 20:06:31,https://medium.com/@paigeonthewing/covid-19-is-no-worse-than-the-flu-and-other-dangerous-myths-231383336075,0,dataviz
frny18,Top 15 Countries electricity power consumption per capita History,,6,2,Noonshak,2020-03-30 09:56:49,https://www.youtube.com/watch?v=s6CCnfebaOA,0,dataviz
flvlbw,"I built space-search.io, a search and visualisation tool for satellites & space debris in earth orbit.",,4,0,erwin_H,2020-03-20 14:07:23,/r/datavisualization/comments/fluyod/i_built_spacesearchio_a_search_and_visualisation/,0,dataviz
cklg8m,How to make such data visualization？,"https://www.youtube.com/watch?v=4-2nqd6-ZXg  

what tools were used to make a video in the above URL",4,3,myself659,2019-08-01 08:10:25,https://www.reddit.com/r/dataviz/comments/cklg8m/how_to_make_such_data_visualization/,0,dataviz
brdcrn,Graphs of Thrones | analyzing the change in writing over 8 seasons,,5,3,Mock_Twain,2019-05-21 17:36:56,https://www.ifweassume.com/2019/05/graphs-of-thrones.html,0,dataviz
bq67bz,Introduction to Data Visualization with ggplot2,,5,0,blogueandoatope,2019-05-18 17:03:33,https://www.youtube.com/watch?v=NXjPcXx42Yc,0,dataviz
bndxwo,Elijah Meeks Keynote at Tapestry 2018: Third Wave Data Visualization,,4,0,blogueandoatope,2019-05-11 16:29:07,https://www.youtube.com/watch?v=itChfcTx7ao,0,dataviz
bl0b7q,The science of data visualization,,4,0,blogueandoatope,2019-05-05 17:17:00,https://www.youtube.com/watch?v=l7cAdp0f4X0,0,dataviz
9uhzsr,Career Pivot into Data Visualization,"Hey everyone not sure if this is the right place to ask a career question but I was just wondering what I can do to get into data visualization.  I'm currently a 25 y.o analyst (graduated with bachelor's in 2016) and work full-time with excel all day, everyday.  I think data visualization is really interesting and want to pivot the career that way. I have basic SQL and tableau experience. Would you recommend solely focusing on tableau to take my first step into this career path? Or are there any other recommendations (like picking SQL back up from my studies while getting my bachelor's)?

Any advice is greatly appreciated! Thanks! ",5,1,danver3,2018-11-05 21:49:11,https://www.reddit.com/r/dataviz/comments/9uhzsr/career_pivot_into_data_visualization/,0,dataviz
9bf9gr,My 6yo nephew is a budding data scientist,,5,1,SolusVerita,2018-08-30 01:24:54,https://imgur.com/a/4XMGjee,0,dataviz
8xtpn1,New data viz project illustrates 12 practical tips for effective data visualization,,6,2,Geckoboard,2018-07-10 21:56:09,https://i.redd.it/05m8hrr3qz811.jpg,0,dataviz
8cxy39,"Today the European Union’s highest court ruled that Poland broke environmental laws with large-scale logging in the Bialowieza forest. Satelite imagery, digital cartography and infographics.",,5,0,johndatavizwiz,2018-04-17 16:38:49,https://infografiki.wyborcza.pl/wyrok-na-puszcze/en/,0,dataviz
5e03fo,When Maps Shouldn't be Maps,,6,0,jtsymonds,2016-11-20 20:57:20,http://www.ericson.net/content/2011/10/when-maps-shouldnt-be-maps/,0,dataviz
404t57,Chipotle Locations Plotted with E.coli cases,"This is one of my first data visualizations using D3.  I scraped the data from menuism (it does not have all chipotle locations) and the CDC to get the number of E.coli cases. Would love some feedback on it. 

http://benkrawitz.com/chipotleMap/

Also if anyone is interested here is the repo (feel free to toss me some stars or fork it and add anything else):  https://github.com/benkraw/ChipotleMap  ",5,0,Krawee,2016-01-09 04:15:38,https://www.reddit.com/r/dataviz/comments/404t57/chipotle_locations_plotted_with_ecoli_cases/,0,dataviz
3stli1,7 things I’ve learned by attending the 2015 Data Visualisation Summit in London,,5,0,codeorelse_nl,2015-11-14 21:03:54,http://www.themarketingtechnologist.co/7-things-ive-learned-by-attending-the-2015-data-visualisation-summit-in-london/,0,dataviz
35qojt,What is the name of this chart and how can i do it? is there any online tool?,,5,7,jsmanuel,2015-05-12 18:45:25,http://noosphere.princeton.edu/images/LLNL_US_EFC_20081.png,0,dataviz
10t3jn,Population Pyramids of the whole world from 1950 to 2100 (made using Raphael.js),,4,0,madewulf,2012-10-02 08:29:22,http://populationpyramid.net/,0,dataviz
1agahu7,Americans Are Getting Married Older Than Ever,,5,1,Jaded_Warrior123,2024-02-01 13:02:45,https://i.redd.it/zrnuo27k2zfc1.png,0,dataviz
19ed0el,Top 20 Richest Colleges in the US,,4,1,Jaded_Warrior123,2024-01-24 09:11:37,https://i.redd.it/g0k09ya0ucec1.png,0,dataviz
185asex,what is the name of this chart type?,"Hi all, I really liked this chart and want to use it. What is the name and what is a good tool to generate something like this

https://preview.redd.it/fn6chfs7vx2c1.jpg?width=1536&format=pjpg&auto=webp&s=dfe0cfdc4ad3fc98d86f5ae8d2d469816e43a1a9",3,3,r_spiers,2023-11-27 19:06:45,https://www.reddit.com/r/dataviz/comments/185asex/what_is_the_name_of_this_chart_type/,0,dataviz
12t613u,[OC] Visualizing Max Temperature Trends in the USA,,4,2,transitmapper,2023-04-20 15:57:31,https://youtu.be/C-jwQ8fPun4,0,dataviz
12skuph,Importance of Data-Driven Storytelling: Data Analysis & Visual Narratives,,3,1,Emily-joe,2023-04-20 03:44:13,https://www.dasca.org/world-of-big-data/article/importance-of-data-driven-storytelling-data-analysis-and-visual-narratives,0,dataviz
128l5zp,I would like to improve in my data visualization skills. Someone interested to connect to do so?,"Lately, I've been feeling like my data visualizations haven't improved in months. I'm currently learning how to use Looker, but I'm not getting the results I want in terms of the look and feel of my dashboards.

Would be nice to have a space where we can show what we are doing to get feedback, in order to learn from each other and improve our data visualization skills. 

Do you think this makes sense? I could not find any subreddit to do so, so I created one, but I would be glad to know if there is any community around with this goal, to join.

Thanks for reading, and I hope to see your viz and feedbacks in r/DataVizFeedback!",4,0,Cereghetti-Ivan,2023-04-01 12:38:02,https://www.reddit.com/r/dataviz/comments/128l5zp/i_would_like_to_improve_in_my_data_visualization/,0,dataviz
zjy5xq,The Value of Data Visualization for Data Science Professionals,,4,0,Emily-joe,2022-12-12 12:49:50,https://www.dasca.org/world-of-big-data/article/the-value-of-data-visualization-for-data-science-professionals,0,dataviz
xw4jmp,How I solved 80% of data-related questions with NLP,,4,1,None,2022-10-05 08:09:54,https://v.redd.it/z8qudknm3yr91,0,dataviz
wxjpoh,Wikipedia Outliers — Correlate Wikipedia page views with real-world events,,4,0,igorlukanin,2022-08-25 17:10:18,https://cube-wikipedia-outliers.netlify.app,0,dataviz
vtqi9j,A look at inflation over the last year by looking at the price of coffee and a donut nationwide (U-CPI stats),,4,0,Shilohtd,2022-07-07 19:14:46,https://public.tableau.com/app/profile/shiloh.tillemann.dick/viz/PriceofADonutandCoffeeMay2022/PriceofADonutandCoffeeMay21-May22,0,dataviz
q7shxk,Is there any software that creates dynamic versions of these tree diagrams with date sliders that allow the visualisation of changes to branches and leaves over time?,,5,2,sumant28,2021-10-14 04:37:35,https://looker.com/assets/img/images/blocks/screenshots/viz/tree/tree.gif,0,dataviz
ogg6iv,10 Open Data Sources You Wish You Knew,,4,0,_paige_joseph,2021-07-08 20:51:17,http://omnisci.link/ques8j,0,dataviz
nhvdpm,ArcGIS Insights meet Spotify,"Do you love dataviz and music? There is a mini-course for you! Register for free at [https://www.allthatgeo.com/course/arcgis-insights-my-spotify-data](https://www.allthatgeo.com/course/arcgis-insights-my-spotify-data)

https://preview.redd.it/6vfcljr9th071.png?width=1214&format=png&auto=webp&s=9e834777219d7ce2187685b6129f811040bef7ad",4,0,None,2021-05-21 15:34:39,https://www.reddit.com/r/dataviz/comments/nhvdpm/arcgis_insights_meet_spotify/,0,dataviz
mgklu3,Analyze OpenStreetMap Data with OSMnx and OmniSci Free,,4,0,_paige_joseph,2021-03-30 16:59:11,http://omnisci.link/u0pcz5,0,dataviz
lumekv,"Top 10 most valuable brands in the world. Not to be confused with market capitalisation, brand is an intangible asset of a company. Valuation is based on the royalty relief approach - how much a company is willing to pay to license a brand",,4,0,Data_visualized,2021-02-28 18:13:16,https://youtu.be/UJ32qyDI1a0,0,dataviz
kwtus4,Recommendation Engine VIZ with Power BI. & Python,,3,0,Grits1899,2021-01-14 00:16:38,https://youtu.be/iDV0Zh6HDGc,0,dataviz
jkal9t,Top 20 Countries by journalists killed (1992-2018),,4,0,Viking88s,2020-10-29 14:03:25,https://www.youtube.com/watch?v=VCsDQ9_7YtQ&ab_channel=WWRankings,0,dataviz
igsnc8,Writing Alt Text for Data Visualization,,3,0,jackfruitchips_,2020-08-26 04:55:56,https://medium.com/nightingale/writing-alt-text-for-data-visualization-2a218ef43f81,0,dataviz
hqi0g1,"Tom Scott: A Million Dollars vs A Billion Dollars, Visualized: A Road Trip",,5,0,dontnormally,2020-07-13 16:06:34,https://www.youtube.com/watch?v=8YUWDrLazCg,0,dataviz
gkjwsp,What is this 1-dimensional chart type called?,"It is a very basic 1-dimensional chart with a single indicator showing positioning on a scale: https://i.imgur.com/bkVgWR4.png

I looked at multiple chart examples but did not see this kind. Maybe it is too simple to even mention?

Edit: Thank you for all the answers. I feel I know enough to build this in D3 and not necessarily use existing libraries.",3,5,obviousoctopus,2020-05-15 23:22:48,https://www.reddit.com/r/dataviz/comments/gkjwsp/what_is_this_1dimensional_chart_type_called/,0,dataviz
g9mvlo,The Atlantic Slave Trade Animated In Less Than 5 Minutes (1600-1865),,4,0,UnrealBeachBum,2020-04-28 13:08:42,https://youtu.be/CrpbrdsUn1Y,0,dataviz
ftoqst,Animated Map Of Confirmed Coronavirus Cases & Deaths In California,,4,0,UnrealBeachBum,2020-04-02 15:53:32,https://youtu.be/r6wQzxV9zEo,0,dataviz
e3evkt,The Top 15 Global Brands Ranking (2001-2018),,4,0,UnrealBeachBum,2019-11-29 13:41:04,https://youtu.be/ivpYXHXbxb8,0,dataviz
cdqx8m,Beyond Nightingale: Being a Woman in Data Visualization,,4,0,most_painful_truth,2019-07-16 02:11:00,https://medium.com/nightingale/beyond-nightingale-being-a-woman-in-data-visualization-d7968d171ccf,0,dataviz
bm73i0,"Designer's Perspective, Data Visualization: Giorgia Lupi | 2018 Wharton People Analytics Conference",,4,0,blogueandoatope,2019-05-08 16:06:56,https://www.youtube.com/watch?v=w7n2aD3j78g,0,dataviz
awm351,Data Visualization tools for Linux?,"I am looking to make interactive dashboards from data in a SQL database. I have bit experience with data visualization packages in Python (plotly,matplotlib, seaboarn) but i feel these  aren't as  intutive and quick to build full dashboards as tableau and spotfire, but these programs (desktop verisons) seem to be only on Windows. 

Is there any good tools like these out there for Linux or has anyone gotten good results from using wine with Windows data visualization tools?",4,1,Oct8-Danger,2019-03-02 20:40:26,https://www.reddit.com/r/dataviz/comments/awm351/data_visualization_tools_for_linux/,0,dataviz
94h8lu,"Anyone wants to just get started on how dataviz coding works: Here is a brief guide (jupyter notebooks) to learn data-visualization, by learning how the functions work, in some Python libraries.",,5,1,callMeSpacetime,2018-08-04 06:49:11,https://github.com/techcentaur/Data-is-Cool,0,dataviz
8vs66u,Visualize 4000 text notes in 2d?,"Hi everyone. I have a list (simple txt file) of about 4000 small notes of about 50 words. Each note has a x and an y coordinate (relative position) and some have relations among them. I just want to find a way to visualize these notes and freely move through them (zoom in and out etc.). Right now I work with VUE (Visual Understanding Environment) but that's becoming very laggy (see screenshot). Any recommendations?

https://preview.redd.it/woe1okojiq711.png?width=1132&format=png&auto=webp&s=c55f0057af890feedbb3b577623d2dff1af9a2b3",5,2,Shami_V,2018-07-03 13:25:09,https://www.reddit.com/r/dataviz/comments/8vs66u/visualize_4000_text_notes_in_2d/,0,dataviz
8ehhqt,How to Easily Map Your Database Schema in Power BI,,3,0,DingerKing3,2018-04-24 03:33:21,https://www.youtube.com/watch?v=icf7Hfj22vg,0,dataviz
804bve,Designing and improving a plot [video inside],,4,0,balgan,2018-02-25 13:07:27,https://medium.com/@eyeofdata/the-simpsons-seasons-ratings-d516d748b1f5,0,dataviz
6rb0ue,Airlines & Analytics | How The Airline Industry Uses Data To Fly Higher,,4,0,softcrylic_1,2017-08-03 08:50:59,http://www.softcrylic.com/blogs/airlines-analytics-how-the-airline-industry-uses-data-to-fly-higher/?utm_source=reddit&utm_campaign=backlink&utm_medium=link,0,dataviz
6phlos,Moneyball for Art (and Pollock's tallest painting),,5,0,Artnome,2017-07-25 17:14:26,https://www.artnome.com/news/2017/7/17/moneyball-for-art-and-pollocks-tallest-painting,0,dataviz
5fyvdp,Virtual Reality and the future of Data Viz,,3,0,evanwarfel,2016-12-01 20:16:55,http://www.roadtovr.com/everything-wrong-with-traditional-data-visualization-and-how-vr-is-poised-to-fix-it/,0,dataviz
2rvyy1,Spread of #JeSuisCharlie on Twitter,,5,0,futureisdata,2015-01-09 19:37:48,http://srogers.cartodb.com/viz/123be814-96bb-11e4-aec1-0e9d821ea90d/embed_map,0,dataviz
2o8l1j,ViziCities development diary #1: One month in,,3,0,misnamed,2014-12-04 06:29:05,http://rawkes.com/articles/vizicities-dev-diary-1,0,dataviz
