id,title,selftext,score,num_comments,author,created_utc,url,gilded,subreddit
a3f9xm,Baseball Visualization Dashboard,"Recently I shared a blog post of mine where I visualized some batting stats for the 2018 season. Some of you wanted to see these visualizations for all teams and players. So I started to develop a dashboard and it's very early first version is now up on

[www.baseball-dashboard.com](https://www.baseball-dashboard.com/)

Please use it on a desktop pc or laptop for now since I have still problems with mobile.

You can choose the team or player you want and you will see how they did offensively this year.

Any feedback and/or criticism is very welcome. This is a side project but I want to develop it furhter in the future.",3,0,skofield,2018-12-05 18:52:22,https://www.reddit.com/r/dataviz/comments/a3f9xm/baseball_visualization_dashboard/,0,dataviz
9v3jxg,How Marylanders voted for governor during the 2018 elections,,3,1,CNSMaryland,2018-11-07 21:23:40,https://i.redd.it/f7tjme4h7zw11.gif,0,dataviz
9ulx1j,What Data Visualization Tools Do You Think Were Used In This Article?,"Here is the link:

[https://pudding.cool/2018/01/chyrons/](https://pudding.cool/2018/01/chyrons/)

&#x200B;

I really love the layout of this article. It's very very well done and clean looking. I have two very broad questions for you guys:

&#x200B;

1.) What data visualization tools should I look into if I want to make interactive and dynamic graphs like the one in this article?

&#x200B;

2.) How would I look further into creating something with a similar layout where you can scroll and have your article on the side while the graphs stay in place but change on the right? Very neat.

&#x200B;

Hope these questions aren't too broad. Help me improve my skills!

&#x200B;",3,0,gorillaBBQ,2018-11-06 06:07:02,https://www.reddit.com/r/dataviz/comments/9ulx1j/what_data_visualization_tools_do_you_think_were/,0,dataviz
8iyocm,Introducing VisGuides,"***VisGuides*** is a democratic discussion forum about visualization guidelines. It welcomes all scientists, researchers, practitioners, designers, engineers, students, and users who are interested in interested in data visualization and visual analytics regardless of their background.

[http://visguides.org/](http://visguides.org/)",3,0,vertexar,2018-05-12 20:23:47,https://www.reddit.com/r/dataviz/comments/8iyocm/introducing_visguides/,0,dataviz
7zlen3,Thought this might be helpful to you guys - 6 Mistakes Ruining Your Charts and Infographics,,3,0,SoftandChewy,2018-02-23 04:33:03,http://contentmarketinginstitute.com/2018/01/charts-infographics-mistakes/,0,dataviz
7xhcw5,How to use Jupyter Notebooks and pandas to explore data,,4,0,moklick,2018-02-14 11:25:41,https://blog.webkid.io/analysing-data-with-jupyter-notebooks-and-pandas/,0,dataviz
7lfnag,I am recently unemployed. Here's what only reddit and job hunting looks like!,,4,1,QuillFurry,2017-12-22 06:20:14,https://imgur.com/gallery/hYc2i,0,dataviz
7958oh,Suggestions on how to visualize word associations?,"I have a data set with a number of companies, and how both customers and non-customers associate them with key words used in marketing campaigns (e.g. ""innovative"", ""expensive"", ""attentive"", ""integrity"").  I have crunched numbers to show overall scores, comparisons between competitors, etc. but am really struggling on how to show the differences without flat tables or lots of numbers. Has anyone seen any interesting way of visualizing this kind of data?",3,2,thomasaquina,2017-10-27 18:54:49,https://www.reddit.com/r/dataviz/comments/7958oh/suggestions_on_how_to_visualize_word_associations/,0,dataviz
70q5ul,What language/lib to use to show trajectory animation on map at a city level ?,"I am struggling so hard to find the good language and bib combo. I am looking to plot dots on a map at city level, and animate the dots following trajectories. Preferably using C++, python, or node.js, but I will be open to any solution at this point.

What I found is either obsolete, static only (no animation), or only applicable at country level (no streets details).

Would have any advice for a lost soul ?",3,0,ArraySaturday,2017-09-17 20:49:54,https://www.reddit.com/r/dataviz/comments/70q5ul/what_languagelib_to_use_to_show_trajectory/,0,dataviz
6u4bm1,Currently predicted weather conditions by county for counties in or near the eclipse zone - updated every 12 hours,,3,0,babblebat,2017-08-16 19:08:36,http://babblebat.com/em,0,dataviz
68c4uo,Pie charts did nothing to deserve what you’re doing to them,,3,1,makmanalp,2017-04-29 22:31:20,https://medium.com/@makmanalp/pie-charts-did-nothing-to-deserve-what-youre-doing-to-them-ca803997eb08,0,dataviz
67gnkl,First time data visualization projects..!,"Whatever, whenever, for fun or for work or for school. Let's see them!",3,2,jemattei,2017-04-25 13:50:03,https://www.reddit.com/r/dataviz/comments/67gnkl/first_time_data_visualization_projects/,0,dataviz
66agcu,"Harvard-Incubated Marketplace, Experfy, seeking Visualization expert for project based work. $4k-$6k (experfy.com)",,3,0,dtrain15,2017-04-19 14:16:37,https://www.experfy.com/projects/521-build-prediction-visualization,0,dataviz
61a653,Dataviz tool concept for an autonomous agriculture-drone-system,,3,0,ahoiin,2017-03-24 17:04:36,https://medium.com/@ahoiin/a-drone-air-traffic-control-system-should-manage-the-lower-sky-heres-how-ab2f6cc29bc5#.862phjdov,0,dataviz
5zduai,New and Traditional Techniques for Node-Link Visualization,,3,0,evanwarfel,2017-03-14 18:15:46,https://medium.com/kineviz-blog/visualizing-node-link-graphs-84a40a9b2fcc#.y5p9ylg2n,0,dataviz
5hnl6f,23 Visualizations and When to Use Them,,2,0,dccpt,2016-12-11 01:22:51,https://blog.dominodatalab.com/video-23-visualizations-use/,0,dataviz
4uwl6o,Which dataviz tool should I use?,"I have a table with 1000 records. I want to show matches of column B where any keyword from column A in entered in a web form.

Is there an open source library that would be ideal for this?",3,0,bravo_ragazzo,2016-07-27 19:54:24,https://www.reddit.com/r/dataviz/comments/4uwl6o/which_dataviz_tool_should_i_use/,0,dataviz
4shc8x,Origin of crops,,3,0,papereraser,2016-07-12 14:46:11,http://blog.ciat.cgiar.org/origin-of-crops/,0,dataviz
49zt5y,Stacked Area Charts and Mathematical Approximations,,3,0,remembermyurl,2016-03-11 17:39:01,http://www.infragistics.com/community/blogs/tim_brock/archive/2016/02/25/stacked-area-charts-and-mathematical-approximations.aspx,0,dataviz
44lc5i,NetCrunch network monitoring in the NOC,,3,1,mrojek,2016-02-07 12:02:52,http://i.imgur.com/K7hZWMX.jpg,0,dataviz
3xhiot,Why mobile data visualization shouldn’t hurt | News & Analysis | Data Driven Journalism,,3,0,None,2015-12-19 17:57:02,http://datadrivenjournalism.net/news_and_analysis/why_mobile_data_visualization_shouldnt_hurt?utm_content=buffer63a8a&utm_medium=social&utm_source=twitter.com&utm_campaign=buffer#.VnWaZhJD5rk.reddit,0,dataviz
3xbqkm,Star Wars deaths: interactive visualisation,,3,0,cole007net,2015-12-18 09:15:39,http://cole007.net/starwars,0,dataviz
3x87c9,Expressing figures and data visually – a how to guide,,3,0,ClaireEmilieLecocq,2015-12-17 16:06:00,http://blog.illustrio.com/expressing-figures-data-visually-guide/,0,dataviz
3tkez5,"Graphing the Use of ""Fuck"" on Reddit Over Time",,3,2,ModdedApparel,2015-11-20 13:56:32,https://projects.fivethirtyeight.com/reddit-ngram/?keyword=fuck,0,dataviz
3smafl,Comparing 7 Python data visualization tools,,3,0,dataphysicist,2015-11-13 03:12:41,https://www.dataquest.io/blog/python-data-visualization-libraries/,0,dataviz
3ggyx0,[Discussion] What would you use to produce interactive charts that can be embedded in a web page?,"I know of Tableau Public and Pygal. Do you use one of these, or something else? How do you produce inviting, interactive charts?",3,3,pdougherty,2015-08-10 14:59:16,https://www.reddit.com/r/dataviz/comments/3ggyx0/discussion_what_would_you_use_to_produce/,0,dataviz
37m1gn,You Draw It: How Family Income Affects Children’s College Chances,,3,0,logophobia,2015-05-28 16:39:21,http://www.nytimes.com/interactive/2015/05/28/upshot/you-draw-it-how-family-income-affects-childrens-college-chances.html,0,dataviz
2riogb,How Nonemployed Americans Spend Their Weekdays,,3,0,mparramon,2015-01-06 15:03:57,http://www.nytimes.com/interactive/2015/01/06/upshot/how-nonemployed-americans-spend-their-weekdays-men-vs-women.html?_r=0&abt=0002&abg=1,0,dataviz
1werfm,Topological Networks: The Future of Visualizing Data,,3,0,tjlaher,2014-01-28 22:32:28,http://www.ayasdi.com/blog/topology/topological-networks-the-future-of-visualizing-data,0,dataviz
1rmrnp,Step-by-step introduction tutorial to Gephi using Facebook network,Thx for visiting http://www.obviousleaks.org/step-by-step-gephi-tutorial/,3,0,debecdel,2013-11-28 06:57:33,https://www.reddit.com/r/dataviz/comments/1rmrnp/stepbystep_introduction_tutorial_to_gephi_using/,0,dataviz
1ju1v5,Kindly take a look at /r/dataisbeautiful,"Thanks for visiting /r/dataviz, please take a look at /r/dataisbeautiful, it's way busier than this sub.",3,0,neilplatform1,2013-08-06 20:17:09,https://www.reddit.com/r/dataviz/comments/1ju1v5/kindly_take_a_look_at_rdataisbeautiful/,0,dataviz
1g49nt,DataViz History: Charles Minard’s Flow Map of Napoleon’s Russian Campaign of 1812 – Retreat from Moscow,,3,0,dataarchaeology,2013-06-11 13:10:26,http://datavizblog.com/2013/06/11/dataviz-history-charles-minards-flow-map-of-napoleons-russian-campaign-of-1812-retreat-from-moscow/,0,dataviz
gaf6x,Vintage Data Visualization - beautiful infograms from the beginning of the 20th century,,3,0,urish,2011-03-24 11:56:24,http://www.informationisbeautiful.net/2011/vintage-infoporn-no-1/,0,dataviz
dnbgy,Visualisation of the last 9+ years of LLVM development. Please give me some feedback ^_^,,3,4,ioquatix,2010-10-05 23:18:16,http://www.oriontransfer.co.nz/research/code-visualisation,0,dataviz
dje3r,"UK transport mapped: Every bus stop, train station, ferry port and taxi rank in Britain. Welcome to the ultimate transport data | News | guardian.co.uk",,3,0,G_Comstock,2010-09-27 08:17:25,http://www.guardian.co.uk/news/datablog/2010/sep/27/uk-transport-national-public-data-repository,0,dataviz
dj2ci,"A taxonomy of data science. Great, comprehensive article.",,3,0,onetwoandthree,2010-09-26 13:05:01,http://www.dataists.com/2010/09/a-taxonomy-of-data-science/,0,dataviz
8jj86,Our favorite drugs,,3,0,neilplatform1,2009-05-11 13:24:01,http://awesome.goodmagazine.com/transparency/web/0904/trans0409ourfavoritedrugs.html,0,dataviz
19dts06,Figma tutorial: Live data pie chart,,2,0,shamsi_gamer,2024-01-23 17:32:07,https://www.youtube.com/watch?v=WOSMFhDZLak,0,dataviz
18hfuy5,Deciphering Data: Business Analytic Tools Explained,"The guide explores the most widely used business analytics tools trusted by business decision-makers - such as business intelligence tools, data visulization, predictive analysis tools, data analysis tools, business analysis tools: [Deciphering Data: Business Analytic Tools Explained](https://www.blaze.tech/post/deciphering-data-business-analytic-tools-explained)

It also explains how to find the right combination of tools in your business as well as some he­lpful tips to ensure a successful inte­gration.",2,0,thumbsdrivesmecrazy,2023-12-13 12:36:33,https://www.reddit.com/r/dataviz/comments/18hfuy5/deciphering_data_business_analytic_tools_explained/,0,dataviz
17cmw0q,Best Data Viz/ Story Telling examples in news publications,"I did a fun interview  with Gabi Steele (ex data viz at The Washington Post) where she shared some of her fav data visualization examples throughout her career:

US Gun Deaths in 2013: [https://guns.periscopic.com/?year=2013](https://guns.periscopic.com/?year=2013)

Borderline - Navigating the US-Mexican Border: [https://www.washingtonpost.com/graphics/2018/national/us-mexico-border-flyover/](https://www.washingtonpost.com/graphics/2018/national/us-mexico-border-flyover/)

You can check out the full interview [here](https://www.linkedin.com/posts/jparkerrogers_thanks-again-gabi-steele-for-joining-us-on-activity-7121239418765549569-t27x?utm_source=share&utm_medium=member_desktop)! ",2,0,JParkerRogers,2023-10-20 22:07:16,https://www.reddit.com/r/dataviz/comments/17cmw0q/best_data_viz_story_telling_examples_in_news/,0,dataviz
1792ix3,Data Visualisation Principles Part 1 — A Practical Example in Altair,,2,0,StjepanJ,2023-10-16 10:05:21,https://towardsdatascience.com/data-visualisation-principles-part-1-a-practical-example-in-altair-b6e16f665fc6,0,dataviz
16al9bk,"""The only sure way to tell if you are a bonafide dataviz professional is if you're willing to deeply engage in a discussion of whether or not connected scatterplots are as valuable as room temperature superconductors or as bogus as claims about room temperature superconductors."" - Elijah Meeks",,2,0,StjepanJ,2023-09-05 11:08:59,https://medium.com/@Elijah_Meeks/are-connected-scatterplots-unreadable-57fb4281ffb3,0,dataviz
169t8uo,"Guide to Data Analytics Dashboards - Common Challenges, Actionable Tips & Trends to Watch","The guide below shows how data analytics dashboards serve as a dynamic and real-time­ decision-making platform - not only compile data but also convert it into actionable­ insights in real time, empowe­ring businesses to respond swiftly and e­ffectively to market change­s: [Unlock Insights: A Comprehensive Guide to Data Analytics Dashboards](https://www.blaze.tech/post/unlock-insights-a-comprehensive-guide-to-data-analytics-dashboards)

The guide covers such aspect as common challenges in data visualization, how to overcome them, and actionable tips to optimize your data analytics dashboard.",2,1,thumbsdrivesmecrazy,2023-09-04 14:19:34,https://www.reddit.com/r/dataviz/comments/169t8uo/guide_to_data_analytics_dashboards_common/,0,dataviz
15efh1v,Importance of Data-Driven Storytelling: Data Analysis & Visual Narratives,,2,0,Emily-joe,2023-07-31 12:56:18,https://www.dasca.org/world-of-big-data/article/importance-of-data-driven-storytelling-data-analysis-and-visual-narratives,0,dataviz
159b87x,"If you hate Google Analytics 4 UI, this is for you","Hey everyone, one year ago I posted a Looker Studio template and a lot of people ended up using it and sharing feedback. So I went ahead and made an improved version. You can get it here:  
  
https://lookerstudio.google.com/reporting/afd66d58-3cc8-48a6-b3b9-b2be36462d4e  
  
I'm not asking for anything in return, not even your email address. Enjoy!

If the dashboard is down, it's because of Google Analytics 4 API restrictions. Just follow the instructions to make a copy and your version will be working just fine.",2,0,spexel,2023-07-25 15:10:55,https://www.reddit.com/r/dataviz/comments/159b87x/if_you_hate_google_analytics_4_ui_this_is_for_you/,0,dataviz
14l98yq,The Value of Data Visualization for Data Science Professionals,,2,0,Emily-joe,2023-06-28 13:15:28,https://www.dasca.org/world-of-big-data/article/the-value-of-data-visualization-for-data-science-professionals,0,dataviz
14cwgv5,Language data analysis,"Hi, I am performing a language analysis where i track keywords used by an institution over 10 years.

I was able to collect the data and put it into an excel table. But I was wondering if there are any interesting/new ways of visualizing this data besides the graphs available on excel.

Thank you!!",2,3,MoNomoRo,2023-06-18 21:59:21,https://www.reddit.com/r/dataviz/comments/14cwgv5/language_data_analysis/,0,dataviz
13y1x0r,Highly customizable data visualization tool,"Hello everyone!

Our team created **a data visualization tool** namely [Dataflake](https://www.dataflake.co/). It is a web app and is offering **100% free usage**

Dataflake allows to use SQL to create interactive dashboards like other data visualization tools, but it offers **highly customizable styling options** to visualize charts and other design elements. Moreover, Dataflake allows to **schedule automated email delivery** to send dashboard and **embed on applications or websites.**

Register at: [https://app.dataflake.co/register](https://app.dataflake.co/register)

We would deeply appreciate if you can spend some time experiencing Dataflake and share your thoughts to help us improve our product! Thank you very much!",2,2,Grand_Ad_887,2023-06-02 03:32:12,https://www.reddit.com/r/dataviz/comments/13y1x0r/highly_customizable_data_visualization_tool/,0,dataviz
13rur7b,Focus Group: Data Viz - Best Practices Training,"Hey Everyone,

Apologies if I am breaking the forum rules. I am a doctoral student studying BI at Marymount University. I’m getting ready to run a focus group on data visualization this/next week and was wondering if you’d like to participate. I aim to build a training program focused on data viz, marry the art and science of it. Interested?

Click the link below! Once I have a good group of folks, I will send out details of the study and instructions to join the conversation.

Please mark your availability for: Data Viz - Focus Group 

[https://whenavailable.com/event/SV4K3eEcpN2JBptA8](https://whenavailable.com/event/SV4K3eEcpN2JBptA8)",2,0,Dr_of_BI,2023-05-25 22:00:11,https://www.reddit.com/r/dataviz/comments/13rur7b/focus_group_data_viz_best_practices_training/,0,dataviz
137ljp4,Looking for idea to efficiently display % of populations satisfying a criteria.,"Let's say, I want to see how many of the people in each service of my company have been trained on a software.  
In one visualisation, other than a table, I would like to see the absolute number of people trained and the % it represents; because in service A, we trained 50 people out of 150, and in service B, only 12, but out of 15. So I want to highlight that we put a lot of effort into training A but B is closer to be 100% trained.  
Any ideas or propositions?  
Thanks.",2,0,Whiteflager,2023-05-04 14:00:29,https://www.reddit.com/r/dataviz/comments/137ljp4/looking_for_idea_to_efficiently_display_of/,0,dataviz
12vu5lj,Idk if this is the right subreddit but can someone tell me what kind of graph this is,,2,1,Material-Paint5462,2023-04-23 03:34:50,https://www.reddit.com/gallery/12vtxy6,0,dataviz
12hpuyl,"Best practices for encoding aggregated categories under ""others""",,2,5,henrigere,2023-04-10 17:34:50,https://i.redd.it/wfps1luue3ta1.png,0,dataviz
11w0riv,"I ‘m looking for dataviz widgets, preferably open source, I could embed on a website. Any recommandations ?","I mentioned open source because even if I’m aware GSheet, Airtable, Tableau, Datawrapper… are proposing suchlike features but I’d rather use open solutions. 

I’ve been told Metabase or Graphana are suitable solutions but they still seem a bit overkill when it comes only to display simple csv tables into interactive graphs.

Any idea is welcome !",2,2,JPy_multi,2023-03-19 23:04:56,https://www.reddit.com/r/dataviz/comments/11w0riv/i_m_looking_for_dataviz_widgets_preferably_open/,0,dataviz
11q7u81,Best 5 BI Tools Widely Applicable for Data Visualization,,2,0,Emily-joe,2023-03-13 12:05:21,https://www.dasca.org/world-of-big-data/article/best-5-bi-tools-widely-applicable-for-data-visualization,0,dataviz
11a06ke,Best tool for kiosk-mode dashboards,"Hi all,

I have a wall of monitors on which that I want to display a bunch of visualizations of data from DataBricks/JDBC, and I want them to just display my visualizations as soon as the device driving the monitor boots up.

I'm using DataBricks as my backend. We have free-version Grafana in-house, but the free version is not well supported by DataBricks.  I can make it work in a few weeks, but that involves getting IT involved, and will take some time.  I'm hoping to get something up and running this week.

rj",2,1,otx,2023-02-23 15:19:33,https://www.reddit.com/r/dataviz/comments/11a06ke/best_tool_for_kioskmode_dashboards/,0,dataviz
113r6ai,Data for 2022 on Canada’s trade activity with the world are now available through the International Trade Explorer tool / Les données de 2022 sur l’activité commerciale du Canada avec le monde sont maintenant disponibles à partir de l’outil l’Explorateur du commerce international [OC],"The International Trade Explorer is an interactive tool that provides users with a new way of discovering Canada’s trade relationships with the world. Data for 2022 have been updated and are now available [here](https://www150.statcan.gc.ca/n1/pub/71-607-x/71-607-x2019005-eng.htm?utm_source=rddt&utm_medium=smo&utm_campaign=statcan-all-content-22-23).

Through four different data visualizations, including an interactive world map, a treemap, a bar chart and a provincial view, the tool offers a complete set of easy-to-use functionalities to help users learn about the evolution of Canada’s trading activity through time.

*\[We are Canada’s national statistical agency. We are here to engage with Canadians and provide them with high-quality statistical information that matters! Publishing in a subreddit does not imply we endorse the content posted by other redditors.\]*

\*\*\*\*

L’Explorateur du commerce international est un outil interactif qui fournit aux utilisateurs une nouvelle façon de découvrir les relations commerciales du Canada avec le monde. Des données pour 2022 ont été mises à jour et sont maintenant disponibles [ici](https://www150.statcan.gc.ca/n1/pub/71-607-x/71-607-x2019005-fra.htm?utm_source=rddt&utm_medium=smo&utm_campaign=statcan-all-content-22-23).

Grâce à quatre visualisations des données différentes, y compris une carte du monde interactive, une carte à cases arborescente, un graphique à barres et un aperçu provincial, l’outil offre un ensemble complet de fonctionnalités faciles à utiliser pour aider les utilisateurs à connaître l’évolution de l’activité commerciale du Canada dans le temps.

*\[Nous sommes l’organisme national de statistique du Canada. Nous sommes ici pour discuter avec les Canadiens et les Canadiennes et leur fournir des renseignements statistiques de grande qualité qui comptent! Le fait de publier dans un sous-reddit ne signifie pas que nous approuvons le contenu affiché par d'autres utilisateurs de Reddit.\]*",2,1,StatCanada,2023-02-16 13:55:34,https://www.reddit.com/r/dataviz/comments/113r6ai/data_for_2022_on_canadas_trade_activity_with_the/,0,dataviz
1122iib,Calling the London-based UK DataViz community 📣,"https://preview.redd.it/1qh9d93sw4ia1.png?width=600&format=png&auto=webp&s=5176d5060400271275dfa1ae2d0b60ab23b3fc9c

Are you free after work on Thursday, March 2nd for a fun, free meetup in London (UK)?

In just a few weeks, we’re taking community meetups back to the era of speakeasy clubs - complete with secret passwords, hidden locations, and (of course!) devilish drinks🍹

Here’s what to expect:

* Delicious drinks and snacks in a central London location
* Plenty of networking and fun with your DataViz community & colleagues
* DataViz experts on-hand to bounce ideas-off/ask the challenging questions

Register to reveal the exact time and place of this event, and the secret password to get in the door 🔑

We’ll see you underground!

[REGISTER HERE](https://www.eventbrite.co.uk/e/vizlibs-data-underground-tickets-529387491237)",2,1,JasonAtAstrato,2023-02-14 10:50:42,https://www.reddit.com/r/dataviz/comments/1122iib/calling_the_londonbased_uk_dataviz_community/,0,dataviz
111y9zg,Thoughts on the effectiveness of network visualizations?,"Network visualizations are often just a mess.

In my experience as information designer, they work well as investigative, exploratory tools but are not as effective for communication.

So curious, what do people think of network visualizations? Are they effective enough?

[A random network visualization from the web. Probably done in Gephi or similar.](https://preview.redd.it/zxtc4e6ce4ia1.jpg?width=800&format=pjpg&auto=webp&s=37b02c8234d3e72ea40f47d4996aa26f9206a3f5)

[View Poll](https://www.reddit.com/poll/111y9zg)",2,5,pielodi,2023-02-14 09:08:38,https://www.reddit.com/r/dataviz/comments/111y9zg/thoughts_on_the_effectiveness_of_network/,0,dataviz
10veozw,How do I get links to open inside my data visualization?,,2,1,doctorcaptain,2023-02-06 18:53:58,https://www.americaisallin.com/analysis-public-overwhelmingly-supports-policies-reduce-highway-emissions#map,0,dataviz
10g0tin,The Value of Data Visualization for Data Science Professionals,,2,0,Emily-joe,2023-01-19 12:45:43,https://www.dasca.org/world-of-big-data/article/the-value-of-data-visualization-for-data-science-professionals,0,dataviz
zgf9ag,5 Alternatives to the Bar Chart,,2,0,dataenthusiast14,2022-12-08 23:12:23,https://medium.com/@nickmartin812/5-alternatives-to-the-bar-chart-f53660c0e57f,0,dataviz
z292kk,Visualizing Distributions for EDA,,2,0,dataenthusiast14,2022-11-22 23:41:17,https://link.medium.com/bZ7wDa4Pavb,0,dataviz
yqhjy4,"Organizations are undergoing a radical change in their decision-making process, which has drummed up the need for Data Scientists well-versed in data management strategies.",,2,0,Emily-joe,2022-11-09 12:26:10,https://www.dasca.org/world-of-big-data/article/how-data-scientists-will-fit-in-data-driven-cultures-of-future,0,dataviz
xx29nq,Top critical capabilities for a data scientist,,2,0,Emily-joe,2022-10-06 10:52:35,https://www.dasca.org/world-of-big-data/article/top-critical-capabilities-for-a-data-scientist,0,dataviz
x0o1vv,Left Center Right Dice Game,"I made a python script to play the dice game Left Center Right with seven players 5000 times and this was the result. I plotted game length on the x and frequency of those lengths on the y axis. 

https://preview.redd.it/r7qwdgumgnk91.png?width=756&format=png&auto=webp&s=955080f7fd6f67cdf05174f77e8ce9dfae32969d",2,0,rabbitpiet,2022-08-29 12:54:55,https://www.reddit.com/r/dataviz/comments/x0o1vv/left_center_right_dice_game/,0,dataviz
