id,title,selftext,score,num_comments,author,created_utc,url,gilded,subreddit
cwt8hb,Modern DataViz wiz doing it for fun...,"I'm hoping someone can remind me... I vaguely recall someone who was creating dataviz for fun and managed to simply turn that doing it for fun into a career (ie, his blog got popular enough he could quit his job).

I'm struggling to remember who and just vaguely hoping someone will say 'Oh yeah, that's bob over at whateversite' because this is just plain bugging me and I'm beginning to think I imagined it.",1,0,jaydeflix,2019-08-29 00:15:46,https://www.reddit.com/r/dataviz/comments/cwt8hb/modern_dataviz_wiz_doing_it_for_fun/,0,dataviz
cwp76x,Using log scale for data that has large variations?,"Say I shake a bag if marbles 20 times with a constant force. I record how many marbles exit the bag after each shake. Each instance of the shake contains a different amount of marbles. 

So on the first shake I lose 25 out of 50 marbles - 50%. On the second shake I lose 10 out of 100 marbles - 10%. If I draw a trend line if these percentages, i will have some spots that jump because the sample of marbles is not consistent. Is it appropriate to use a logarithmic scale to smooth out the data so that the jumps look less extreme?",1,0,fool-evolved,2019-08-28 19:02:08,https://www.reddit.com/r/dataviz/comments/cwp76x/using_log_scale_for_data_that_has_large_variations/,0,dataviz
cvrga2,Is there a type of Sankey Graph that has overlapping groups?,"ok so I'm trying to visualize some data right and Sankey graph seemed perfect. Except for mine the groups can be overlappig and that doesn't work well with a Snakey graph, is there something similar that I can use to do this? Or something else at all?",1,2,jiggaboooojones,2019-08-26 17:48:01,https://www.reddit.com/r/dataviz/comments/cvrga2/is_there_a_type_of_sankey_graph_that_has/,0,dataviz
c5m7jc,Books?,Hi! Does anyone know of any state of the art books in the topic? Thanks!,1,2,Antidemiurge,2019-06-26 06:10:47,https://www.reddit.com/r/dataviz/comments/c5m7jc/books/,0,dataviz
bzov0r,#SAP's CEO Bill McDermott loves to #Motivate. All the #Hashtags used on The #Visualized Twitter #Timeline of Bill McDermott via TheVisualized Social Media App 📊 https://thevisualized.com/twitter/timeline/billrmcdermott #MondayMotivation #Dream #Trust #Leaders #Data #Visualization #WordCloud,,1,0,TheVisualizED,2019-06-12 09:07:07,https://i.redd.it/s1k8c10w5w331.png,0,dataviz
brq1lf,World Bank challenge invites map-based data visualizations that help people better understand and communicate disaster risk (May 15 - July 15),,1,0,mbrinkhu,2019-05-22 15:18:36,https://understandrisk.org/vizrisk/,0,dataviz
bokajp,Complete data visualization series in R using ggplot | Arpan Gupta,,1,0,blogueandoatope,2019-05-14 15:21:53,https://www.youtube.com/watch?v=RPTLS6SUMf8,0,dataviz
bm3kyi,Qualitative analytics for apps -- cool course, Helped me better understand the difference between quantitative and [qualitative analytics](https://productcoalition.com/free-course-learn-qualitative-app-analytics-2019-edition-3e577ed236a3/?cpnid=7010N000000hdsE),1,0,joshymeyer,2019-05-08 10:29:33,https://www.reddit.com/r/dataviz/comments/bm3kyi/qualitative_analytics_for_apps_cool_course/,0,dataviz
blrvst,The Future of Data Visualization on the Web - Alan Mendelevich,,1,0,blogueandoatope,2019-05-07 15:13:44,https://www.youtube.com/watch?v=nH8YZvfLa4M,0,dataviz
bfikor,A cross between pie charts and bar graphs.,,1,0,abedneg0,2019-04-20 23:37:16,https://thestoryfolds.com/blog/2019/4/20/pie-bar-charts,0,dataviz
bb31fo,What are some tools to make a radial heatmap?,"Hi, I'm looking for some tools to create a radial heatmap, with four concentric circles, and a wraparound from 1-1500. Is there a tool to do this (Chrome).",1,0,Billy5481,2019-04-09 03:20:31,https://www.reddit.com/r/dataviz/comments/bb31fo/what_are_some_tools_to_make_a_radial_heatmap/,0,dataviz
b6gxdu,What Data Viz tool to pick up,"Hi guys !

I was wondering if you guys had any opinions on what tool to pick up for data visualization that would be good to have more flexibility.

I currently use Tableau, Google Data Studio and dabbling in PowerBI. Are there any better tools that you would recommend as I am relatively new. Preferably free as I would like to learn on the side.

I also dabble in Python as well.",1,14,ElethorAngelus,2019-03-28 10:05:24,https://www.reddit.com/r/dataviz/comments/b6gxdu/what_data_viz_tool_to_pick_up/,0,dataviz
aqwa6b,R Video Tutorial #1: Working with dates and times with plot.ly,,1,0,skofield,2019-02-15 12:55:05,https://smart-tools.berndschmidl.com/r-tutorial-1/,0,dataviz
al93oa,Too early or late?,,1,0,yvette110,2019-01-30 04:42:31,https://public.tableau.com/profile/starschema?fbclid=IwAR1WEcQs7OkDOvOrtsDTqSMNnM541WXOrB63Mc8ptbBPAAfLFdKZDo6-NnM#!/vizhome/Tooearlyorlate/Tooearlyorlate,0,dataviz
a9y9ri,Politician and parties along the years.,"Hi, want to make a Viz on the politician movements and party changes along the 30 last parliaments, what is the best graph type to do so?",1,4,yuvalabou,2018-12-27 10:52:28,https://www.reddit.com/r/dataviz/comments/a9y9ri/politician_and_parties_along_the_years/,0,dataviz
a3znen,Visualization Dashboard Updated - Compare Teams and Players,"Thanks to the feedback here on reddit I added some new features to

[www.baseball-dashboard.com](https://www.baseball-dashboard.com)

It is now more convenient to search for Players and/or Teams. Also you can generate two visualizations next to each other so you can compare teams/players. Please let me know what you think!

As a next step I want to do something similar for Pitching. Please let me know if you have ideas what else can be done.

Cheers!",1,0,skofield,2018-12-07 13:01:44,https://www.reddit.com/r/dataviz/comments/a3znen/visualization_dashboard_updated_compare_teams_and/,0,dataviz
a3w613,"""Pro bono"" Viz Work - Looking to build freelance portfolio","Hi All!  
As the title suggests, I'm looking to pick up some small scale projects to add to my portfolio. A bit about myself, I've been doing BI/Analytics for close to 6 years, started off with MicroStrategy and about 2.5 years ago moved over to the amazing tableau! I've got experience with multiple databases but my passion is story telling and creative visualizations, as well as converting those stubborn excel users :)  


Currently I've got a pretty sweet gig that leaves me with enough time to want to pursue additional work. Unfortunately all of my own work contains confidential data so I'm looking to spend some time building a network via ""pro bono"" work to get started.   


Feel free to PM me for more info on availability/linkedIn details/etc.  


Thanks!

&#x200B;

PS- I have xposted this in a couple of other subreddits so i do apologize in advance if this isnt the correct location!",1,0,dataScoop,2018-12-07 04:04:49,https://www.reddit.com/r/dataviz/comments/a3w613/pro_bono_viz_work_looking_to_build_freelance/,0,dataviz
9yssyo,Every Plate Appearance in the 2018 MLB season visualized,,1,0,skofield,2018-11-20 14:50:06,https://berndschmidl.com/2018/11/20/every-plate-appearance-in-the-2018-mlb-season-visualized/,0,dataviz
9vl8ha,"MD Gov. Larry Hogan’s decisive victory, in five charts",,1,0,CNSMaryland,2018-11-09 15:15:11,https://cnsmaryland.org/2018/11/08/hogans-decisive-victory-in-five-charts/,0,dataviz
9t6rh3,Need Help Adjusting my matplotlib scatter plot!,"&#x200B;

[I'm just running: \`plt.scatter\(ep\_inf\['imdbRating'\], ep\_inf\['Writers'\]\)\` where writers cells sometimes contain a long string of writers and I'm getting the image below as output. Nee help adjusting the y-axis \(writers\) so that I can actually read it!](https://preview.redd.it/lfdamce8pnv11.png?width=6189&format=png&auto=webp&s=b166a5584efff028aa47e7b897b1544ea311ca62)

&#x200B;",1,0,gorillaBBQ,2018-11-01 05:29:49,https://www.reddit.com/r/dataviz/comments/9t6rh3/need_help_adjusting_my_matplotlib_scatter_plot/,0,dataviz
9rljx0,Visualizing binary outcomes based on two categorical variables,"I am trying to represent outcomes based on two categorical variables:

* outcome (call it pass/fail)

* SES (High/Medium/Low)

* Disability (Y/N)

So far, I have a Sankey diagram: three SES categories flow into disability which fork into pass or fail. What I am trying to show is that in the high-income group, disability matters less because a higher proportion of them ""fail"" compared to the Low/Medium income groups. The Sankey diagram is a good visual, but doesn't show this as clearly as I would like.

Are there better ways of representing this?",1,0,EtOHMartini,2018-10-26 15:09:26,https://www.reddit.com/r/dataviz/comments/9rljx0/visualizing_binary_outcomes_based_on_two/,0,dataviz
9e6vx1,How to map a value to a colorscheme,"I am looking for a function that given a value and its range can output an R,G,B tuple with a nice colorscheme that can be visualized on a blue background. Any advice?",1,1,the_sad_pumpkin,2018-09-08 19:40:23,https://www.reddit.com/r/dataviz/comments/9e6vx1/how_to_map_a_value_to_a_colorscheme/,0,dataviz
9bh9vs,How to visualise hectolitre volumes,"Hi all,

I am looking for a way to visualise hectolitres in a nice way.  
E.g: we produced 5,728,608.911 hl of beer , which could fill 229 olympic pools or stack up X amount of beercans to the moon. 

&#x200B;

Thanks in advance ! ",1,0,Brewercz,2018-08-30 06:38:53,https://www.reddit.com/r/dataviz/comments/9bh9vs/how_to_visualise_hectolitre_volumes/,0,dataviz
99zejf,How to create and render an interactive county level US choropleth map into a web page,"I am looking to add an interactive map, meaning you can at least hover over the US counties to see the values, to a web page. I have done this in the past with python but it wasn't embedded into a web page and the only way I know to use the same method is to save the map as a image. If anyone knows how this can be done with python or pure js, not node as i am running a Django server, I would be very appreciative. ",1,4,rheajr86,2018-08-24 17:29:58,https://www.reddit.com/r/dataviz/comments/99zejf/how_to_create_and_render_an_interactive_county/,0,dataviz
98t4o3,Radmesser: So viel Abstand halten Autos beim Überholen,,1,1,Plateauton,2018-08-20 12:25:04,https://interaktiv.tagesspiegel.de/radmesser/,0,dataviz
96qp7p,Anyone know Free and Best Data Visualization Courses for Beginners?,I recently curated a list of [Best Data Visualization Courses on my blog](https://sinxloud.com/where-learn-find-best-data-visualization-courses/). And would like to know get a list of the Free Courses for learning Data Visualization that my subscribers can benefit from... ,1,0,skj8,2018-08-12 17:28:18,https://www.reddit.com/r/dataviz/comments/96qp7p/anyone_know_free_and_best_data_visualization/,0,dataviz
91t0a4,Need help finding the right visualization in Rstudio,"I am looking for the best way to graph the correlation between a predictive score and a manual label in sets of data over time. In the process, a system predicts the likelihood that a user will label a document as ‘yes’ or ‘no’, and provides a set for the user once a day. I’m trying to display the progression of the correlation between high scores from the system and actual calls by the user. But I can’t find an effective way to represent all three ‘dimensions’ of the data. The data looks like this:

https://preview.redd.it/8qtiyc1984c11.png?width=1010&format=png&auto=webp&s=302eccfa65dec0126194aae1ae5a18aacbcada1e

Each date (15 days total) has four lines to delineate the four possible labels. Columns 4-13 show the different 10 point ranges of the system scores

What I’d like is to have the date on the x axis, the number of labels applied on the y axis, and use the label applied as an aesthetic to differentiate the calls being made. My first thought was a density plot like the one below, but that’s missing one more dimension to show the system score. Any help you can give with the best way to visualize this data would be greatly appreciated. 

https://preview.redd.it/xzyezdga84c11.png?width=800&format=png&auto=webp&s=b076a47952eb1a255f7f4b28f7746406bfee7d6c",1,1,cole_cash,2018-07-25 15:50:10,https://www.reddit.com/r/dataviz/comments/91t0a4/need_help_finding_the_right_visualization_in/,0,dataviz
8qbo0o,Advice on visualizing a currently very busy scatter plot,"[Plot in question](https://imgur.com/YqFH7LO)

I'm trying to put together some visualizations as I tie up a project and have hit this wall. I have 5 groups of simulated data of different identities (groups 1, 3 and 5 are mostly around the origin). I then also have a set of non-simulated data (in black) (labels all changed here to try to make explaining it easier).

In short, I'm trying to demonstrate that ""value 1"" and ""value 2"" can be used to select points in the real data that are most likely to be in the simulated population 2 group. As a result, I need to simultaneously show where the simulated populations and real data fall. The simulated groups are too sparse to get decent looking 2d histograms or contours out of (and simulating enough to fill them out would take months). If I put the real data on top, the clumping near the origin makes it difficult to see where the approximate boundaries of the different groups are, so the current version has the simulated data on top of the real data with very low opacity. 

It works **okay** as is, but I've had to keep the points quite small, and it's still trickier to read than I'd like. I'm wondering if someone here might have any ideas about how to present this better.

Thanks much!",1,2,jaded_fable,2018-06-11 18:21:35,https://www.reddit.com/r/dataviz/comments/8qbo0o/advice_on_visualizing_a_currently_very_busy/,0,dataviz
8p3oef,Bubble Charts: Are Square plots more effective?,"It's harder to tell the actual boundaries of a circle than it is with a square. For example, if I showed you a square and circle side by side, it would he harder to tell if they have the same width/height. That is, if the values on the X or Y axes help you determine the relative size of each plot, wouldn't having the plots be square be more effective than dots?   

At a glance, circles are effective because you can compare them, but when you want to measure the size of them individually and use the values on the axes to do so, it seems that squares can help you define those boundaries more easily, no?   


Also posted in /visualization",1,0,NullOfficer,2018-06-06 19:40:27,https://www.reddit.com/r/dataviz/comments/8p3oef/bubble_charts_are_square_plots_more_effective/,0,dataviz
8o72vj,Anyone like Nepusz Tamas in the world? he made this,,1,2,Burning_Pikachu,2018-06-03 07:38:02,https://i.redd.it/cxhnyqz3pq111.png,0,dataviz
8gokso,Visualizing 200K Moving Job Requests on Thumbtack in R,"Data viz showing how people have been moving across the US based on Thumbtack data. Made by the data science team at Thumbtack.

Originally from:

[https://www.thumbtack.com/engineering/visualizing\-200k\-movers/](https://www.thumbtack.com/engineering/visualizing-200k-movers/)

https://preview.redd.it/51c6mwyablv01.png?width=2000&format=png&auto=webp&s=1773d533f0c9be3caa917228a2041b46de1d3681",1,3,happy_pandaz,2018-05-03 07:23:34,https://www.reddit.com/r/dataviz/comments/8gokso/visualizing_200k_moving_job_requests_on_thumbtack/,0,dataviz
8f6tgk,International Chart Day,Check out our video for International Chart Day: [https://www.youtube.com/watch?v=msINhEwLWIM&t=544s](https://www.youtube.com/watch?v=msINhEwLWIM&t=544s) ,1,0,Paluko,2018-04-26 22:36:30,https://www.reddit.com/r/dataviz/comments/8f6tgk/international_chart_day/,0,dataviz
8bfvf0,Help needed - visualization of USA mother's day spending habits per state,"Hey! :) Currently trying to get my head around where to find updated data for this awesome graph from 2007 - 2017:

https://public.tableau.com/shared/99GTRRSB3?:display_count=yes 

I'd love any pointers :) google trends is giving me nuttin.",1,1,turnerturnerturnerm,2018-04-11 09:56:31,https://www.reddit.com/r/dataviz/comments/8bfvf0/help_needed_visualization_of_usa_mothers_day/,0,dataviz
87w3pk,Need help with interactive legend for sunburst chart (D3.js v4),"Hello, need help to redraw sunburst after categories in legends are disabled

So far, the sunburst chart can
- zoom in when a section is clicked
- zoom out when the center is clicked
- display total when sunburst redraws on zoom
- displays interactive legend
- colored squares toggle when categories are unchecked
- display new total when categories are unchecked

Issue
- Not sure how to go about redrawing the sunburst to exclude categories that were unchecked by the user

Code:
https://codepen.io/lisaofalltrades/pen/rJYNRv",1,0,lisaofalltrades_,2018-03-28 22:16:46,https://www.reddit.com/r/dataviz/comments/87w3pk/need_help_with_interactive_legend_for_sunburst/,0,dataviz
86nzau,[Help Wanted] Awesome RShiny list - 2018 update.,,1,0,datasnakes,2018-03-23 20:44:34,https://www.reddit.com/r/Rlanguage/comments/86nd3w/help_wanted_awesome_rshiny_list_2018_update/,0,dataviz
85n00h,tutorial for making multipanel plots using QTGrace free plotting software,,1,0,sp8rks,2018-03-19 20:58:07,https://www.youtube.com/watch?v=6YxHb81vrqg&t=159s,0,dataviz
84e70n,[Free Ebook] Presenting Data People Can't Ignore,,1,0,HorsePower88,2018-03-14 15:22:28,https://infogram.com/blog/hubspot-ebook-presenting-data-people-cant-ignore/?utm_source=Quora&utm_campaign=HS%20Ebook,0,dataviz
7vvycf,Spotify music attributes,"Dear Redditers,

We are looking for participants for an online experiment with the Spotify recommender system. The purpose of the experiment is to allow users to easily interact with the Spotify algorithm and to better personalise the recommendations generated by Spotify. If you use Spotify and can spare 10 minutes to participate, we would really appreciated it: http://augment-hci-spotify.eu-4.evennode.com",1,0,AugmentHCI,2018-02-07 13:07:01,https://www.reddit.com/r/dataviz/comments/7vvycf/spotify_music_attributes/,0,dataviz
7uf35s,Platforms to present html widgets?,"There are great ways to visualize data using html, Java etc, however presentation platforms like powerpoint, keynotes, prezi, google slides doesnt support them. 

Are there any platform which can support html widgets?

I know R markdown supports it but I was looking for something that doesnt requires coding. Thanks!",1,0,K4k4shi,2018-02-01 01:26:00,https://www.reddit.com/r/dataviz/comments/7uf35s/platforms_to_present_html_widgets/,0,dataviz
7uakaf,Visualization tool for highlighting and comments,"Hello redditers! I am looking for a particular visualization tool: one that allows you to publish small chunks of text that can be highlighted, and upon clicking on the highlighted phrase a bubble or window with a comment would pop up. What I want to do is publish certain chunks of texts from the bill of rights, with commentary from some important academics. 

Any thoughts?
",1,0,pomegranatesauce,2018-01-31 15:15:27,https://www.reddit.com/r/dataviz/comments/7uakaf/visualization_tool_for_highlighting_and_comments/,0,dataviz
7tw4j5,Help visualizing complex nested data,"I'm trying to understand what sort of visualizations best fit some complex nested data that I'm working with.

The data is a categorized list, which is nested three deep, as an example: ""Broad Area - Narrow Area - Specific Focus"". There are 11 Broad, 45 narrow, and approximately 80 specific focus areas. Additionally, each specific focus area has a current state with 4 potential states, as well as two indicators with low-medium-high values. 

I've worked on a few options, but I either end up with a cluttered mess because of the sheer amount of nesting, or I'm missing data points. I've used size and color for the low-medium-high representations, put the states into rings, sliced up pie areas for broad focus,etc, but that just doesn't seem to work. 

Any examples of similar types of data structures, or am I trying to ask one visualization to do too much work? ",1,0,Jishosan,2018-01-29 22:23:17,https://www.reddit.com/r/dataviz/comments/7tw4j5/help_visualizing_complex_nested_data/,0,dataviz
7thxc5,Any recommendations for good data visualization tool?,"How to make the bar chart more attractive, replace the bar with icons? Any data visualization tool for that? Thank you. ",1,2,Buscando2016,2018-01-28 03:47:31,https://www.reddit.com/r/dataviz/comments/7thxc5/any_recommendations_for_good_data_visualization/,0,dataviz
7dwbvs,[OC] - Some design concepts in D3 - feedback welcome!,,1,0,Mao_De_Tesouro,2017-11-18 22:37:40,http://nickm.io,0,dataviz
71l1dn,Best graph type for showing two data variables per class?,"I work at a car dealership, and I've been asked to look into how many Vehicle Service Contracts we're selling based on the type of purchase (lease, finance, cash purchase). I'd like to show both:

1) What percentage of each purchase type also bought a VSC, 

and 2) what percentage of our overall portfolio each purchase type  makes up. 

In other words, if we're selling 100% of our lease customers VSCs but leases only make up 2% of our overall sales portfolio, we need to weight our performance their accordingly. Is there a way to do this visually? Maybe a bar graph that displays information in both height and depth? Does anyone have any suggestions?",1,7,ProLicks,2017-09-21 18:12:00,https://www.reddit.com/r/dataviz/comments/71l1dn/best_graph_type_for_showing_two_data_variables/,0,dataviz
7086ag,python split up tuple to render on histogram,,1,0,s-matthew-english,2017-09-15 06:42:25,https://stackoverflow.com/questions/46233120/python-split-up-tuple-to-render-on-histogram,0,dataviz
6y21uc,How to Spot Visualization Lies,,1,0,psangrene,2017-09-04 18:11:45,http://www.datasciencecentral.com/profiles/blogs/how-to-spot-visualization-lies-1,0,dataviz
6uheqx,100 Useful Tags to Deploy in an E-Commerce Site,,1,0,softcrylic_1,2017-08-18 12:13:24,http://www.softcrylic.com/blogs/100-useful-tags-deploy-e-commerce-site/?utm_source=Reddit&utm_campaign=Tag Management - Infographic&utm_medium=link,0,dataviz
6tqxfm,How to create custom Sankey diagrams using R,,1,0,scottauds,2017-08-15 01:07:06,https://www.displayr.com/sankey-diagrams-r/?utm_source=Reddit&utm_medium=Dataviz&utm_campaign=sankey%20diagram%20in%20r,0,dataviz
6s96c6,Even tables can be made to look better - communicating statistical significance,,1,0,scottauds,2017-08-07 22:31:06,https://www.displayr.com/the-magic-trick-that-highlights-significant-results-on-any-table/?utm_source=reddit&utm_medium=dataviz&utm_campaign=Trick%20that%20Highlights%20Results%20on%20Table,0,dataviz
6ku7pd,Any good datasets about the American Revolution?,"With July 4 around the corner, I'm looking for a good dataset about the Revolutionary War to play around with. Would anyone have some suggestions of publicly available datasets?",1,0,CowCookie,2017-07-02 16:47:04,https://www.reddit.com/r/dataviz/comments/6ku7pd/any_good_datasets_about_the_american_revolution/,0,dataviz
6iu2vb,Best BI tools for combo charts?,"I have an analytics application which currently lives in Excel. One of the charts I made in Excel is a stacked column + scatter combo. Sounds dumb, but for the purposes of the visualisation it is perfect.

We are replatforming the application into something more robust, and we have everything nailed down with the exception of our reporting layer.

Already having a license for Power BI I started playing with that. And for the majority of the work it was perfect. I would be able to create charts with dynamic metadata and publish them to the web. Ideal.

However when I came to this stacked column + scatter combo, there is no such visualisation in Power BI. Nor does it exist as a custom visualisation that I can find. 

I'm looking into the possibility of finding a contractor who will build this custom visualisation for Power BI -- however what would really be nice is if I could just get an off-the-shelf package, similar to Power BI, which allows creation of such combos out of the box (like Excel does!).

I'm a tad overwhelmed by the sheer number of solutions out there, so I'm just wondering if anyone has any hints as to where I should start.

Thanks in advance.",1,0,the1ine,2017-06-22 15:07:35,https://www.reddit.com/r/dataviz/comments/6iu2vb/best_bi_tools_for_combo_charts/,0,dataviz
6ir2h2,Are Congressional swings correlated with the occurrence of a census in the US?,,1,1,cruyff8,2017-06-22 03:52:48,http://i.imgur.com/4wbWNi3.png,0,dataviz
6f5jjt,Feedback please for my data visualization platform,"I built [vizfiddle](https://vizfiddle.com) to make it easy for people to embed simple data that can turn into simple visualizations.

I would be grateful if I can get some feedback for my little tool :)

Some specific inquiries are:

- Does the app even make sense at a glance?
- Can you see some uses yourself?
- Do you have general feedback for the tool?",1,3,kingoftheapes,2017-06-04 04:18:25,https://www.reddit.com/r/dataviz/comments/6f5jjt/feedback_please_for_my_data_visualization_platform/,0,dataviz
6f0os6,"Has anyone made something which does this? Or interested in helping make it? Visualising the spread of misinformation vs the spread of the fact checking response, plus their interaction.",,1,0,Aegist,2017-06-03 11:14:44,https://medium.com/@Aegist/visualising-the-spread-of-fake-news-over-time-and-the-fact-checking-response-to-it-5be9b21ecf4c,0,dataviz
6aobcf,Hong Kong Typhoons Data Visualization,,1,0,dennyshess,2017-05-12 01:09:41,http://neonite.hk/hktyphoons,0,dataviz
6akqj1,What I Learned Recreating One Chart Using 24 Tools,,1,0,BioGeek,2017-05-11 15:14:42,https://source.opennews.org/articles/what-i-learned-recreating-one-chart-using-24-tools/,0,dataviz
