id,title,selftext,score,num_comments,author,created_utc,url,gilded,subreddit
6u27yu,The Technology Powering the Impact Investing Network Map,,2,0,johnjones4,2017-08-16 14:02:01,https://casefoundation.org/blog/the-technology-powering-the-impact-investing-network-map/,0,dataviz
6ts6f2,Any recommendations on the easiest way to get historical weather data?,"I've been collecting some data from a thermometer in my house, and I'd like to see how that compares minute by minute (or at least hour by hour) how that compares with the outside temperature. Is there a dead simple site where I could type in a zip code and date range, and export that level of weather data? Not just Hi, Average, Low, but a minute by minute / hour by hour table.",2,2,UrbanLumberjack85,2017-08-15 05:12:46,https://www.reddit.com/r/dataviz/comments/6ts6f2/any_recommendations_on_the_easiest_way_to_get/,0,dataviz
6ol140,"We analyzed data from 17,459 startup fundings across the U.S. and what we found might surprise you. Startup Funding Trends: A Visual Data Story",,2,0,TomCasano,2017-07-21 02:12:10,https://www.fundz.net/startup-funding,0,dataviz
6jt44h,Compare the Best Javascript Chart Libraries of 2017,,2,1,adilbaaj,2017-06-27 14:41:49,https://blog.sicara.com/compare-best-javascript-chart-libraries-2017-89fbe8cb112d,0,dataviz
6g0dbl,Fantasy DataViz - ideas on unique visualizations,,2,2,bishopZ,2017-06-08 11:31:25,https://bishopz.carbonmade.com/projects/6496124,0,dataviz
6f9zz2,Inside the TOP 1000 tags on Medium.com — Part 1 [OC],,2,0,baditaflorin,2017-06-04 21:43:03,https://medium.com/@baditaflorin/inside-the-top-1000-tags-on-medium-com-part-1-a1ff96356639,0,dataviz
6apnjz,Mobile 'Adaptive' Data Viz,,2,0,treytrey22,2017-05-12 06:17:00,https://groups.google.com/forum/#!topic/d3-js/SRTJgXW3Jqc,0,dataviz
66np0x,Data Visualization Book Giveaway,,2,0,ped46,2017-04-21 07:13:08,https://infogr.am/blog/data-visualization-books/,0,dataviz
5ys8bk,Free alternatives to kumu.io? x-post /r/infographic,"Hello all,

I'm looking for a free private/desktop alternative to (freemium) [Kumu.io](https://kumu.io/).

I just found Kumu, and love the premise, but I'd like something more private - Kumu offers unlimited *public* projects for free accounts.

Any suggestions?",2,1,5-Whys,2017-03-11 11:21:14,https://www.reddit.com/r/dataviz/comments/5ys8bk/free_alternatives_to_kumuio_xpost_rinfographic/,0,dataviz
5wjk3p,"Continuously Encrypt Amazon Redshift Loads with S3, KMS, and Lambda",,2,2,Everything_Cyber,2017-02-27 21:30:12,http://panoply.io/blog/continuously-encrypt-amazon-redshift-loads-with-s3-kms-and-lambda/,0,dataviz
5igiif,Create interactive dashboards in Python with Bowtie,"[Bowtie](https://github.com/jwkvam/bowtie) enables you to easily create interactive dashboards. There's an example project [here](https://github.com/jwkvam/bowtie-demo) that's been deployed to [heroku](https://bowtie-demo.herokuapp.com). It's on a free tier so it may take a minute or two to wake up if it's asleep.

If you try using I would be interested in hearing what you think. You can use the [docs](https://bowtie-py.readthedocs.io/en/latest/index.html) to get started.",2,0,qacek,2016-12-15 08:49:52,https://www.reddit.com/r/dataviz/comments/5igiif/create_interactive_dashboards_in_python_with/,0,dataviz
5guu2n,Awesome in-app dashboards (and how to make yours awesome too),,2,1,rotzak,2016-12-06 19:21:52,https://reflect.io/blog/awesome-dashboards/,0,dataviz
50adhz,We analyzed the dialects of 670'000 German-Speaking users and mapped them,,2,0,wnstnsmth,2016-08-30 10:08:22,http://www.srf.ch/news/schweiz/tschutten-kicken-oder-bolzen-die-grosse-dialektkarte,0,dataviz
4ewnz7,What language were these visualisations made in?,,2,4,regis_regum,2016-04-15 13:17:45,http://www.nytimes.com/interactive/2015/03/19/upshot/3d-yield-curve-economic-growth.html?_r=2,0,dataviz
4cwuoo,"#rstats + #cats = #CatterPlots, new visualization system for complex data",,2,0,davebot1,2016-04-01 17:29:12,https://github.com/Gibbsdavidl/CatterPlots,0,dataviz
4af34w,"""I Can't Believe It's Not A Pie Chart"" — a journey to an alternative",,2,0,adennsi4,2016-03-14 21:01:12,https://medium.com/@alexquach/to-pie-charts-3b1f57bcb34a,0,dataviz
44mly9,(Question) How to make an Info-GIF,"Hello everyone,

I am currently researching a question within the realm of data visualization and web design and was hoping someone here might be able to point me in the right direction.

What I am looking for is an elegant way to create GIFs with animated charts and maps in them, something like this:
http://giphy.com/gifs/white-2016-3o6UBm0gM2w8m7iBSU

Any ideas, links, tips on software and workflow would be greatly appreciated.",2,0,vortexsutra,2016-02-07 17:44:31,https://www.reddit.com/r/dataviz/comments/44mly9/question_how_to_make_an_infogif/,0,dataviz
43cofd,Interactive Website Log Analysis & Data Visualization with Jupyter Notebook & Python Spark (PySpark) on Apache Spark,,2,0,juvchan,2016-01-30 04:40:50,https://channel9.msdn.com/Events/APAC-Influencer-Hero-2015/Malaysia-Influencer-Showcase/02-Juv-Chan-Interactive-IIS-Log-Analysis-with-Azure-HDInsight-Spark-Linux,0,dataviz
3zeu4o,"New R package for extracting the dominant colors from images, RImagePalette","I've just released a new package to CRAN, RImagePalette, which uses the median cut algorithm to extract the dominant colors from images. With this package you can use images as ggplot scales!

Take a look on github: https://github.com/joelcarlson/RImagePalette

or on CRAN: https://cran.rstudio.com/web/packages/RImagePalette/

Let me know what you think! Feedback and contributions always welcome :)",2,0,Clampurloiner,2016-01-04 13:49:30,https://www.reddit.com/r/dataviz/comments/3zeu4o/new_r_package_for_extracting_the_dominant_colors/,0,dataviz
3v0dtw,The Global Extremes of Population Density,,2,0,papereraser,2015-12-01 15:59:56,http://metrocosm.com/the-global-extremes-of-population-density/,0,dataviz
3rt6wp,What's a good portfolio option for a data viz designer/web developer?,"Hello

I want to design a portfolio for my work, which includes data visualizations, interactive charts/maps, static works and some web development.

I have used Wordpress but want a theme that extends more flexibility for interactive works. With wordpress, a portfolio link generally takes one to a page with a gallery and some static content; I want to be able to have portfolio links that lead to full-page interactive sites.

Any ideas for data viz portfolio sites is greatly appreciated. I have considered developing my own in Laravel or similar PHP framework, but Wordpress might be more practical for what I'm doing",2,0,DeepClearEyes,2015-11-06 21:00:43,https://www.reddit.com/r/dataviz/comments/3rt6wp/whats_a_good_portfolio_option_for_a_data_viz/,0,dataviz
3rnq76,BitTorrent's New Browser Is Also A Data Viz,,2,0,shugert,2015-11-05 18:24:55,http://www.fastcodesign.com/3052967/bittorrents-new-browser-is-also-a-data-viz,0,dataviz
3rgc2e,"Actually, Marty didn’t go Back To The Future: Graphing the train sequence of BTTF3",,2,1,ddcarnage,2015-11-04 04:43:50,http://blog.francoismaillet.com/marty-didnt-go-back-to-the-future,0,dataviz
3rciji,Does anybody here do sales calls? What in your opinion are the most important data visualizations you would want displayed on your mobile device before you attend a sales call?,,2,4,jingjangjones,2015-11-03 13:00:31,https://www.reddit.com/r/dataviz/comments/3rciji/does_anybody_here_do_sales_calls_what_in_your/,0,dataviz
3pwvc4,Unified Interface to ggplot2 Popular R packages in One Line,,2,0,terrytangyuan,2015-10-23 14:49:30,https://github.com/sinhrks/ggfortify,0,dataviz
3j3fit,Comparing UN climate talks to middle school cliques,,2,0,Celia_LJ,2015-08-31 15:26:10,http://www.npr.org/2015/08/31/434599379/how-are-u-n-climate-talks-like-a-middle-school-cliques-rule?utm_source=twitter.com&utm_medium=social&utm_campaign=movies&utm_term=artsculture&utm_content=20150831,0,dataviz
3gg8k4,11 Awesome Data Visualizations Way Ahead of Their Time [Infographic],,2,0,digitaltothem,2015-08-10 10:49:52,http://www.investintech.com/resources/blog/archives/5692-data-visualizations-infographic.html,0,dataviz
3bpn2l,Kentucky's Gay Marriage Denial by Zip Code (Updated 6-30-2015),,2,0,Inform8n,2015-07-01 03:29:06,http://bourbonandbrains.blogspot.com/2015/06/kentuckys-gay-marriage-denial-by-zip.html,0,dataviz
3ayj03,Nice animated line chart showing annual temperature trends since the 1880s,,2,1,hofo,2015-06-24 15:07:09,http://www.bloomberg.com/news/features/2015-06-18/this-year-is-headed-for-the-hottest-on-record-by-a-long-shot,0,dataviz
37vxq1,My first attempt at adding simple visualizations to my blog,,2,1,ryno2019,2015-05-30 21:11:41,http://ryanbrink.com/visualizing-productivity-with-elasticsearch-logstash-and-d3/,0,dataviz
34ioot,How much does each parliamentary seat cost?,,2,0,jmethvin88,2015-05-01 14:11:13,http://blog.import.io/post/how-much-does-a-uk-parliamentary-seat-cost,0,dataviz
2ldpq6,[Question]: Building Interactive stories using Data Visualization ?,"I am trying to build an interactive data visualization page to make a story more interactive (I integrate videos/Picture ..). Imagine it as a plain text that I would transform to interactive story for kids.

I found: 
- http://storymap.knightlab.com/
- http://timeline.knightlab.com/

But it seems that I can't show a lot of text. Do you recommend any JS Frameworks to use, or examples to check (for inspiration) ?
",2,1,LearningDjango,2014-11-05 16:52:09,https://www.reddit.com/r/dataviz/comments/2ldpq6/question_building_interactive_stories_using_data/,0,dataviz
1wkg8x,Visualizing Enron Emails In Order To Detect Fraud,,2,0,tjlaher,2014-01-30 16:59:09,http://www.ayasdi.com/blog/topology/the-shape-of-enron,0,dataviz
1nof2q,Why rainbow colors aren’t the best option for data visualizations,,2,0,seabass,2013-10-03 20:26:02,http://www.poynter.org/uncategorized/224413/why-rainbow-colors-arent-always-the-best-options-for-data-visualizations/,0,dataviz
1ln82d,"WTF dataviz (or your ""won't"" source of inspiration)",,2,0,None,2013-09-03 14:34:11,http://wtfviz.net,0,dataviz
1ku6jr,"Steve Wexler, Data Revelations, Tableau, and How Best to Visualize Likert Scale Data",,2,0,dataarchaeology,2013-08-21 23:26:57,http://datavizblog.com/2013/08/21/steve-wexler-data-revelations-tableau-and-how-best-to-visualize-likert-scale-data/,0,dataviz
1k5aem,Drawing the world by hand. A lesson from hand-drawn maps,,2,0,danielpradilla,2013-08-11 15:16:35,http://www.danielpradilla.info/blog/en/drawing-the-world-by-hand/,0,dataviz
1geerr,Infographic: Medical Alphabet,,2,0,dataarchaeology,2013-06-15 14:16:04,http://datavizblog.com/2013/06/15/infographic-medical-alphabet/,0,dataviz
14oi4a,Visualizing the Heartbeat of Twilio: a data visualization of our calls,,2,0,ninamehta,2012-12-11 19:45:04,http://www.twilio.com/engineering/2012/12/11/visualizing-the-heartbeat-of-twilio,0,dataviz
goe0k,Bookmarklet to visualize the reblog graph topology of any post with notes on your tumblr dashboard.,,2,0,warfangle,2011-04-12 18:10:29,http://revisualizer.com,0,dataviz
g597y,Realtime view of Boston.com readership (Boston Hack Day winner),,2,0,apb409,2011-03-16 16:56:39,http://www.bignewsboston.com/news,0,dataviz
ck82p,website sitemap using gexf4j and gephi,,2,0,bufuscout,2010-06-29 17:31:27,http://jmcampanini.posterous.com/21456799,0,dataviz
7z5um,NYT Visualization Lab,,2,0,neilplatform1,2009-02-21 12:14:03,http://vizlab.nytimes.com/visualizations,0,dataviz
7omh3,Info-Graphics are Welcome at the Avant Garde Subreddit.,,2,0,None,2009-01-09 20:44:06,http://www.reddit.com/r/AVANT_GARDE/,0,dataviz
1bwdui3,"Waffen, Kredite, Hilfsgüter: Welche Länder unterstützen die Ukraine bisher am meisten?",,1,0,helena_kolumna,2024-04-05 09:35:18,https://interaktiv.tagesspiegel.de/lab/waffen-kredite-hilfsgueter-welche-laender-unterstuetzen-die-ukraine-bisher-am-meisten/,0,dataviz
1bikj9y,Color Psychology in Data: The Role of Color in Data Visualization,,1,0,Emily-joe,2024-03-19 13:40:53,https://www.dasca.org/world-of-big-data/article/color-psychology-in-data-the-role-of-color-in-data-visualization,0,dataviz
191295p,📢 First graph of the year.," 🌬   🔌 Evolution of wind energy production in Spain between 2012 and 2022.

{ggplot2}

&#x200B;

[Production of gigawatt-hours \(GWh\) of wind energy by Autonomous Community in Spain. Comparison 2012-2022.](https://preview.redd.it/ac5ssvayz2bc1.png?width=3543&format=png&auto=webp&s=4234231bf364d9683f4a6109cd38e6406c7c677b)

 \#rstats #dataviz #week1 #datavizweek1 #ggplot2 #renewables #windpower ",1,0,miki_peltzer,2024-01-07 20:54:55,https://www.reddit.com/r/dataviz/comments/191295p/first_graph_of_the_year/,0,dataviz
18bbzwf,I am building a tool to automate data cleaning and consolidation (Feedback please),"Hi Redditors,

I built a tool that allows you to standardize manually entered data using generative AI. So all similar phrases are automatically harmonized, enabling you to run improved data analytics.

[https://www.dataharmonizer.com/](https://www.dataharmonizer.com/)

\> Correct for inconsistencies in spelling (Coop vs co-op)

\> Harmonize shortcuts (Limited vs Ltd.)

\> Correct for spelling mistakes (serbices vs services)

This is how the tool works:

* You can upload a CSV file and specify which row to extract and harmonize.
* The model automatically consolidates data by combining similar-looking phrases.
* You can edit the proposed phrase names or further consolidate entries if there are some groups the model has missed.
* In the end, you can download your CSV file again.

I would highly appreciate feedback from the community on what I can improve! I really appreciate any help you can provide.",1,0,Apprehensive_Cut9179,2023-12-05 13:30:36,https://www.reddit.com/r/dataviz/comments/18bbzwf/i_am_building_a_tool_to_automate_data_cleaning/,0,dataviz
174t4cz,automagic joins between tables and views with magic model,,1,0,zingdata,2023-10-10 19:01:44,https://v.redd.it/u921e8ylaftb1,0,dataviz
16snmr5,Best Open Source / Free tool for Dynamic map representation in-web?,"I need a software to visualize a map that can be interactive (click so that then additional data are shown), with a representation that allows ""dot size"" on the map to be proportional to a given ""number of events"", and that can be inserted in a website. If the data can even be modified dynamically, that would be a plus.

Are in your opinion any out of Tableau, Datawrapper or Flourish appropriate/powerful enough? Or, more to the point, in your experience, what are the best tools that could fit this particular task=",1,2,karel_data,2023-09-26 13:13:04,https://www.reddit.com/r/dataviz/comments/16snmr5/best_open_source_free_tool_for_dynamic_map/,0,dataviz
16m1891,Bar Chart Races in Flourish - Time data?,"Hey,
Does anyone know how to create a bar chart race in Flourish that can display times instead of numbers? I want to make a speedrunning video.",1,0,ESOrSomething,2023-09-18 17:11:16,https://www.reddit.com/r/dataviz/comments/16m1891/bar_chart_races_in_flourish_time_data/,0,dataviz
15yh7zx,Display Altair chart definitions in Streamlit,"This is a [cool post](https://blog.streamlit.io/drill-downs-and-filtering-with-streamlit-and-altair/) from Carlos D Serrano that shows how to create interactive and dynamic visualizations using Altair in Streamlit.

https://preview.redd.it/fn4zmr79zpjb1.png?width=3456&format=png&auto=webp&s=9cea1f8b7ffe1569228f1bac1c9026437f9f858f",1,0,JessSm3,2023-08-22 20:15:55,https://www.reddit.com/r/dataviz/comments/15yh7zx/display_altair_chart_definitions_in_streamlit/,0,dataviz
14lwbua,Financial Data Management with No-Code Tools - Guide,"Data governance plays a pivotal role in financial data management. It  is about establishing clear rules and processes for data handling within an organization - defines who can take what action, upon which data, in what situations, using what methods. Essentially, it's about having the right procedures in place to ensure data accuracy, security, and legal compliance: [Mastering Financial Data Management: A Complete Guide - Blaze.Tech](https://www.blaze.tech/post/mastering-financial-data-management-a-complete-guide)",1,0,thumbsdrivesmecrazy,2023-06-29 05:36:00,https://www.reddit.com/r/dataviz/comments/14lwbua/financial_data_management_with_nocode_tools_guide/,0,dataviz
14l349b,I am a UX designer I want to pursue a career in data viz. Any suggestions on how to approach it? I also have a little bit of engineering background but nothing too extensive.,Right now I am not sure what I want to do and I am having a hard time accepting UX as my career from the past few months. ,1,1,shilpa1995,2023-06-28 07:49:14,https://www.reddit.com/r/dataviz/comments/14l349b/i_am_a_ux_designer_i_want_to_pursue_a_career_in/,0,dataviz
13jgbv2,Help with Sankey,"I'm using the networkD3 package in R to make a Sankey diagram - trying to show continuity across 3 timepoints.  How can I get these bands to align? I want to show them passing through the middle nodes, but staying together if that makes sense.

https://preview.redd.it/4q3ccdub790b1.jpg?width=1596&format=pjpg&auto=webp&s=68b4e9e72228edb8858879eb8acd46912dacaf12",1,0,TFly3,2023-05-16 20:31:09,https://www.reddit.com/r/dataviz/comments/13jgbv2/help_with_sankey/,0,dataviz
12hxi7z,Survey on Accessibility Challenges Faced by Visualization Creators,"Hello everyone! For my dissertation work, I am conducting a survey to study the challenges and barriers that visualization creators face in making online data visualizations accessible to blind and low-vision users. If you are someone who creates online data visualizations (for work, research, or even just for fun), please consider filling out this survey:

[https://tinyurl.com/a11y-challenges-dataviz](https://tinyurl.com/a11y-challenges-dataviz) 

It should only take about 10 minutes of your time. I would really appreciate your participation!  (You can find more information on our projects on making online data visualizations here: [https://athersharif.me/projects/VOX.)](https://athersharif.me/projects/VOX.))",1,1,AssociationInitial10,2023-04-10 21:48:11,https://www.reddit.com/r/dataviz/comments/12hxi7z/survey_on_accessibility_challenges_faced_by/,0,dataviz
12di25r,Unlock the Power of Data Visualization and Storytelling - A Guide for Data Scientists,,1,0,Emily-joe,2023-04-06 12:01:55,https://techearths.com/unlock-the-power-of-data-visualization-and-storytelling-a-guide-for-data-scientists/,0,dataviz
10t08ie,How to identify time periods when one set of time series data has a peak at the same time as another set of simultanerous data is stable and has no peaks,"What is a calculation I can do to graph the times when one set of time series data (dataset 1) has peaks/spikes and another set of simultaneous data (dataset 2) is stable and has more of a plateau pattern and no spikes or peaks at that same time? I tried graphing the difference between the two datasets, but this didn't work because there would be a high difference when both datasets are peaking if one dataset had a higher peak than the other. I only want to see times where one dataset has a peak and the other dataset does not have a peak at all.",1,0,gogogadgad,2023-02-04 00:33:52,https://www.reddit.com/r/dataviz/comments/10t08ie/how_to_identify_time_periods_when_one_set_of_time/,0,dataviz
10s48jc,How would you improve this plot made with R?,,1,2,Feisty_Ice_4840,2023-02-02 23:18:52,https://i.redd.it/7j6c55o4zufa1.png,0,dataviz
z43wso,need some direction with chess info," 

i am trying to create a Data visualization about chess openings.

i have record of 14k (2000+ elo) matches and the openings they used (2019)

link to the info - [https://docs.google.com/spreadsheets/d/1zh3oeq4djqF2MmGIta9qx8ZmdlN90vGH83cxJfACiD0/edit?usp=sharing](https://docs.google.com/spreadsheets/d/1zh3oeq4djqF2MmGIta9qx8ZmdlN90vGH83cxJfACiD0/edit?usp=sharing)

what kind of interesting inference for a chess player can i derive from this?

i also have other info like - the moves they made, time taken, evaluation per move.

anything suggestions will be great.",1,0,jdjhinu,2022-11-25 04:31:59,https://www.reddit.com/r/dataviz/comments/z43wso/need_some_direction_with_chess_info/,0,dataviz
z2oxux,The color of 500k+ online news images visualized (PDF),,1,1,GertFranke,2022-11-23 13:19:23,https://colors.cleverfranke.com/CF-color-research.pdf,0,dataviz
yomxl2,"Visualization is most appealing to the human brain, and this is what makes data visualization a fundamental skill for a data science professional",,1,0,Emily-joe,2022-11-07 13:29:55,https://www.dasca.org/world-of-big-data/article/the-value-of-data-visualization-for-data-science-professionals,0,dataviz
xesnqr,Data visualisation on invoices,"Hello, I was wondering if someone could suggest me a good tool to visualise the below data, which would be stored in a spreadsheet
- seller company
- buyer company
- seller company ERP (operating system)
- invoice number
- invoice amount 

I would like to show circles representing the companies, they would be bigger/smaller based on count of invoices, closer/further to each other based on how many invoices go between them, and coloured based on operating system",1,1,AccomplishedSimple11,2022-09-15 09:54:24,https://www.reddit.com/r/dataviz/comments/xesnqr/data_visualisation_on_invoices/,0,dataviz
vndspy,"New LabPlot video tutorial: Learn how to generate and visualize random numbers in Uniform, Normal (Gaussian), Binomial, Poisson, Weibull (and more) distributions",,1,0,Bro666,2022-06-29 11:42:28,https://tube.kockatoo.org/w/vdSLX2dRBzqhrRRz48dPTw,0,dataviz
vjp4j1,Trying to synthesize a number of consumer trends. Best type of chart to use?,"Hi Data Geeks (this includes myself too),

I'm on an ad hoc data request and attempting to basically take a number of consumer data points on spending (think interest in booking hotels or flights, etc-pulling the interest from Google Trends), and then trying to synthesize everything together in Tableau to make some analysis on how consumer interest has been fairing for different services.

Now, lets say Im synthesizing interest for the top 10 hotels in the US....what would be the best to VISUALLY organize this data? I feel like I could use line charts, but after 10 of them-that obviously gets a bit messy to say the least. Would I use R clustering? (I dont think that would work here given that that many data points would aggregate together and not work with R clustering)? Would a scatterplot possibly make sense? 

Just trying to think of the best way to combine ALL the data points together essentially that still looks visually appeasing and NOT a huge mess.",1,0,WhatsTheAnswerDude,2022-06-24 14:00:12,https://www.reddit.com/r/dataviz/comments/vjp4j1/trying_to_synthesize_a_number_of_consumer_trends/,0,dataviz
u7wdzo,2D data animation software for creating video + infographics,"Hi all! I'm a science communication student and next summer I'll be working on my course final project. I'll be creating **videos with animated infographics** representing the relation between global warming and extreme rainfall, starting from an experimental dataset.

Can you recommend any **professional 2D animation software** to work with? **After effects** seems to be the one which suits my needs best. However, I understand that you can't pay for like just 3 months of use, and that you have to pay for the full 1 year package... And I'm not sure I want to invest so much at this stage!

Also, I'd rather not use coding... at least at this exploration stage! c:",1,3,myrtle_nymph,2022-04-20 13:21:14,https://www.reddit.com/r/dataviz/comments/u7wdzo/2d_data_animation_software_for_creating_video/,0,dataviz
u4ge0x,Subject area courses/outcome data viz,,1,0,Designer-Practice220,2022-04-15 19:58:11,/r/datavisualization/comments/u4gd4d/subject_area_coursesoutcome_data_viz/,0,dataviz
u3ytrw,"Needed: FAST (>10 fps, preferably ~25 fps) real time data visualization graphs and gauges, but graphically pleasing, like grafana, unlike matplotlib. Possible?",,1,0,oz1sej,2022-04-15 03:26:03,https://www.reddit.com/r/dataviz/comments/u3ytrw/needed_fast_10_fps_preferably_25_fps_real_time/,0,dataviz
qcwbz4,Building a dashboard with Google Charts: a step-by-step tutorial 📊📈,,1,0,igorlukanin,2021-10-21 17:01:54,https://cube.dev/blog/google-charts-dashboard/,0,dataviz
pwnete,Mitigating the risk of natural disasters with data,"Register: [https://omnisci.zoom.us/webinar/register/4916327675439/WN\_sNdDOxRnTYK8y-iWN10CHg](https://omnisci.zoom.us/webinar/register/4916327675439/WN_sNdDOxRnTYK8y-iWN10CHg)

Data science has been playing an increasingly important role in mitigating the risk of natural disasters, such as wildfires, and has enhanced our utilization of data and technology to protect our most vulnerable communities. Join OmniSci for a webinar on Wednesday (9/29)**,** [***Preventing the Next Paradise Disaster with Accelerated Analytics***](https://omnisci.zoom.us/webinar/register/9316303674574/WN_sNdDOxRnTYK8y-iWN10CHg), where we will explore how data science and analytics tools play a critical role in understanding factors contributing to wildfires, associated risks, and impacts on communities across the Western United States, Canada, and beyond.",1,0,OmniSci_,2021-09-27 18:35:01,https://www.reddit.com/r/dataviz/comments/pwnete/mitigating_the_risk_of_natural_disasters_with_data/,0,dataviz
